Name	title	coding
t3_k1dokd	Trump's inner circle is telling him that Giuliani and the rest of his legal team are making him look like an idiot, report says
t3_k16as8	Steve Schmidt: ‘We’ve entered the corrupt pardon phase of the Trump coup’
t3_k1fhlv	Mueller prosecutor says Trump should be investigated and face charges after leaving office
t3_k1cko2	Obama says lives could have been saved if Trump hadn't disbanded pandemic response unit
t3_k15yeb	‘Absolutely No Allegations of Any Fraud’: Pa. Court Rejects Trump Campaign’s Appeal Over 69 Mail-In Ballots
t3_k1g099	Pranksters have claimed a Trump 2024 campaign website domain which labels Trump a 'loser'
t3_k1dsa2	Donor Sues Pro-Trump Group for $2.5 Million for Failing to Prove Voter Fraud
t3_k1lnms	Trump Is About to Hand Over Sacred Apache Land to a Mining Company
t3_k17277	Giuliani thinks Trump ‘may have won Virginia’ despite Biden winning state by nearly half a million votes
t3_k1ezlz	Trump’s conspiracies have MAGA world talking Georgia boycott
t3_k1as4m	El Paso lawyered up to try and collect $570,000 owed to the city by the Trump campaign from a rally 2 years ago
t3_k1g08g	Ex-Trump lawyer Sidney Powell files typo-filled lawsuits in Michigan, Georgia
t3_k1in3b	Why Biden shouldn't extend an olive branch to Republicans
t3_k1en3v	Donald Trump Retweets Call to Pardon Himself
t3_k1ca3s	Trump urges Americans to ‘gather’ for Thanksgiving in direct contradiction of official Covid guidance
t3_k17xny	Pro-Trump Group Donor Sues Over Failure to Expose Election Fraud
t3_k1i58k	Why Biden Has It Harder Than FDR and Lincoln — They had big congressional majorities to pass the New Deal and fund the Union Army. Biden is the rare crisis president without the majorities he needs.
t3_k1ghc7	Donor sues pro-Trump group over failure to prove voter fraud: 'Empty promises'
t3_k1gtvp	Indian country showed up to beat Trump. How can you show up for Indian country?
t3_k1oj3g	Trump supporters reportedly calling for boycott of key Georgia Senate races
t3_k1hz0i	Shame the Random, Unknown Government Officials Aiding Trump’s Coup Attempt
t3_k1eqs1	Want to Be Like FDR, Joe Biden? Make Your Thanksgiving Proclamations Rallying Cries - The 32nd president used every tool—even Thanksgiving Proclamations—to promote a moral vision for social and economic justice. Biden should do the same.
t3_k18fep	'Wounded' Trump caves on Biden transition as allies abandon him
t3_k178xy	Over 30 Trump Campaign Lawsuits Have Failed. Some Rulings Are Scathing. As President Trump continues to litigate the 2020 election, some judges have lost all patience. Here are some excerpts of their rulings.
t3_k1at5v	Representatives for 'Tiger King's' Joe Exotic are said to be chasing Trump down for a pardon and spending thousands of dollars to get it
t3_k1k1dk	Ex-GOP Pennsylvania governor condemns Trump's Gettysburg meeting as attempt "to undermine the republic"
t3_k1p866	Trump says he will leave the White House if Electoral College votes for Biden
t3_k1fr77	Trump’s Last Act: Risking National Security to Honor the Confederacy. He promises to veto the Defense Appropriations Authorization Act if it forces to Pentagon to change the names of bases and ships.
t3_k1e6ky	Obama says Republicans won votes for Trump by wrongly framing white men as victims
t3_k1f7lj	Joe and Jill Biden in Thanksgiving op-ed: 'We can be apart without being alone'
t3_k1cwkm	Donald Trump Is the Ultimate Super-Spreader | Trump didn’t merely bungle this country’s pandemic response; he stoked the flames of this third and largest surge.
t3_k1h7nv	Get ready for Donald Trump’s shadow government — via Twitter and Fox News: Other Republicans, in fear of the wrath of Trump’s supporters, will obstruct Joe Biden at every turn.
t3_k1gz8z	Trump’s Thanksgiving Message Urges People To ‘Gather,’ Despite Raging Pandemic
t3_k169vg	Donald Trump Shares Deep State Conspiracy Article That Says 'We Are at War'
t3_k1jggr	Leading House Dems Demand 'Full Accounting' on Trump Order Allowing Purge of Federal Workforce
t3_k1o6m0	Comedians Buy Trump 2024 Website Domain to Call President a 'Loser'
t3_k1fxbr	Trump shares tweet saying he should pardon himself, rest of his admin
t3_k1hyjh	Biden takes his cue from Muhammad Ali as he copes with a dope — As Ali did with Foreman, Biden has let his rival punch himself out.
t3_k1mhcs	Trump retweets post from GOP ally Matt Gaetz suggesting the president pardon himself and whole administration
t3_k1mlgj	Midnight Ruling Exposes Rifts at a Supreme Court Transformed by Trump
t3_k1exsn	Obama says Republicans portrayed white men as ‘victims’ to win votes for Trump
t3_k1j285	Biden Urged to 'Honor Indigenous Sovereignty and Immediately Halt' Fossil Fuel Pipelines
t3_k1i6ol	Investor Sues to Get His $2.5 Million Back After Supporting True the Vote’s Flailing Pro-Trump Election Suits.
t3_k17k4y	Trump wages war on our country and the rule of law one last time
t3_k1e7r8	Trump retweets congressman urging him to pardon himself
t3_k1m30w	Some Trump voters still believe he can retain the presidency
t3_k1i78k	PA Lt. Governor to Trump lawyer Giuliani: Where's the voter fraud? | Rudy Giuliani and Donald Trump are still attacking Pennsylvania's election results. The commonwealth's Lt. Governor John Fetterman says the evidence for that fraud simply does not exist.
t3_k1fqxm	Biden predicted a GOP 'epiphany' after the election. Trump's standing in the way.
t3_k19487	Over phone, Trump tells Pennsylvania hearing U.S. election must be ‘turned around’
t3_k17yc5	Biden Urged to 'Honor Indigenous Sovereignty and Immediately Halt' Fossil Fuel Pipelines
t3_k1guvu	Bidens Highlight 'Sacrifice' of Staying Home for Thanksgiving While Trump Urges Americans to Gather
t3_k1pktd	Donald Trump says he will leave the White House if Joe Biden is confirmed by electoral college
t3_k1gsph	Biden to face test over access to sensitive information as he inherits Trump's secret server
t3_k1gw51	Trump’s baseless election fraud claims in Georgia turn Senate runoffs into a ‘high-wire act’ for Republicans
t3_k1p3nm	Trump Supporters Want to Boycott the Georgia Runoffs. Is Their Threat Genuine?
t3_k1m6vv	Teddy Roosevelt relative joins mockery of Trump ‘elite strike force’ lawyer for misquoting his ancestor: The former president’s great-grandson mocked Jenna Ellis’s ‘ifea’ defence for misquote
t3_k1cb5e	Trump Retweets Rep. Matt Gaetz Urging Him to Pardon Himself
t3_k1720h	Biden promises some student loan forgiveness. Student borrowers hope he delivers.
t3_k1o9e2	Ex-Trump Lawyer Sidney Powell Mocked For Typo-Laden Lawsuits
t3_k1l51b	They’re Baaack: Trump and Allies Still Refuse Election Loss
t3_k1ndvj	Error-riddled lawsuit filed in Georgia by Ex-Trump lawyer
t3_k1ofbw	Justice Department appeals order it cannot rep. Trump in E. Jean Carroll case
t3_k1mojr	Trump administration removes experts from Defense Policy Board
t3_k1ie4m	‘A polite coup d’etat’: Trump and allies continue baseless claims on U.S. election
t3_k1g86b	They're baaack: Trump and allies still refuse election loss
t3_k1powx	Trump says it will be 'a very hard thing' to concede to Biden
t3_k1p8x2	US election result: Trump comes step closer to conceding as he says he will respect Electoral College vote
t3_k1gz8v	Secluded and deluded: Trump’s post-election actions show a mad-monarch mindset
t3_k1oemk	‘I know this isn’t the way we hoped we’d spend our holiday’: Bidens send a Thanksgiving message to the nation
t3_k1a37f	Trump fixates on bogus election claims, leaves Americans struggling without Covid relief
t3_k1h61e	Trump Races to Weaken Environmental and Worker Protections, and Implement Other Last-Minute Policies, Before Jan. 20
t3_k1ep1i	Trump Tweets Bogus Poll Backing His Refusal to Concede
t3_k1p2pk	‘Loser’: How a Lifelong Fear Bookended Trump’s Presidency. The president’s inability to concede the election is the latest reality-denying moment in a career preoccupied with an epithet.
t3_k1jqka	New Rule Would Allow U.S. to Use More Methods for Executions — The rule, which would permit methods including firing squads and electrocution, comes as the administration rushes to execute five more prisoners before President Trump’s term ends.
t3_k1j9gh	Citing conspiracy theories, Michigan GOP electors ask court to name Trump winner
t3_k1e1r5	A sweet Thanksgiving after all: America has rebuffed Trump's assault on democracy
t3_k1ndor	Donald Trump should pardon Joe Exotic and himself to combat ‘radical left bloodlust’, says congressman
t3_k1l7ht	DOJ to Appeal Judge's Injunction Against 'Cruel, Unprecedented Policy' of Deporting Migrant Children | The Trump administration—which has denied the severity of the coronavirus pandemic and seized infants from their parents—claims it is acting in the interest of public health and children.
t3_k1eyky	They’re baaack: Trump and allies still refuse election loss
t3_k1q2fd	After Trump retweets call to pardon himself, Fox News asks "can he?"
t3_k16xcm	Biden victory in hand, Black church get-out-the-vote workers assess the future
t3_k1qmwz	Noam Chomsky: Trump Has Revealed the Extreme Fragility of American Democracy
t3_k1po3b	Trump Is Leaving the White House. Meanwhile, He’s Escalating His Execution Spree.
t3_k1ik5o	Trump’s Last Act: Risking National Security to Honor the Confederacy — He promises to veto the Defense Appropriations Authorization Act if it forces Pentagon to change the names of bases and ships.
t3_k1jara	Trump Rushes to Weaken Environmental and Worker Protections Before January 20
t3_k1igbf	Trump Is Trying to Bring Back Firing Squads
t3_k19nd4	Biden and Harris to skip big Thanksgiving celebrations
t3_k17428	What happens if Trump gets pardon-happy in his final days in office
t3_k16m05	Journalist Carl Bernstein says Sen. Rob Portman despises Trump. Spokeswoman says that's not true.
t3_k1ezsv	Joe Biden Defends His Cabinet Choices: 'This Is Not A Third Obama Term'
t3_k1pwhs	Trump says he will leave if electoral college votes for Biden
t3_k1h3fq	No Pardon Can Save Trump’s Terrible Thanksgiving
t3_k15p9e	Donald Trump still believes US election was ‘rigged’
t3_k1e6zb	Only a quarter of Republicans believe Donald Trump should concede
t3_k1dp4g	Barack Obama has taken a swipe at Hispanic voters who chose Donald Trump, accusing them of ignoring the US president's "racist" comments.
t3_k1n0su	In Georgia, Republicans juggle Biden win and Trump loyalties
t3_k1pmcb	Column: Trump does his worst to make Biden's job even tougher
t3_k19tun	Federal Court Rejects Challenge To Trump's Push To Alter A Key Census Count
t3_k19s2w	Immigrant advocates to Biden: Be better than Obama
t3_k1ptd8	Trump says he'll leave White House if Biden declared winner of Electoral College
t3_k1qpk7	In Thanksgiving Message, Trump Says ‘We’re Like a Third-World Country’ Because He Lost Election
t3_k1nj9u	China is likely to be Biden’s biggest cybersecurity challenge
t3_k1pohl	Trump Says He Will Leave the White House if Electoral College Votes for Biden
t3_k1gch7	Biden tries to spread calm, as some Democrats worry about his willingness to fight
t3_k1p3lo	Trump Sought Options for Attacking Iran to Stop Its Growing Nuclear Program
t3_k1pgg0	Trump Defiant in Thanksgiving Remarks, Unwilling to Concede
t3_k1fqf3	Joe and Jill Biden: Our most important Thanksgiving tradition
t3_k1ijh0	Trump Shared a Tweet Saying He Should Pardon Himself, and Joe Exotic
t3_k1q67z	Just In: Trump says he'll leave White House if Biden declared winner of Electoral College
t3_k1pss6	Donald Trump says he will leave White House if electoral college votes for Joe Biden
t3_k1r17h	Man sues for refund of $2.5m he donated to Trump election challenge group
t3_k1o3jz	MIT's Ernie Moniz Is On Biden's Short List For Energy Secretary — Thrilling Energy Wonks But Disappointing Progressives
t3_k1jbye	Where does the Trump team go next with its legal complaints? Nowhere fast
t3_k1d9vf	Strongmen review: a chilling history for one nation no longer under Trump
t3_k1iwvy	Fact-checking Trump’s cellphone rant of election falsehoods
t3_k1gjjk	Biden's Next Climate Chief Will Tackle 'Existential Threat' At Home
t3_k1qq5l	President Trump will spend his last months in office pardoning turkeys: President Trump will spend the last two months in office giving a pass to all the felons, chancers, and ne’er-do-wells who supported and enabled him. Strap in.
t3_k1c1h2	Xi Jinping calls to congratulate Joe Biden on election win
t3_k1hzfe	Tulsi Gabbard Urges Donald Trump to Pardon Edward Snowden and Julian Assange
t3_k1em7w	Bolsonaro takes swipe at Biden and again dismisses Covid deaths
t3_k1jy86	The Other America: The New Politics of the Poor in Joe Biden’s (and Mitch McConnell’s) USA
t3_k1b6nz	In Trump and Biden, reality and fantasy collide on Thanksgiving
t3_k16g6m	Flournoy gets progressive boost in Biden's search for Pentagon chief
t3_k1qxtt	'I'm the President of the United States!': Trump flips out on reporter
t3_k1ixt6	They're baaack: Trump and allies still refuse election loss
t3_k1kea4	Yes, Trump can pardon himself — but it's a risky move that won't protect him from all prosecutions he could face
t3_k1q0aw	Angry Trump promises rally in battleground state of Georgia
t3_k1a2et	Biden seeks unity as Trump stokes fading embers of campaign
t3_k1h510	Trump set for precedent breaking lame-duck period
t3_k1qwrl	Trump Says He’s Not Thankful, Refuses To Say If He Will Attend Biden Inauguration
t3_k1o6fk	Joe Biden dreams of a healing nation. For now, a dream is about all he’s got
t3_k1qiwk	Trump says he'll travel to Georgia to support Republican Senate candidates in runoff election
t3_k1eidz	Defeat Trump. OK, Now Comes the Hard Part.
t3_k1iro9	Julian Assange’s partner appeals to Trump to pardon him
t3_k1dr3y	Trump's next two months of mayhem
t3_k1qr9c	Overseas celebrations after Biden-Harris win
t3_k1j4uj	Vaccine skepticism emerges as early test for Biden
t3_k1eelw	As Biden administration ramps up, Trump legal effort drags on
t3_k1qf53	Angry Trump promises rally in battleground state of Georgia
t3_k1ik8e	Biden, Trump celebrate Thanksgiving quietly at home as pandemic rages
t3_k1dp1j	The Biden Presidency Already Has Its First Conspiracy Theory: The Great Reset : Usually, you become president before the crazy starts. But Biden still has weeks to go till he assumes office.
t3_k1hoai	Polling Shows Why Trump Will Retain His Bully Pulpit With the GOP Base Even After He Leaves Office: GOP voters see the president -- not his allies in Congress -- as their champion, and most would back him in 2024.
t3_k1gqzc	Trump can be the greatest loser
t3_k1edco	Joe Biden considers Roger Ferguson to lead National Economic Council, Gary Gensler for Deputy Treasury Secretary
t3_k1r0ut	Rep. Matt Gaetz calls on Donald Trump to pardon “Tiger King” Joe Exotic to own the libs - "He should pardon the Thanksgiving turkey. He should pardon everyone, from himself to his administration officials to Joe Exotic if he has to."
t3_k1radv	Trump says he will leave White House following Electoral College vote for Biden
t3_k1r4f0	Biden Has the Team Obama Always Wanted
t3_k1r423	Trump says he will leave White House if Biden wins Electoral College vote
t3_k16k7n	Trump’s legacy, by the numbers
t3_k1rbli	Donald Trump says he will leave White House if electoral college votes for Joe Biden
t3_k16jvq	Clyburn says Biden not naming enough Black cabinet members
t3_k1mts0	What will Biden mean for Pakistan?
t3_k1pvcg	President Trump Thanksgiving Day Remarks
t3_k1b74v	Lara Trump insists president must have won election because of rally crowds
t3_k164s8	Analyzing Biden's possible pick for secretary of defense
t3_k1m9cj	How Biden won: He built on Clinton's successes
t3_k1kpl8	Joe Biden says he will stick with Nancy Pelosi in COVID-19 talks
t3_k1c866	What President Biden Won’t Touch: Foreign Policy, Sacred Cows, and the U.S. Military
t3_k1huwh	Trump hails Supreme Court, hits links on Thanksgiving
t3_k1lhas	Trump could box Biden into a corner on China
t3_k1aflt	Disdain and Disbelief After Biden Claims 'Significant' Progressive Presence in Administration
t3_k16ayh	Did Joe Biden create the 'office of the president-elect'? Here's what you need to know
t3_k1ez19	Where Trump beat the stuffing out of Biden
t3_k16ziu	Sidney Powell promises 'massive' Georgia lawsuit by Wednesday that will 'save' Trump's presidency
t3_k1emt3	Biden says 'we're all in this together' as Dem politicians keep getting caught breaking coronavirus rules
t3_k1q2e6	Trump’s leaving Biden a Christmas gift of Middle East peace — will Joe throw it in the trash?
t3_k174vh	Biden reportedly doesn’t want Trump investigated after he leaves office
t3_k16x2r	Nolte: Only 3% of Trump Voters Believe Joe Biden Is Legitimate Winner
t3_k176ic	Photos: Obama Attacks Trump for Using Same ‘Cages’ at Border He Used
t3_k16mtq	A Biden Presidency Wouldn't Be Moderate, or Legitimate
t3_k1dokd	Trump's inner circle is telling him that Giuliani and the rest of his legal team are making him look like an idiot, report says
t3_k16as8	Steve Schmidt: ‘We’ve entered the corrupt pardon phase of the Trump coup’
t3_k1fhlv	Mueller prosecutor says Trump should be investigated and face charges after leaving office
t3_k1cko2	Obama says lives could have been saved if Trump hadn't disbanded pandemic response unit
t3_k15yeb	‘Absolutely No Allegations of Any Fraud’: Pa. Court Rejects Trump Campaign’s Appeal Over 69 Mail-In Ballots
t3_k1g099	Pranksters have claimed a Trump 2024 campaign website domain which labels Trump a 'loser'
t3_k1dsa2	Donor Sues Pro-Trump Group for $2.5 Million for Failing to Prove Voter Fraud
t3_k1lnms	Trump Is About to Hand Over Sacred Apache Land to a Mining Company
t3_k17277	Giuliani thinks Trump ‘may have won Virginia’ despite Biden winning state by nearly half a million votes
t3_k1ezlz	Trump’s conspiracies have MAGA world talking Georgia boycott
t3_k1as4m	El Paso lawyered up to try and collect $570,000 owed to the city by the Trump campaign from a rally 2 years ago
t3_k1g08g	Ex-Trump lawyer Sidney Powell files typo-filled lawsuits in Michigan, Georgia
t3_k1in3b	Why Biden shouldn't extend an olive branch to Republicans
t3_k1en3v	Donald Trump Retweets Call to Pardon Himself
t3_k1ca3s	Trump urges Americans to ‘gather’ for Thanksgiving in direct contradiction of official Covid guidance
t3_k17xny	Pro-Trump Group Donor Sues Over Failure to Expose Election Fraud
t3_k1i58k	Why Biden Has It Harder Than FDR and Lincoln — They had big congressional majorities to pass the New Deal and fund the Union Army. Biden is the rare crisis president without the majorities he needs.
t3_k1ghc7	Donor sues pro-Trump group over failure to prove voter fraud: 'Empty promises'
t3_k1gtvp	Indian country showed up to beat Trump. How can you show up for Indian country?
t3_k1oj3g	Trump supporters reportedly calling for boycott of key Georgia Senate races
t3_k1hz0i	Shame the Random, Unknown Government Officials Aiding Trump’s Coup Attempt
t3_k1eqs1	Want to Be Like FDR, Joe Biden? Make Your Thanksgiving Proclamations Rallying Cries - The 32nd president used every tool—even Thanksgiving Proclamations—to promote a moral vision for social and economic justice. Biden should do the same.
t3_k18fep	'Wounded' Trump caves on Biden transition as allies abandon him
t3_k178xy	Over 30 Trump Campaign Lawsuits Have Failed. Some Rulings Are Scathing. As President Trump continues to litigate the 2020 election, some judges have lost all patience. Here are some excerpts of their rulings.
t3_k1at5v	Representatives for 'Tiger King's' Joe Exotic are said to be chasing Trump down for a pardon and spending thousands of dollars to get it
t3_k1k1dk	Ex-GOP Pennsylvania governor condemns Trump's Gettysburg meeting as attempt "to undermine the republic"
t3_k1p866	Trump says he will leave the White House if Electoral College votes for Biden
t3_k1fr77	Trump’s Last Act: Risking National Security to Honor the Confederacy. He promises to veto the Defense Appropriations Authorization Act if it forces to Pentagon to change the names of bases and ships.
t3_k1e6ky	Obama says Republicans won votes for Trump by wrongly framing white men as victims
t3_k1f7lj	Joe and Jill Biden in Thanksgiving op-ed: 'We can be apart without being alone'
t3_k1cwkm	Donald Trump Is the Ultimate Super-Spreader | Trump didn’t merely bungle this country’s pandemic response; he stoked the flames of this third and largest surge.
t3_k1h7nv	Get ready for Donald Trump’s shadow government — via Twitter and Fox News: Other Republicans, in fear of the wrath of Trump’s supporters, will obstruct Joe Biden at every turn.
t3_k1gz8z	Trump’s Thanksgiving Message Urges People To ‘Gather,’ Despite Raging Pandemic
t3_k169vg	Donald Trump Shares Deep State Conspiracy Article That Says 'We Are at War'
t3_k1jggr	Leading House Dems Demand 'Full Accounting' on Trump Order Allowing Purge of Federal Workforce
t3_k1o6m0	Comedians Buy Trump 2024 Website Domain to Call President a 'Loser'
t3_k1fxbr	Trump shares tweet saying he should pardon himself, rest of his admin
t3_k1hyjh	Biden takes his cue from Muhammad Ali as he copes with a dope — As Ali did with Foreman, Biden has let his rival punch himself out.
t3_k1mhcs	Trump retweets post from GOP ally Matt Gaetz suggesting the president pardon himself and whole administration
t3_k1mlgj	Midnight Ruling Exposes Rifts at a Supreme Court Transformed by Trump
t3_k1exsn	Obama says Republicans portrayed white men as ‘victims’ to win votes for Trump
t3_k1j285	Biden Urged to 'Honor Indigenous Sovereignty and Immediately Halt' Fossil Fuel Pipelines
t3_k1i6ol	Investor Sues to Get His $2.5 Million Back After Supporting True the Vote’s Flailing Pro-Trump Election Suits.
t3_k17k4y	Trump wages war on our country and the rule of law one last time
t3_k1e7r8	Trump retweets congressman urging him to pardon himself
t3_k1m30w	Some Trump voters still believe he can retain the presidency
t3_k1i78k	PA Lt. Governor to Trump lawyer Giuliani: Where's the voter fraud? | Rudy Giuliani and Donald Trump are still attacking Pennsylvania's election results. The commonwealth's Lt. Governor John Fetterman says the evidence for that fraud simply does not exist.
t3_k1fqxm	Biden predicted a GOP 'epiphany' after the election. Trump's standing in the way.
t3_k19487	Over phone, Trump tells Pennsylvania hearing U.S. election must be ‘turned around’
t3_k17yc5	Biden Urged to 'Honor Indigenous Sovereignty and Immediately Halt' Fossil Fuel Pipelines
t3_k1guvu	Bidens Highlight 'Sacrifice' of Staying Home for Thanksgiving While Trump Urges Americans to Gather
t3_k1pktd	Donald Trump says he will leave the White House if Joe Biden is confirmed by electoral college
t3_k1gsph	Biden to face test over access to sensitive information as he inherits Trump's secret server
t3_k1gw51	Trump’s baseless election fraud claims in Georgia turn Senate runoffs into a ‘high-wire act’ for Republicans
t3_k1p3nm	Trump Supporters Want to Boycott the Georgia Runoffs. Is Their Threat Genuine?
t3_k1m6vv	Teddy Roosevelt relative joins mockery of Trump ‘elite strike force’ lawyer for misquoting his ancestor: The former president’s great-grandson mocked Jenna Ellis’s ‘ifea’ defence for misquote
t3_k1cb5e	Trump Retweets Rep. Matt Gaetz Urging Him to Pardon Himself
t3_k1720h	Biden promises some student loan forgiveness. Student borrowers hope he delivers.
t3_k1o9e2	Ex-Trump Lawyer Sidney Powell Mocked For Typo-Laden Lawsuits
t3_k1l51b	They’re Baaack: Trump and Allies Still Refuse Election Loss
