name	title	coding 
t3_k4js8c	'All About the Grift': Trump Reportedly Raises Over $150 Million for Non-Existent 'Election Defense Fund'	5
t3_k4wxi7	"'It has all gone too far': Georgia voting official tears into Trump, GOP senators for fueling threats against election workers and being 'complicit' with their silence"	2
t3_k4yo0t	'It has to stop': Georgia official calls on Trump to 'stop inspiring' death threats over election	2
t3_k4xmzx	"‘Gone Too Far’: Ga Election Official Torches Trump, Gop Sens For Silence On Death Threats"	2
t3_k49pla	‘Is he just coming to bring Covid’: Democrat Georgia candidate launches blistering attack on Trump state visit	1
t3_k4yn00	‘It Has All Gone Too Far’: Georgia Election Official Lashes Trump	2
t3_k4nruh	"‘Plain and simple grift’: Trump has raised $170m since election day. Rob Flaherty, digital director of Joe Biden’s campaign, calls fund ‘plain and simple grift’"	5
t3_k4xj0o	"‘Someone’s Going to Get Killed’: Georgia Election Official’s Emotional Plea to Trump, Loeffler, Perdue"	7
t3_k4lhre	"‘They can know that there are things coming’: Former cybersecurity chief hints at legal action against Trump campaign attorney - “The way I look at it is that we’re a nation of laws, and I plan to take advantage of those laws,” said Christopher Krebs."	2
t3_k4w02o	"""Someone's going to get killed"": Georgia official slams Trump, others on post-election rhetoric"	2
t3_k4z4tc	25 former D.C. Bar presidents: Lawyers should not be complicit in Trump’s attack on democracy	2
t3_k4qof8	"268,000 People Died and Scott Atlas Shrugged: Trump's ""Most Dangerous"" Covid Adviser Quits | Atlas brought no expertise in infectious diseases but plenty of misinformation to the position."	1
t3_k4lplm	"A Post-Election Trump Firing Makes the Case for an Independent, Regulatory CISA"	7
t3_k4zn7f	A Top Georgia Election Official Angrily Urged Trump To Condemn Supporters Who Are Threatening Election Workers	7
t3_k4p9fa	A Trump Lawyer Just Called For the Execution of Trump's Former Election Security Chief	2
t3_k4pazd	A witness in Trump ally Sidney Powell's lawsuits says the voting results in 'Edison County' indicate fraud. No such place exists.	2
t3_k4n9ae	"After Trump Att’y Calls For His Death, Former DHS Official Warns That He Has Good Lawyers"	2
t3_k4l8iy	Arizona Gov. Doug Ducey Appears To Ignore Call From Trump While Certifying Election Result - The Republican governor heard plenty from the president on Twitter later.	2
t3_k4lf9x	Arizona Governor Ducey appears to ignore call from Trump or Pence while certifying election results	2
t3_k4k6te	"As Trump and Barr ramp up executions, Biden must rally America to end the death penalty"	4
t3_k4t3ox	Bank of America joins big U.S. banks that won’t finance oil in the Arctic refuge Trump opened to drilling	7
t3_k4vw65	Barr breaks with Trump on claims of fraud	2
t3_k4sn3e	Biden Calls on Congress to Pass ‘Robust’ Stimulus Package	4
t3_k4crmc	Biden Covid advisor on Dr. Atlas resignation: 'I am relieved' because he wasn’t qualified	1
t3_k4m9f8	Biden plans to reverse Trump’s anti-LGBT+ policies including trans military ban	6
t3_k4kfzg	Biden readies major stimulus push and flurry of executive actions in first 100 days	4
t3_k4visy	"Biden’s COVID Team Sounds the Alarm Over Trump’s Vaccine Distribution Plan — The president has checked out on the pandemic, aides say. And now, the team coming in says they fear basic questions are not being answered."	1
t3_k4yz38	Burnett: Barr is leaving Trump on island of his most die hard sycophants	7
t3_k4obve	Chris Krebs hints at legal action against Trump campaign lawyer who suggested he be 'shot'	2
t3_k4unqz	Congress needs to fix Donald Trump's favorite loopholes — Trump has been adept at exploiting every loophole available to him in the law. Congress needs to go full post-Watergate and close off as many as possible.	7
t3_k4qcko	"Don't be fooled: Trump's conspiracy theories won't discourage Georgia Republicans. Republican voters aren't fooled by Trump's lies about ""rigged"" elections — they think they're in on the con"	2
t3_k4m4bw	Donald Trump Jr. tells Georgia Senate voters that Trump is on the ballot	7
t3_k4qa8j	Donald Trump's refusal to accept defeat fuels violent threats on social media	5
t3_k4upt0	"Even after he’s gone, Trump will try to hog the spotlight. Ignore him, media colleagues | Opinion"	7
t3_k4uzse	Federal Court Will Not Sanction Trump Campaign for Lying in Michigan Voting Lawsuit	2
t3_k4nhk7	Fired cybersecurity chief hints at legal action after Trump campaign lawyer said he should be executed	2
t3_k4ijfx	Fired Official Says Correcting Trump's Fraud Claims The 'Right Thing To Do'	2
t3_k4vloe	"For Years, Republicans Ignored Donald Trump’s Tweets. Now They’re Using Twitter as an Excuse to Attack Biden’s Budget Chief Pick"	7
t3_k4y6fv	Former cybersecurity chief plans to take legal action after Trump lawyer calls for him to be shot	2
t3_k4v6xj	"Georgia election official condemns Trump after threat to worker: Gabriel Sterling, an aide to Georgia's secretary of state, said Trump should ""stop inspiring people to commit potential acts of violence."""	7
t3_k4uuws	Georgia election official demands Trump stop 'inspiring' violence: 'Someone's going to get killed'	7
t3_k4ywp9	Georgia election official pleads with Trump and Republicans to 'stop inciting acts of violence'	7
t3_k4woof	Georgia Elections Official Begs Trump to ‘Stop Inspiring People to Commit Potential Acts of Violence’	7
t3_k4y187	Georgia Official Warns of Trump’s Election Fraud Claims: ‘Someone’s Gonna Get Killed’	2
t3_k4vh8x	"Georgia official: Trump, U.S. senators complicit in potential violence"	7
t3_k50036	Georgia Republican warns Trump is inciting violence over election: 'Someone will get hurt'	7
t3_k4mtrr	Georgia Republicans beg Trump to release them from his prison of lies	2
t3_k4nspi	Georgia's lieutenant governor joins state GOP officials in rejecting Trump's 'misinformation'	2
t3_k4r0al	Georgia’s Lt. Governor Doesn’t Seem Eager For Trump To Visit This Weekend	7
t3_k4po9e	Giuliani denies report that he discussed pardon with Trump Giuliani was reportedly under investigation by federal prosecutors for his dealings in Ukraine on behalf of Trump’s political interests.	3
t3_k4y3xp	GOP Election Official Warns Trump to Stop the Attacks or 'Someone’s Going to Get Killed'	7
t3_k4xrcx	Groups sue Trump and White House to stop destruction of administration records	2
t3_k4otyy	Hannity says Trump should pardon himself and his family – but former White House lawyer insists that’s impossible | There is no legal basis for a president pre-emptively pardoning themselves or their relatives	7
t3_k4jmqi	House Democrats Demand Increase in IRS Funding to Go After 'Wealthy Tax Cheats'—Like Donald Trump	7
t3_k4xwaz	"Is Trump Going to Preemptively Pardon His Entire Family, Just in Case? | As long as Trump’s just giving them out, Rudy Giuliani would also like one."	7
t3_k4uuxn	Jake Tapper to interview Joe Biden and Kamala Harris in first joint interview since winning election	5
t3_k4rc4b	Joe Biden should do everything at once | How to succeed in hyperpolarized politics: run a blitz.	7
t3_k4zvg5	Judge throws out Trump rules limiting skilled-worker visas	5
t3_k4nbz8	Krebs looking at legal 'opportunities' after Trump campaign lawyer said he should be 'shot'	2
t3_k4qlgt	Legal Experts Blast Trump Lawyer For Saying Krebs Should Be ‘Taken Out And Shot’	2
t3_k4gp63	Lincoln Project calls for revenge on ‘grubby sellouts’ who backed Trump	7
t3_k4t31q	Mitch McConnell for the first time appears to accept Biden's election victory over Trump	4
t3_k4yyae	Nevada governor: 'Unconscionable' for Trump to suggest Reno's COVID-19 surge unit 'fake'	1
t3_k4nf0b	NYT: Giuliani Discussed ‘Pre-emptive Pardon’ With Trump	7
t3_k4ls58	Obama says Dolly Parton not getting medal of freedom was 'screwup': 'I'll call Biden'	7
t3_k4vrjd	"Ohio tea party leader urges Trump to suspend the Constitution, declare martial law to hold new vote"	7
t3_k4zqdg	Removing Trump Is Not Enough. He Must Be Prosecuted.	7
t3_k4xvo7	Rep. Mike Kelly asks Supreme Court to nullify Biden win over Trump in Pennsylvania as he challenges mail-in ballot rule	2
t3_k4lpoi	Report: Trump Has Raised More Than $150M On Election Fraud Propaganda	2
t3_k4ncrp	Rudy Giuliani reportedly seeks pardon from Donald Trump	7
t3_k4n99x	"Rudy Giuliani talked to Trump about getting a preemptive pardon before the president leaves office, report says"	7
t3_k4ynnv	"Rudy Giuliani, who has not been charged with a crime, discussed preemptive pardon with Trump: report. While Giuliani's specific legal exposure is unknown, he is a subject in at least two recent federal investigations"	7
t3_k4lrw2	Rudy Giuliani's latest conspiracy: 'Illegal aliens' stole Arizona's election from Trump	7
t3_k4z1fa	Schumer: Barr likely ‘to be fired’ after disputing Trump’s voter fraud claims	2
t3_k4j7fc	Sean Hannity says Trump should pardon himself and his family to avoid a ‘witch hunt.’ Experts say it’s not that simple.	7
t3_k4x5re	The Supreme Court Wants to Revive a Doctrine That Would Paralyze Biden’s Administration	7
t3_k4z4wi	"The Trump campaign's new lawsuit would invalidate 221,000 Wisconsin ballots — including votes cast by mail because of the coronavirus pandemic"	2
t3_k4za0j	"This has to stop’: Georgia official calls out Trump, U.S. senators over threats to election workers"	7
t3_k50b0h	Tiger King's attorney believes they're close to getting pardon from Trump	2
t3_k4wxx5	"Trump associates, including Giuliani, are asking for pardons"	7
t3_k4k4cu	"Trump attacks GOP governors, retweets 'why bother voting for Republicans'"	5
t3_k4xbfs	Trump bilks $170 million from supporters to fund suits—but his PAC pockets most of the cash: report	5
t3_k4oa4q	Trump Campaign Lawyer Joe diGenova Could Be Disciplined for ‘Stunning’ Statement That Chris Krebs Should Be ‘Shot’	7
t3_k4yt47	"Trump fired me for saying this, but I’ll say it again: The election wasn’t rigged"	5
t3_k4zm6n	"Trump has discussed possible pardons for three eldest children, Kushner: report"	5
t3_k4zb5e	Trump has raised $170 million since Election Day.	5
t3_k4skgg	Trump is an expert in making money off losing. Now he’s doing it again.	5
t3_k4q44l	Trump Is Milking His Donors For All They’re Worth Before He Leaves Office	5
t3_k4t7bi	Trump Is Rapidly Becoming Irrelevant	5
t3_k4qwo5	Trump Is Wringing Every Last Cent Out of His Supporters on the Way Out	5
t3_k4m8jq	Trump keeps retweeting the anonymous account 'Catturd2' which backs his baseless election-fraud claims. The handle is now trending.	2
t3_k4dmuc	"Trump lawyer calls for ousted cybersecurity chief to be ""taken out at dawn and shot"""	2
t3_k4a14m	Trump Lawyer Joe diGenova Says Former Cybersecurity Chief Chris Krebs Should Be Executed for Saying Election Was Secure	7
t3_k4zda1	Trump Reportedly Considering Pardons For 3 Of His Children And Rudy Giuliani	5
t3_k4uamv	Trump reportedly ousts top Pentagon official leading ISIS fight	7
t3_k4kzrf	Trump shares posts asking ‘why bother voting for Republicans?’ ahead of key vote that could decide Senate	5
t3_k4reut	Trump suggests Georgia governor could 'call off' Senate runoff races	5
t3_k4icdp	"Trump Tells Pompeo: Go Wild on Iran, Just Don’t Risk ‘World War III’"	3
t3_k4y1i3	Trump to boycott Biden’s inauguration and won’t even invite him for White House visit - report	5
t3_k4yuf4	"Trump to restart foreign deals, breaking a post-presidency norm - A return to overseas dealmaking raises new ethical issues no ex-president has ever confronted. Trump’s sprawling global company is private and increasingly reliant on foreign lenders."	5
t3_k4v5zk	Trump urges Georgia governor to ‘call off election’ as GOP frets about Senate runoffs	5
t3_k4mrhz	Trump wants Georgia's GOP governor to 'call off the election'	5
t3_k4zhi4	"Trump, Kushner, White House sued by watchdog to prevent illegal deletion of official emails, WhatsApp messages"	5
t3_k4w78u	"Trump’s ‘Save America’ PAC Could Pay For Big Macs, Hush Money … Pretty Much Anything"	5
t3_k4l4cp	Trump’s airtime should be limited when necessary journalist says	5
t3_k4psea	"Trump’s campaign ends as his first one began, surrounded by outcasts and cranks"	5
t3_k4jydi	Trump’s legacy is the plague of extreme lies. Truth-based media is the vaccine	2
t3_k4zbj3	"Trump’s virus czar resigned, drawing cheers from health officials who say his ideas are dangerous."	2
t3_k4n1eh	Video shows Arizona governor ignoring 'Hail to the Chief' call while certifying Biden victory	2
t3_k4zig3	Warren Presses Biden to Enact 'Effective Economic Stimulus' With Single Pen Stroke: Cancel Student Debt	4
t3_k4jluy	"We will finally get Trump out of the White House, but how do we get him out of our faces?"	7
t3_k4p6jv	Why Joe Biden Can Stop Worrying and Start Spending Like Crazy - The country is in desperate need of a massive economic recovery program. The incoming administration shouldn’t hold back.	4
t3_k4va65	William Barr Kept Silent For Weeks As Trump’s Voter Fraud Conspiracy Theories Spread	2
t3_k46s2b	Wisconsin formally declares Biden won election following recount	2