name	title	coding
t3_k46amu	Biden to nominate Janet Yellen as US treasury secretary	
t3_k3qszl	"Ousted Trump cybersecurity official calls Rudy Giuliani's election claims ""dangerous"""	
t3_k3zvr9	Trump 'ashamed' to have endorsed Republican Georgia governor	
t3_k4ajpl	Fox News Host Gives Lara Trump a 2020 Reality Check	
t3_k3nzju	"What it’s like to teach children about the election, and its results, in deep-red Trump country"	
t3_k40vhc	Will Biden’s All-Women Press Team Bring an End to the Chaos?	
t3_k3n99k	"Joe Biden's doctor says he suffered ""hairline fracture"" in foot after he slipped while playing with dog"	
t3_k38mjd	"Trump attorneys described Giuliani as 'deranged' and likened the team pushing election fraud claims to a 'clown car,' report says"	
t3_k3khqf	Pa. lawmaker was informed of positive coronavirus test while meeting with Trump: report	
t3_k4angv	Trump's coronavirus adviser Scott Atlas resigns	
t3_k498tx	Biden’s pick to lead White House budget office emerges as lightning rod for GOP	