name	title
t3_k403ex	"The ""What happened in your state last week?"" Megathread, Week 47"
t3_k44py1	"New Kelly Loeffler ad claims multimillionaire knows what ""it feels like waiting on that paycheck"" | The richest member of Congress is worth between $800 million and $1 billion, according to Forbes"
t3_k45eq6	This Country Can't Survive If 43% of Us Live in Unreality
t3_k41xhu	Trump said the stock market would crash if Biden won. The Dow is having its best month since 1987.
t3_k41srd	Arizona Certifies Biden’s Election Victory Over Trump
t3_k48941	Ivanka Trump ‘Not Wanted’ posters appear across New York City
t3_k3yd5q	FCC Chairman Ajit Pai will step down on January 20
t3_k3z06l	Joe Biden names Karine Jean-Pierre, a proud Black lesbian immigrant, as deputy White House press secretary
t3_k3zl4a	Biden's favorability already 6 percent higher than Trump's record: poll
t3_k3xnka	Mark Kelly to be sworn in as senator on Wednesday
t3_k4241c	Arizona votes to certify results as Giuliani peddles debunked conspiracies at Phoenix hotel
t3_k3yye8	"GOP congressman says he's been called a ""traitor"" by people close to him for recognizing Biden's victory"
t3_k3y9ep	The ‘Kraken’ Lawsuit Was Released And It’s Way Dumber Than You Realize
t3_k3y80s	75% of every donation to Trump's 'election defense fund' could be spent by the president himself on things like paying family members or financing a 2024 bid
t3_k3w0p4	There Aren’t Serious Enough Consequences for Those Trying to Break American Democracy. What the president and his lawyers have been attempting to do deserves punishment that will likely never come.
t3_k40p23	Predictably, some Georgia Republican voters are turning on the party
t3_k3w2hj	We Won’t Forget and We Won’t Forgive What Trumpists Did to America
t3_k3vdw3	Biden Four Times More Popular With Republicans Than Trump Is With Democrats: Poll
t3_k3ul81	Congress is briefly reconvening, under pressure from Trump and Biden to pass a COVID-19 stimulus bill after months of gridlock
t3_k3v2oi	President Trump’s interview is an embarrassing low mark for him, Fox News and, especially, interviewer Maria Bartiromo: Once a respected journalist and top business reporter, Bartiromo has seemingly sold her journalistic soul to become a sycophant for President Trump.
t3_k45csk	The Trump You’ve Yet to Meet: Just because we know bad things about the 45th president, don’t assume that there’s nothing bad left to find out.
t3_k3z1b0	House to make historic vote to end marijuana prohibition this week
t3_k433e1	Federal Judge Advances Lawsuit Accusing Felix Sater Of Laundering Loot Through Trump Properties.
t3_k3vijr	Biden's favorability rating rises while Trump's slips: Gallup
t3_k43k82	National Review Editors Slam President Trump as ‘Petulant’ and ‘Disgraceful’ Sore Loser
t3_k3z5h4	Trump's Rallies Didn't Pay Off For Him At The Polls, According To Data. Research has, however, linked his rallies to hundreds of COVID-19 deaths.
t3_k41wg3	Arizona certifies Biden's win
t3_k42h1m	Georgia governor rejects Trump's call to 'overrule' elections officials with emergency powers
t3_k48iqh	"Proud Boys member threatens armed revolt outside Giuliani meeting: ""Not going to stand back and stand by anymore"""
t3_k46s2b	Wisconsin formally declares Biden won election following recount
t3_k3x9bi	President-elect Biden Adds Navajo Nation Health Director, Dr. Jill Jim, to His Transition Team's Coronavirus Task Force
t3_k3u8vj	Ossoff warns of 'paralysis' if Republicans keep control of Senate
t3_k46hjr	All major battleground states in the 2020 election officially finalize their results, cementing Biden's victory in the presidential race
t3_k3wbby	"Trump's whining about the ""rigged"" election feeds off GOP's longtime victim complex: For the right to cast themselves as history's victims is nothing new. But this time it's more dangerous than ever"
t3_k3vhx5	Ocasio-Cortez raises $200K to fight food and housing insecurity during video game battle
t3_k3z814	Democrat Mark Kelly Will Be Sworn Into The Senate On Wednesday
t3_k44esj	Georgia shuts down Trump’s attempts to bully governor over election result
t3_k3tfti	Republican Rep. Tells Trump to 'Stop the Stupid' after 'Election Hoax' Tweet
t3_k474w5	Joe Biden names all-female communications team, Kayleigh McEnany falsely claims Trump did it first. McEnany claims Trump has an all-female team, forgets about her own male deputies and Pence's male press secretary
t3_k42wkh	Georgia governor, defying Trump, says he'll 'follow the law' on election results
t3_k3vynw	Why Trump's Michael Flynn pardon was so obviously corrupt
t3_k3u4pg	The Supreme Court Must Choose Between Trump and the Constitution in the Census Case
t3_k40wfv	David Perdue Campaign Mocks Opponent Jon Ossoff for Eating at Black-Owned Slutty Vegan Restaurant
t3_k49c1m	Millionaire Kelly Loeffler mocked for ad claiming she knows what it ‘feels like waiting on that paycheck’
t3_k3we1f	Trump Whines About ’60 Minutes’ Interview With Ex-DHS Official Who Debunked False Voter Fraud Claims
t3_k3znc8	The GOP Is a Propaganda Party | Media parasites have taken control of the host.
t3_k3v9zr	'Stop The Stupid': GOP Lawmaker Pleads With Trump To Drop Election Lies
t3_k3x1v8	Senator's defense in stock-trading controversy undercut by new details
t3_k3txr7	Trump’s Tantrum Over Loss Could Smash Georgia GOP
t3_k46qb6	Stephen Miller Races to F--K Over Immigrants on His Way Out the Door — The new father and architect of Donald Trump’s family-separation policy is hard at work.
t3_k3yowf	FCC chief Ajit Pai to depart agency the day Biden is sworn in
t3_k45xx2	Harris County GOP chairman who made racist Facebook post resigns
t3_k3wdha	Trump losing Twitter followers since election – as Biden gains them
t3_k478ud	Joe Biden's inaugural committee will accept corporate donations up to $100,000, but bar lobbyists and fossil fuels
t3_k43w1q	McConnell-linked super PACs dominate outside spending in Georgia runoffs
t3_k41tx3	Trump’s path to a second term via faithless electors has ‘zero practical chance’
t3_k430hz	Trump couldn’t steal the election. That doesn’t mean warnings were overblown.
t3_k46730	Wisconsin Becomes Last Contested State to Confirm Biden Won
t3_k42emu	"'Looking at You, Senate Majority Leader': 87 Million Could Lose Paid Leave Without Urgent Action From Congress | ""It's very America for us to finally require paid sick leave and family leave during the pandemic only to let it lapse before the pandemic is over."""
t3_k3uxzw	"'Reckless, Provocative, and Illegal': Sanders Warns Assassination of Iranian Scientist Designed to Kill Diplomacy | ""We must not allow that to happen. Diplomacy, not murder, is the best path forward."""
t3_k47wzs	Wisconsin Gov. Tony Evers signs certification of Joe Biden’s win ahead of promised lawsuit from President Donald Trump
t3_k3zzgd	Georgia secretary of state says Trump is being misled by 'dishonest actors'
t3_k3ww46	US is Infected with ‘Pandemic Capitalism’ as Markets Incentivise Suffering
t3_k3zqcp	Cashing in on coronavirus? Georgia Sen. Perdue’s stock trades raise suspicions
t3_k457tm	Joe Biden Seems to Be on Board With This Blog's First Rule of Economics: F*ck The Deficit. People Got No Jobs.
t3_k45o1z	Democrats Can Play Hardball, They Just Usually Schedule Matches Against Other Democrats
t3_k3xkld	Biden picks Janet Yellen for Treasury Secretary and five other top economic advisers
t3_k44zk1	Georgia Democrat Osoff Says 'Disgraced' Trump Will Only Bring COVID to State
t3_k419up	Trump ally hosting maskless meeting to nix election certification gets COVID
t3_k44suf	Trump and his allies have won zero out at least 26 lawsuits they've filed since Election Day
t3_k487yf	How Will Biden Deal With Republican Sabotage? | He needs to make the G.O.P. pay a price for obstruction.
t3_k3whg8	Trump lost support in most of the places where he held his final campaign rallies
t3_k4987d	Scott Atlas resigns from coronavirus task force, reports say
t3_k44dde	No, Georgia’s governor cannot ‘overrule’ its secretary of state on voting.
t3_k48qhq	Dr. Scott Atlas resigns as special adviser to Trump on coronavirus
t3_k46t7x	Democratic Party Lawyers: Sidney Powell’s Kraken Lawsuit Amounts to ‘Debunked Conspiracy Theories’ and ‘Wild Speculation’
t3_k42lg5	Arizona secretary of state certifies election results with Biden winning state's 11 electoral votes
t3_k45pgo	Citing rise of 'Christian nationalism,' Secular Democrats unveil sweeping recommendations for Biden
t3_k40bjc	Georgia secretary of state calls out 'dishonest actors' for 'exploiting the emotions of many Trump supporters' and 'misleading the president as well' '
t3_k469wf	Wisconsin confirms Joe Biden as winner following recount
t3_k40onw	Far-Right Pastor: Trump Fast-Tracked Firing Squad Execution Rule Because Some Traitors Are Going to Get Shot
t3_k44ojt	The Georgia Senate Runoffs Will Determine Whether Anything Gets Done in Congress
t3_k48n5k	Hannity: Trump Should ‘Pardon His Whole Family and Himself’
t3_k452i7	Indiana Asks the Supreme Court to Let It Strip Rights From Same-Sex Parents
t3_k3w1ey	The Electoral College is only getting worse
t3_k3ogh2	Corporate Media Begin to Acknowledge GOP Coup Attempt
t3_k45e08	It’s Not Just Trump: Covid-19 Is The Test That Conservatism Was Built To Fail
t3_k44y3r	‘The 2020 Election Is Now Over’: Pennsylvania Secretary of State Urges SCOTUS to Reject GOP Election Challenge as Moot
t3_k3uxds	Ex-U.S. cybersecurity chief Chris Krebs tells 60 Minutes how he knows the 2020 election wasn't rigged
t3_k3u5nq	Biden set to receive first president's daily intelligence brief Monday
t3_k3yn43	McEnany Ignores Male Deputies While Railing Against Coverage Of Biden's All-Female Comms Team
t3_k46yzi	The Trump Train Has Reached Its Terminus in Crazytown
t3_k44d10	GOP eyes new voting restrictions based on made-up fraud claims
t3_k46cii	Trump’s own Supreme Court appointees can’t stomach his attempts to rig the Census
t3_k3yuyf	Donald Trump Says U.S. Election Security Is 'International Joke,' but Watchdogs Rate it Highly
t3_k47835	The Cruelty Is the Point of Trump’s Approval of Hanging and Firing Squads as Execution Methods
t3_k43jl0	Wisconsin to certify election result Monday after recounts net 45 new votes for Trump in Madison region and 132 votes for Biden in Milwaukee area
t3_k3x3bp	Senate returns to Washington with millions of Americans hoping for an agreement on a stimulus package
t3_k3uia3	Joe Biden Scheduled To Get First Intelligence Briefing Monday : Briefings are finally starting up after a lengthy delay triggered by Trump’s refusal to concede the election victory to Biden.
t3_k49pla	‘Is he just coming to bring Covid’: Democrat Georgia candidate launches blistering attack on Trump state visit
t3_k3zacd	Trump provided a road map for stealing an election. Next time could be worse.
name	title
t3_k3zuu0	Poll: Democrats nearly twice as likely as GOP to call pandemic 'extremely serious'
t3_k45wfb	Trump Challenged to Stop 'Waging War' on Election Results by National Review Editorial Board
t3_k47adi	Even Amy Coney Barrett appears skeptical of Trump’s latest attempt to rig the census
t3_k3lze2	Biden to receive first presidential intelligence briefing on Monday
t3_k3x2al	Trump Spent Thanksgiving Weekend on a Misinformation Spree | “The goal here is to confuse people, and he's doing very well at that. This is a classic propaganda tactic.”
t3_k46f19	Elections Commission chair officially confirms Biden's win in Wisconsin
t3_k43btw	Trump and his allies won't drop claims of stolen election — because they're cashing in. Trump will leave office on Jan. 20 — but in the meantime, right-wing grifters make bank by pretending otherwise
t3_k42de2	Arizona certifies Biden’s victory in the state
t3_k453bt	Democracy Is Still Not Safe in the United States
t3_k47yrq	Justice Department releases Trump's pardon of Flynn and asks court for dismissal
t3_k3nbwh	Trump waged a 4-year war with the media. Now Biden has hit the reset button with a historic all-female White House communications team.
t3_k4983b	AZ’s GOP Gov Appears To Get A Call From Trump As Biden’s Win Becomes Official In The State
t3_k40ihv	The Zaniest Pro-Trump Conspiracists Are Making Life Hard For the GOP In Georgia
t3_k3y2w0	The Escalating War Between The Republican Party and Democracy | An extremist party with fringe views can only hope to prevail if it subverts the popular will.
t3_k431d5	Georgia Republican officials reject Trump's calls to overturn election results
t3_k42pzx	Trump Races to Kill Lisa Montgomery In First Federal Execution of a Woman in Almost 70 Years
t3_k48i6s	Articles of impeachment filed against GOP Ohio governor over coronavirus orders
t3_k46iub	'Realize How Silly It Sounds': GOP Lawmaker Urges Americans to Ignore Trump's 'Baseless Conspiracies'
t3_k3uqi6	Pennsylvania Republican ‘informed of positive Covid result while in meeting with Trump’
t3_k47q6n	Republicans file articles of impeachment against Gov. DeWine
t3_k45ppo	Remote work can’t change everything until we fix this $80 billion problem - The U.S.’s rural areas still suffer from limited broadband availability. Addressing that may take both government investment and new technologies.
t3_k42hdb	Arizona certifies Biden's victory over Trump
t3_k48sbd	Wisconsin, Arizona certify Biden wins in presidential vote
t3_k3zmv7	Michigan Republican congressman asks Trump to drop election fraud conspiracy
t3_k3xynh	"Citing Past Calls for Social Security Cuts, Progressives Not Pleased With Biden Pick of Neera Tanden for OMB | ""Everything toxic about the corporate Democratic Party is embodied in Neera Tanden."""
t3_k3x9uh	A GOP State Senator Learned He's COVID Positive During a Meeting With Trump
t3_k3lck8	Trump Did Worse in Counties Where He Held His Final Rallies: Report
t3_k43ig6	Arizona certifies Biden's victory
t3_k3ux4w	Anti-LGBT+ Christian activist claims Joe Biden is forming a ‘transgender atheist army’
t3_k48kl3	DeSantis says no new lockdowns, mask mandates or any other anti-COVID-19 measure in Florida
t3_k49dbj	Scott Atlas resigns as coronavirus adviser to Trump
t3_k47c2b	Trump’s feud with Brian Kemp says it all about the president’s voter fraud claims
t3_k3z3yy	Pai formally announces plans to leave FCC
t3_k3nnzz	Fired director of U.S. cyber agency Chris Krebs explains why President Trump's claims of election interference are false
t3_k42uq8	How Democrats should wage war on coming G.O.P. obstructionism
t3_k485oy	Wisconsin completes canvass and certifies Biden as the winner in the state
t3_k3kfa9	'This is propaganda': Fox News' Maria Bartiromo slammed for 'softball' Trump interview
t3_k3lkkn	Fox News Host Pulls Apart Election Lies Trump Spouted On Network Hours Earlier
t3_k3tgs4	GOP Rep. Says Trump FBI Claim Is 'Flooding the Zone with Baseless Conspiracies'
t3_k42e9r	GOP lawmaker says he's been called a 'traitor' by people close to him for recognizing Biden win
t3_k43v88	Arizona certifies Biden's narrow victory over Trump
t3_k3myr3	"Lindsey Graham calls Biden, Pelosi and Schumer ""trifecta from hell,"" says they'll end Electoral College"
t3_k46muo	Schumer: Hearings for Biden Cabinet picks must start before inauguration
t3_k45bja	Fmr. CIA Dir. Brennan: 'Critically important' that Biden is now receiving the President's Daily Brief
t3_k465ew	A government watchdog says the Labor Department has been releasing flawed data — and finds that most states underpaid jobless Americans
t3_k3ug45	Trump's White House appointees outlast him. Biden and Congress can't forgive and forget.
t3_k492ay	At the White House, Capitol and Supreme Court, Trump goes on a spree of sabotage
t3_k49wwt	Trump’s “Plan” to Distribute COVID-19 Vaccines Is a Predictable Clusterf--k
t3_k3x10f	Avlon: Trump's refusal has moved from denial to delusion
t3_k3z6e1	Mark Kelly to be sworn in Wednesday as Arizona's new senator
t3_k44z3b	"Senate Minority Whip predicts Biden to have ""little"" impact on judiciary as GOP will ""freeze"" his picks"
t3_k47vfa	Why Republicans Want to Make Class, Not Race, the New Political Fault Line. The 2020 presidential election shows that, more than ever, the Democratic Party has become the party of educated voters. For the next four years, Republicans will play up that divide to expand their own base.
t3_k41z7o	Trump Divides Georgia Republicans Ahead of Crucial Senate Runoffs
t3_k49imd	Republicans to Trump: Georgia fraud claims could cost us the Senate
t3_k3yjcq	Biden, Harris to begin receiving classified Presidential Daily Brief for the first time
t3_k3vsgc	Trump's claims of fraud aim to 'scare people', says ex-head of US election security
t3_k49uqx	Murkowski: Trump should concede White House race
t3_k3ujgu	Jon Ossoff lost the first high-profile race of the Trump era. Can he win the last one?
t3_k49edn	Trump lays the groundwork for a massive government purge on his way out the door
t3_k40zu1	FCC Chairman Ajit Pai will step down to make way for the Biden administration
t3_k40vdy	Fox Host Argues Trump Doesn’t Need Court Evidence To Steal Swing States From Biden
t3_k41dml	Supreme Court seems skeptical of Trump’s census plan
t3_k47i9x	Trump has been distorting the military's role in work on a coronavirus vaccine from the very start
t3_k46pgi	Trump still in denial about defeat as legal team mounts last-ditch challenges
t3_k4973g	Dr. Scott Atlas resigns from Trump administration
t3_k46j41	Trump presidency's final days: 'In his mind, he will not have lost'
t3_k3z6op	‘Destructive’ Trump loyalists undermining Pentagon transition, retired admiral warns
t3_k3ns2j	Rahm Emanuel doesn’t deserve a job in Biden’s administration | The president-elect often speaks of this nation’s ‘better angels.’ The former Chicago mayor isn’t one of them.
t3_k46he4	Wisconsin confirms Joe Biden as winner following recount
t3_k3v4ev	Liberal Hyperbole About Trump’s Authoritarianism Was Never the Problem
t3_k4a1k1	Georgia reports more than 940,000 absentee ballot requests for Senate runoff
t3_k49lxb	Arizona certifies election results, finalizing victories for Biden and Kelly
t3_k45pjn	Trump Failures Highlighted in GAO's Devastating Report on Pandemic, Calling for 'Urgent Action' to Preserve Public Health
t3_k495q1	Hunger and food insecurity is rising. Congress must act | American families desperately need economic relief.
t3_k3yhcs	FCC Chairman Ajit Pai to Exit Commission After President-Elect Biden Takes Office
t3_k3jz0x	Pressed About Election, Senior GOP Senator Admits 'I Don't Think It Was Rigged'
t3_k3rb4v	A leaderless America slips deep into a grim pandemic winter
t3_k3hxsq	Fox News Host Shreds Election Fraud Claims Trump Made on Network Hours Earlier
t3_k4338o	Arizona certifies Biden’s election victory over Trump
t3_k43dkf	Fox News host debunks Trump after fellow host Maria Bartiromo let him spew lies without any pushback
t3_k42ymk	Some federal judges plan to retire when Trump exits. Will Biden be able to replace them?
t3_k4a14m	Trump Lawyer Joe diGenova Says Former Cybersecurity Chief Chris Krebs Should Be Executed for Saying Election Was Secure
t3_k3zaub	The Economy Isn’t Working. That’s Exactly the Plan.
t3_k3igxj	Jon Ossoff Says He and Raphael Warnock Will 'Outhustle' David Perdue and Kelly Loeffler in Georgia Runoffs
t3_k3zblg	'Another World Is Possible': Ocasio-Cortez Uses Video Gaming Platform to Raise $200,000 for Fight Against Hunger, Evictions
t3_k49ia6	Have Trump Republican leaders no sense of decency?
t3_k3yxaq	IRS Says Its Own Error Sent $1,200 Stimulus Checks To Non-Americans Overseas
t3_k3m56k	Pa. Lawmaker Trying to Overturn Election Results Learned He Had COVID-19 During Meeting with Trump: Report
t3_k49465	Ossoff’s embrace of Bernie Sanders highlights shift for Georgia Democrats
t3_k46k7p	Trump underperformed in most counties where he held large rallies
t3_k444a5	New Documents Provide Further Details of Stephen Miller’s Influence on Immigration Policy
t3_k46427	Before Stock Trades, Georgia Senator Faced Scrutiny Over Dollar General Sale
t3_k43hc6	Georgia secretary of state: Trump, supporters' emotions being exploited with 'fantastic claims, half-truths, misinformation'
t3_k3y6am	Trump’s Disgraceful Endgame
t3_k3wcmo	Biden to receive his first presidential daily briefing
t3_k40e4z	Fauci Prepares COVID-Battered Nation for Deadly Post-Thanksgiving Spike
t3_k4522r	GAO: Labor Department 'improperly presented' jobless data
t3_k450dn	Arizona certifies election win for Biden over Trump
t3_k47tvd	Wisconsin certifies Joe Biden victory after partial recount
t3_k47plh	Former Rudy Giuliani associates plead not guilty to fraud charges
name	title
t3_k491vz	Georgia GOP lawmaker tests positive for COVID-19
t3_k4aa7l	"Senator calls stimulus deadlock ""stupidity on steroids"" amid bipartisan push for checks before Christmas"
t3_k4702q	Ajit Pai, Easily The Most Controversial FCC Boss In History, Will Step Down January 20
t3_k48oxu	Cannabis group slams Yee’s proposed apartment smoking ban as ‘classist’
t3_k3kpim	Black women helped push Democrats to the finish line in Georgia. Here's how they can do it again
t3_k3i5p9	Giuliani and Powell Could Not Give Evidence of ‘Explosive’ Fraud Claims When Asked by Others on Trump Team: Report
t3_k48dvr	Amy Coney Barrett Is Already Tipping the Scales in Crucial SCOTUS Cases: Trump’s appointee played a key role in the court’s shift on COVID-19 restrictions for religious gatherings and may soon rule in a case that could expand gun rights.
t3_k3zo6q	Georgia Gov. Brian Kemp's office fires back at Donald Trump over election interference demands
t3_k3hj1b	President-elect Joe Biden twists ankle after slipping while playing with dog
t3_k3zcix	Mitch McConnell’s ability to cripple Biden’s presidency depends on one thing
t3_k43ukt	Justices Sotomayor and Gorsuch Lead the Supreme Court in Skepticism of ‘Outdated Anti-Hacking Law’
t3_k3xxjs	Trump Attacks Republican Georgia Governor, Urges Him to 'Use His Emergency Powers'
t3_k3x92j	Andrew Yang, said to be considering mayoral bid, tested in new online poll
t3_k46fwf	Former Giuliani associates plead not guilty in New York to amended indictment
t3_k48cve	He’s a Republican, a Wall Street financier, and a supporter of ‘Medicare for all
t3_k49cvl	’Any and all possible offenses’: Trump pardon grants Flynn a sweeping reprieve
t3_k3vlec	U.S. Supreme Court mulls Trump bid to exclude illegal immigrants from population count
t3_k469g9	Arizona certifies Biden's win as Trump's legal team holds an event in the state over the president's baseless claims of voter fraud
t3_k3w9ad	Newsom’s Top Five Candidates for Kamala Harris’s Senate Seat All Have Climate in Their Bios
t3_k47bwl	Congress returns facing government shutdown deadline, calls for stimulus amid coronavirus surge
t3_k47o9c	"Calls for Diplomacy—Not War—as Scientist's Assassination, Trump Impede Biden's Path to Iran Engagement | ""We cannot let anyone drag us into a new war."""
t3_k3evv3	Retired Admiral Says He's 'Very Concerned' About Trump Loyalists at Pentagon During Biden Transition
t3_k475yv	The Supreme Court Knows Trump’s Nativist Census Scheme Is Unconstitutional | But the conservative justices might not intervene until it’s too late.
t3_k46nm4	Supreme Court skeptical of Trump plan to exclude undocumented immigrants from House redistricting count
t3_k450h8	Supreme Court Seems Skeptical of Trump's Plan to Cut Undocumented Immigrants From Census | No president has tried to do what Trump outlined in a memo in July — remove millions of noncitizens from the once-a-decade head count of the U.S. population
t3_k3vqsl	Fired director of U.S. cyber agency Chris Krebs explains why President Trump's claims of election interference are false
t3_k48zz9	Harris County GOP chair, who assumed role after facing backlash for racist Facebook post, resigns
t3_k3zadi	How Democrats Lost a Once-in-a-Decade Chance to Remake the Political Map | The party won the White House but failed to flip state houses. The upcoming redistricting process will be brutal.
t3_k4acrs	'I'm Kinda Dumb': Proud Boys Supporter's Honest Interview Answers Go Viral
t3_k47oum	Ajit Pai, the Republican F.C.C. chair, will leave on Inauguration Day.
t3_k3sw8g	Trump administration leaves states to grapple with how to distribute scarce vaccines
t3_k45oe2	FCC Chairman Ajit Pai to leave agency on Inauguration Day
t3_k43fwg	Dominion Voting CEO responds to baseless election-rigging conspiracy theories
t3_k3o3s0	Trump Team Would Get Its ‘Clock Cleaned’ At Supreme Court, Scoffs Pennsylvania’s Lt. Gov.
t3_k42zpm	Will a Biden Administration Mean a Smaller Military Budget? - Preventing future pandemics, and addressing long-standing inequalities, will require cutting our bloated Pentagon budget.
t3_k41uol	Weekly jobless claims counts are inaccurate and the unemployed are being underpaid, watchdog says
t3_k3jmhf	From Terre Haute to Tehran to your grandma, Trumpism is revealed as a death cult in the end.
t3_k4agpd	Wisconsin governor certifies state's electoral votes for Biden
t3_k45ci5	Bill filed in Florida to strip state of power to require residents to get vaccinated
t3_k4247k	Biden unveils Janet Yellen as Treasury nominee with vow to ‘deliver immediate economic relief’
t3_k3fsab	Fox News Lets Trump Spew Lies Unchecked In First Interview Since Election Day
t3_k3umof	Trump Is Leaving Biden a Mess in Afghanistan
t3_k3wan0	Biden unveils Jan. 20 inaugural committee
t3_k47v5i	Don't expect a second stimulus check this year. Here's what Congress is talking about instead
t3_k3yarg	Canada to Trump: You can't take our prescription drugs
t3_k49vik	Trump’s Favorite COVID-19 Adviser Scott Atlas Resigns
