name	title
t3_k3ow2i	Trump rages against '60 Minutes' for interview with Krebs
t3_k426fv	Trump allies to Michigan judge: Force Whitmer to overturn results, award state to president
t3_k3ylm6	FCC Chairman Ajit Pai to leave agency next year
t3_k40gta	Trump underperformed in majority of counties where he held rallies in during last two weeks of election campaign
t3_k4aadv	Renna concedes, sealing historic NY Senate win for Democrat John Mannion
t3_k3v1ps	The candidates who could end up prosecuting Trump weigh in on New York's criminal investigation
t3_k3lk06	Pennsylvania Lt. Gov. John Fetterman calls Trump's election lawsuits 'mandatorily aired absurdities' and calls out Twitter over its handling of the president's misinformation
t3_k48byc	WA Notify system goes live with COVID exposure notifications for iPhone and Android users in Washington state
t3_k3f49w	“Mad King” Trump’s Post-Election Spiral Was Even More Deranged Behind Closed Doors
t3_k49wge	GOP State Rep. Moves to Impeach Gov. Mike DeWine for COVID-19 Restrictions
t3_k44kzx	Trump's NATO ambassador pledges 'seamless' transition to Biden administration
t3_k46y7v	Biden’s win brings new hope for peace deals with Denmark and Canada
t3_k47q99	Georgia secretary of state opens investigation into voter registration groups
t3_k3ukoe	Moderna becomes second company to request emergency FDA authorization for COVID-19 vaccine candidate
t3_k3ds16	Trump Now Baselessly Suggests FBI Rigged Election Against Him in First Post-Election Interview
t3_k3cxpt	Ossoff warns McConnell would cause paralysis in federal government if GOP holds Senate
t3_k447vb	DeSantis urges Congress to pass unemployment relief
t3_k3pzqu	'Firehose of falsehood:' How Trump is trying to confuse the public about the election outcome
t3_k3cwgo	Wisconsin recount adds 87 votes to Biden’s victory over Trump
t3_k473m4	U.S. Congress races to avoid December government shutdown amid pandemic
t3_k3tohj	Advocates Push For Resurrection Of DoJ Civil Rights Division Under Biden
t3_k3vfs9	Donald Trump Jr. aides launch super PAC as Georgia worries mount
t3_k3wtgs	'Mercenary' donor sold access for millions in foreign money
t3_k3d06y	Bernie Sanders says GOP ‘has ceased to be a political party’ and is now a ‘cult’ in fiery rebuke of Trump fraud claims
t3_k3pb3p	Former top US cybersecurity official ousted by Trump said there was 'no manipulation of the vote on the machine count side'
t3_k48np6	Supreme Court Seems Skeptical Of Trump’s Census Plan
t3_k40tf9	Firing Squads, Poison Gas, Electric Chair: Trump Moves to Expand Ways to Kill Prisoners
t3_k3yoks	FCC chairman to depart in January
t3_k3dr8n	Jon Ossoff defends claim that GOP senator is a 'crook'
t3_k4a4qg	Controversial White House coronavirus adviser Scott Atlas to resign
t3_k48e6g	The House members already facing the redistricting chopping block
t3_k46lo3	Supreme Court skeptical of Trump's plan to exclude undocumented immigrants from census
t3_k42txm	Georgia GOP Election Officials Blast 'Dishonest Actors' for Baseless Claims: 'Like Playing a Game of Whack-a-Mole'
t3_k3wud1	Joe Biden must be the climate change president
t3_k3lzai	Ousted Trump cybersecurity director debunks 2020 election rumors
t3_k49uh1	Controversial Trump adviser Dr. Scott Atlas reportedly resigned from the White House COVID-19 task force
t3_k437bc	Arizona certifies election results, and Wisconsin is also expected. Trump may challenge the results.
t3_k486me	Pa. lawmaker gets a positive test at Trump meeting
t3_k4277p	Trump’s Trying to Take the Internet Down With Him
t3_k41ke8	Analysis: The 40 most utterly unhinged lines from Donald Trump's first post-election interview
t3_k4291e	Trump escalates attacks on ‘hapless’ Georgia governor refusing signature matching in recount
t3_k4a6l4	Scott Atlas resigns as Trump's pandemic adviser after controversial tenure
t3_k3bu36	Trump attacks FBI for not helping him overturn election result: ‘They just move on’ | The president is furious at the FBI for not backing his election fraud claims
t3_k3y895	When Can We Stop Thinking About Trump Every Minute?
t3_k49uh5	Joe Biden's First Presidential Test: The Student Loan Crisis
t3_k3wal4	Will White Women in Georgia Put Family or Culture War First?
t3_k3uqvd	Biden to receive top-secret US intelligence briefing for first time today
t3_k4akym	President Trump lashes out at Arizona Gov. Doug Ducey after certifying election
t3_k46b7v	The U.S. Is Addicted to Bad Middle East Policy
t3_k3c3iu	Trump Suggests FBI and Justice Department Led By His Own Appointees May Be 'Involved' With Rigging Election Against Him
t3_k4aksa	Trump Lawyer Says Krebs Should Be ‘Taken Out at Dawn and Shot’ for Defending Election
t3_k41plj	Ajit Pai announces departure from FCC after four-year deregulatory blitz
t3_k3chd0	Trump: 'I'm ashamed I endorsed' Georgia Gov. Brian Kemp
t3_k3rfre	Trump lashes out at 60 Minutes in furious tweets over interview with fired elections official
name	title
t3_k3shy7	Georgia Democrat Jon Ossoff on coronavirus lockdown: ‘It’s time to trust the experts’
t3_k43fhu	Don't expect a second stimulus check this year. Here's what Congress is talking about instead
t3_k3bhym	Trump pushes discredited election conspiracy theories in first TV interview since defeat
t3_k4a9rv	Scott Atlas resigns as Trump COVID-19 adviser
t3_k3weo8	Supreme Court Takes Up Trump Plan to Exclude Unauthorized Immigrants in Redistricting
t3_k3j0yc	Source: Pa. lawmaker gets a positive test at Trump meeting
t3_k4a1z4	DOJ Files Trump’s Pardon of Michael Flynn in Judge Sullivan’s Court — Here’s What It Says
t3_k3lk40	Trump loyalist Pa. State Sen. Doug Mastriano tests postive for COVID-19 after meeting Republicans at White House
t3_k48uti	Iowa board certifies Republican Miller Meeks won in Iowas 2nd district, by only 6 votes
t3_k45nu7	Jared Kushner heads to Middle East amid tensions over Iranian nuclear scientist's killing
t3_k40du5	Kayleigh McEnany’s peculiar complaint about coverage of Biden’s all-female press team
t3_k3urwa	Trump risks war again: Will the world condemn the murder of Iran's top nuclear scientist?
t3_k3ckad	Wisconsin recount confirms Biden’s win over Trump, cementing the president’s failure to change the election results
t3_k43bes	Georgia’s Bizarre Runoff System Has Roots In Jim Crow South
t3_k3zmkj	The United States Congress Is Set to Do Something...Good and Useful? On a Bipartisan Basis?
t3_k3i7pn	Biden hires all-female senior communications team
t3_k3e43n	Retired Navy admiral behind bin Laden raid: The rest of the world is waiting for Biden
t3_k4368h	Here’s when Biden’s win becomes official — and how Trump has been trying to prevent that
t3_k3yrgo	Penn launches research center to study the impact of guaranteed income policies
t3_k43n71	Supreme Court conservatives hint at ducking ruling on legality of Trump plan to cut undocumented immigrants from Census
t3_k3qnpz	1918 Germany Has a Warning for America
t3_k4a802	Trump science adviser Scott Atlas leaving White House job
t3_k3yt2g	U.S. arms sales to UAE draw fire from 29 rights groups
t3_k3bqsn	South Dakota's governor encouraged people to go shopping the same day the state reported its highest single-day COVID-19 death total
t3_k40ky5	Is America breaking its health care promise to you?
t3_k3m243	Biden will likely require walking boot for several weeks after fracturing foot
t3_k3arud	Trump was ‘muttering, I won, I won, like ‘Mad King George’ after election defeat, report says
t3_k3agd7	"Trump campaign's legal arguments ""shredded in every court that they're dumb enough to step into"": Pennsylvania lt. governor"
t3_k3bhal	U.S. Rep. Ocasio-Cortez raises $200K after battling Jagmeet Singh in hit video game Among Us | Funds raised went toward initiatives aimed at reducing food and housing insecurity
t3_k3irr6	Official Says No Evidence of Fraud During Wisconsin County's Recount, Biden Still Wins the State
t3_k4ai82	Articles of Impeachment officially filed against Gov. DeWine
t3_k4ahpn	Austin Fusion Center Spied on Nonpolitical Cultural Events - Documents obtained by The Intercept show that law enforcement monitored an online Juneteenth celebration and a meditation event.
t3_k3q52l	Trump Spent His Holiday Weekend Bolstering His Loser Routine
t3_k3pig2	In First Post-Election TV Interview, Trump Suggests Will Never Accept He Lost Election
t3_k41t8k	Millions of workers poised to lose access to paid leave as virus spikes
t3_k3us7r	Trump lashes out as former top DHS official reasserts that election was ‘secure’
t3_k4a8u7	Scott Atlas has resigned as special adviser to President Donald Trump
t3_k4689w	Justices express qualms about sweeping computer crime law
t3_k45plr	"Joe Biden's doctor says he suffered ""hairline fractures"" in foot after he slipped while playing with dog"
t3_k48anw	Read: Trump's pardon of Michael Flynn
t3_k4akv3	Scott Atlas resigns as Trump's coronavirus adviser
t3_k42nyo	Why Joe Biden's broken foot reveals how different his White House will be from Donald Trump's
t3_k412n7	Georgia probing voter-registration groups ahead of critical U.S. Senate races
t3_k3txy5	The Note: Deadlines and dead ends pile up losses for Trump
t3_k44kur	Here are the historic firsts in Biden's administration
t3_k3x7im	What Makes A One-Term President?
t3_k41ytx	Most Republicans Say They Doubt the Election. How Many Really Mean It?
t3_k3uvr5	Biden, Harris to receive first presidential daily briefing on Monday
t3_k41pbx	SCOTUS Appeared Skeptical of Trump’s Census Memo, But Conservative Wing Also Questioned a Court’s Order Blocking It
t3_k41ymz	An immigrant to get the job done at Homeland Security
t3_k3x1p4	In Georgia, 16 Superfund Sites Are Threatened by Extreme Weather Linked to Climate Change | With climate a major issue in two Senate runoff elections, the state’s voters need look no further than coastal Brunswick for potential risks.
t3_k4ak1e	Scott Atlas resigns as coronavirus adviser to Trump
t3_k3zsy9	Yellen to Forge Economic Comeback as Biden’s Treasury Pick
t3_k3xeuj	Biden Plans Swift Moves to Protect and Advance LGBTQ Rights
t3_k44cwn	Biden names top economic team to focus on recovery from pandemic
t3_k3af03	Voters elected a record number of Black women to Congress this year — none were Republican
t3_k3lp8z	CIA Contractor Dies in Secret U.S. War in Somalia
t3_k4a9dm	Dr. Scott Atlas resigns from Trump administration
t3_k4a93o	Pennsylvania House GOP leaders: Lawmakers won't meet again this year
t3_k3mnoi	The internet has become captured by the right. The Gravel Institute is trying to take it back
t3_k3c7il	Trump said he wanted to file 'one big, beautiful lawsuit' claiming election fraud, but his lawyers told him he didn't have legal standing
t3_k45h3x	Biden-Harris announce all-female communications staff
t3_k4ah4h	Top donor allegedly sold access to key politicians for millions in foreign cash: report
t3_k3tnsd	Pennsylvania lawmaker learns of positive COVID-19 test while meeting with Trump: source
t3_k4252o	Supreme Court wary of quick ruling on Trump drive to exclude many immigrants from census
t3_k43a4w	Cuomo unveils 5-point ‘winter plan’ to combat Covid-19 in New York
t3_k49ra4	There’s Another Runoff in Georgia, and the Winner Gets a Month in Congress
t3_k3du0g	Fauci says he lacks power to get Trump to discourage holiday travel, warns of surge upon COVID surge
t3_k48b10	Biden names liberal econ team as pandemic threatens workers
t3_k38s2v	Dogs and cats living together: Joe Biden says feline will join White House pets
t3_k42lcn	Georgia probing voter-registration groups ahead of critical U.S. Senate races
t3_k3ecom	Completed Wisconsin recount confirms Biden’s win over Trump
t3_k3uaab	Op-Ed: To stamp out Trumpism, the U.S. needs to deal with these six things
t3_k40b71	What a Joe Biden Cabinet Pick Might Mean for Native Americans—and Democrats - Choosing Deb Haaland as Interior secretary would be historic. It could also bring a new community into the party fold
t3_k405qp	Biden's transition challenges grow by the day
t3_k3bcok	Trump cannot pardon himself former White House ethics lawyer says
t3_k43m5d	Georgia investigates voter registration groups
t3_k3x5m8	Biden announces economic team, confirms Janet Yellen as Treasury nominee
t3_k3a3ku	Op-Ed: How Trump is laying the groundwork for violence and unrest during Biden’s presidency
t3_k46amu	Biden to nominate Janet Yellen as US treasury secretary
t3_k40zsp	NATO must focus more on challenge of rising China, report to say
t3_k3qszl	"Ousted Trump cybersecurity official calls Rudy Giuliani's election claims ""dangerous"""
t3_k393uk	Black Lives Matter helped shape the 2020 election. The movement now has its eyes on Georgia.
t3_k3zvr9	Trump 'ashamed' to have endorsed Republican Georgia governor
t3_k4017q	Bipartisan group of senators seeks coronavirus stimulus deal
t3_k3ji2o	There was only one fraud in the 2020 election
t3_k4ajpl	Fox News Host Gives Lara Trump a 2020 Reality Check
t3_k3nzju	What it’s like to teach children about the election, and its results, in deep-red Trump country
t3_k3bfhz	GA Sec Of State Calls Out GOPers Who Won’t Condemn Death Threats: ‘Really Complicit’
t3_k41j41	Ajit Pai announces he will step down from FCC on Jan. 20
t3_k40vhc	Will Biden’s All-Women Press Team Bring an End to the Chaos?
t3_k3n99k	"Joe Biden's doctor says he suffered ""hairline fracture"" in foot after he slipped while playing with dog"
t3_k38mjd	Trump attorneys described Giuliani as 'deranged' and likened the team pushing election fraud claims to a 'clown car,' report says
t3_k451nx	George Pearsons Says Vermont’s COVID-19 Restrictions Sound ‘Like Nazism’
t3_k3khqf	Pa. lawmaker was informed of positive coronavirus test while meeting with Trump: report
t3_k49h44	Michigan restaurants urged to defy governor's COVID-19 restrictions
t3_k3yca6	Bipartisan Senate group revives coronavirus relief talks
t3_k4angv	Trump's coronavirus adviser Scott Atlas resigns
t3_k43esl	Stimulus package: Congress is back for a final sprint in 2020. Can a COVID-19 bill get done?
t3_k498tx	Biden’s pick to lead White House budget office emerges as lightning rod for GOP
