name	title
t3_k4o9qv	CDC testing shows COVID was in the US as early as December 2019
t3_k4m2l4	"Has the Penn Supreme Court Invited Scrutiny and Rebuke By Relying on ""Laches"" to Dismiss an Incovenient Complaint?"
t3_k4wv2c	Gristedes CEO: Progressives Are Regressing NYC
t3_k4ly59	"Is America to Be First, Second — or What?"
t3_k4l3br	"The Number of 'Indefinitely Confined' Wisconsin Voters Who Can Vote without IDs Increased from 60,000 in 2016 to Over 200,000 in 2020"
t3_k4zi0e	"Whistleblowers claiming USPS threw out, backdated ballots before election"
t3_k4m6uq	Nasdaq proposes board diversity requirement for listed companies
t3_k4nlr5	Race and ethnicity may be deciding factors in essential workers getting vaccine prioritization
t3_k4f7ma	Video: Snowden on big tech censoring and controlling information
t3_k41jnu	It’s Time To Dramatically Increase the Penalty for Election Fraud
t3_k4fpqm	"BLM’s National Arm Gave Little To Local Chapters While Reaping Millions, Local BLM Chapters Allege In Statement"
t3_k4c9z3	Georgia Secretary Of State Opens 250 Investigations Into ‘Credible Claims Of Illegal Voting’ - Daily Wire
t3_k4qbob	Nearly A Third Of Small Businesses In New York And New Jersey Have Shuttered
t3_k4na4f	L.A. Democrat Ate Outside At Restaurant Immediately After Voting To Ban Outdoor Dining
t3_k4nndg	"Feds to force tech giants like Netflix, Amazon and Spotify to charge and remit tax"
t3_k4ylvz	its a joke at this point
t3_k50p8c	"Michigan Poll Observer: Military Ballots Looked Like ‘Xerox Copies,’ All for Biden"
t3_k4edpy	Georgia Secretary Of State Opens 250 Investigations Into ‘Credible Claims Of Illegal Voting’
t3_k4ans8	Wisconsin Confirms Joe Biden as Winner Following Recount
t3_k4w5b9	Kamala Says Biden Will Be 'Kept Comfortable' While A Discussion Ensues About Whether To Keep Him Alive
t3_k4r2jw	"Not wearing mask in public is 'act of domestic terrorism,' LA County health officer declares"
t3_k4wzgl	California: Frontrunners for Kamala Harris Senate Seat Karen Bass and Barbara Lee both spoke highly of Fidel Castro
t3_k4mdqd	Seattle To Send First-Time Non-Violent Criminals To 'Community Panel' and Have Taxpayers Pay Their Restitution
t3_k4ezcl	Iranian Revolutionary Guards commander reported killed in drone strike
t3_k3vkvs	Media Say Biden’s Female-Led Comms Team Is A First. It’s What Trump Has Now
t3_k4crze	L.A. County Used Federal COVID Relief Funds To 'Recruit Celebrity Influencers' For Coronavirus PR Campaign
t3_k3x365	Police: Armed robbery suspect fatally shot by customer with carry permit in Northeast Philadelphia
t3_k3tm6t	Kamala Harris is slammed for pleading for people to help small businesses just months after she asked for donations to bail out jailed rioters who 'burned and looted' stores
t3_k4qy12	Tucker Carlson: Fauci admits what we all knew months ago -- schools must stay open
t3_k4biwe	"Trump Supporters Gather Outside Raffensperger's Home: ""We Are Silent No More"""
t3_k4y1yt	Bipartisan group of lawmakers present $908 billion coronavirus relief bill
t3_k3zh2l	"L.A. Health Official: Not Wearing A Mask Is ‘An Act Of Domestic Terrorism, Should Be Treated Like One’"
t3_k3x9rl	Buffalo Restaurant Puts Up ‘Walmart’ Sign to Protest Cuomo Restrictions
t3_k4nadw	LIVE: Michigan State Senate Committee on Oversight Holds Hearing on Election Issues 12/1/20
t3_k4m4sh	Biden's Neera Tanden pick signals readiness to govern by executive order
t3_k4ku09	Why is the 2nd Amendment Important?
t3_k4jhp1	Local BLM Chapters Accuse National Foundation Of Hiding ‘Untold Millions Of Dollars’ In Donations From Grassroots Activists
t3_k4j4e8	The Morning Briefing: Whaddyaknow—Enemy of the People CNN Finally Admits China Lied About Bat Flu
t3_k4mmy7	FBI Starts Requesting Election Fraud Evidence
t3_k4jrc9	‘We can do this!’ Liberal celebrities turn Georgia into Hollywood East in bid to flip Senate
t3_k4ka4q	Only the Supreme Court Can Effectively Restrain the Administrative State
t3_k4x0d1	Allison Pearson: Stop telling us to protect the NHS when the NHS is failing to protect us (Stop Lying to us?)
t3_k4qcaa	Prager U Effortlessly Explains and Destroys the 1619 Project
t3_k4ip0j	"Biden’s push for compromise on relief bill means Cuomo, de Blasio won’t get bailouts"
t3_k4oziy	Media Angry At Coinbase For Not Letting Smears Go Unanswered
t3_k42fdp	Dominion Representative for Fulton County Was Kamala Harris' Presidential Campaign Photographer
t3_k43t65	Ted Cruz Hammers Alyssa Milano On Coronavirus Aid: ‘Every Senate Dem Voted to Block Relief’
t3_k4jg6a	"Carter Page sues DOJ and FBI, calls lawsuit an 'important next step'"
t3_k3t289	Trump: 'We Don't Have Freedom of the Press in This Country -- We Have Suppression by the Press'
t3_k4zxnt	GOP state lawmakers file articles of impeached against Ohio Gov. Mike DeWine
t3_k3y7zq	"""They’ll freeze them out"": Democrats fear Senate Republicans will block Biden’s judges"
t3_k4mtha	San Jose Mayor Ignored Health Protocols During Holiday Celebration
t3_k3vnsv	"Stuck In Online Schooling, U.S. Kids Are Failing More Classes Than Ever And Will Never Recover"
t3_k48ql0	"Biden All-Female Communications Team Won't Tell Nation What's Wrong, Nation Should Already Know"
t3_k3xxlv	Neera Tanden Deletes 1100 Tweets Criticizing GOP Leaders In Anticipation Of Tight Confirmation Battle -- Biden’s pick for Director of the OMB is frantically deleting old tweets ahead of a close confirmation vote requiring GOP senators’ support.
t3_k4pzln	Nasdaq Proposes Board-Diversity Rule for Listed Companies
t3_k2pn44	Saturday Morning Political Cartoon Thread
t3_k3evv3	Retired Admiral Says He's 'Very Concerned' About Trump Loyalists at Pentagon During Biden Transition
t3_k3cwgo	Wisconsin recount adds 87 votes to Biden’s victory over Trump
t3_k3cxpt	Ossoff warns McConnell would cause paralysis in federal government if GOP holds Senate
t3_k3d06y	Bernie Sanders says GOP ‘has ceased to be a political party’ and is now a ‘cult’ in fiery rebuke of Trump fraud claims
t3_k3bu36	Trump attacks FBI for not helping him overturn election result: ‘They just move on’ | The president is furious at the FBI for not backing his election fraud claims
t3_k3ds16	Trump Now Baselessly Suggests FBI Rigged Election Against Him in First Post-Election Interview
t3_k3c3iu	Trump Suggests FBI and Justice Department Led By His Own Appointees May Be 'Involved' With Rigging Election Against Him
t3_k3dr8n	Jon Ossoff defends claim that GOP senator is a 'crook'
t3_k3bhym	Trump pushes discredited election conspiracy theories in first TV interview since defeat
t3_k3chd0	Trump: 'I'm ashamed I endorsed' Georgia Gov. Brian Kemp
t3_k3f49w	“Mad King” Trump’s Post-Election Spiral Was Even More Deranged Behind Closed Doors
t3_k3fsab	Fox News Lets Trump Spew Lies Unchecked In First Interview Since Election Day
t3_k3hxsq	Fox News Host Shreds Election Fraud Claims Trump Made on Network Hours Earlier
t3_k3arud	"Trump was ‘muttering, I won, I won, like ‘Mad King George’ after election defeat, report says"
t3_k3ckad	"Wisconsin recount confirms Biden’s win over Trump, cementing the president’s failure to change the election results"
t3_k3agd7	"Trump campaign's legal arguments ""shredded in every court that they're dumb enough to step into"": Pennsylvania lt. governor"
t3_k3ac8d	"Trump underperformed in most counties with large rallies | Many saw the rallies as a sign of big enthusiasm for Trump, but the data suggest the visits did not produce the desired impact for the president."
t3_k3bqsn	South Dakota's governor encouraged people to go shopping the same day the state reported its highest single-day COVID-19 death total
t3_k3bhal	U.S. Rep. Ocasio-Cortez raises $200K after battling Jagmeet Singh in hit video game Among Us | Funds raised went toward initiatives aimed at reducing food and housing insecurity
t3_k3igxj	Jon Ossoff Says He and Raphael Warnock Will 'Outhustle' David Perdue and Kelly Loeffler in Georgia Runoffs
t3_k38s2v	Dogs and cats living together: Joe Biden says feline will join White House pets
t3_k3kfa9	'This is propaganda': Fox News' Maria Bartiromo slammed for 'softball' Trump interview
t3_k3af03	Voters elected a record number of Black women to Congress this year — none were Republican
t3_k3e43n	Retired Navy admiral behind bin Laden raid: The rest of the world is waiting for Biden
t3_k3i5p9	Giuliani and Powell Could Not Give Evidence of ‘Explosive’ Fraud Claims When Asked by Others on Trump Team: Report
t3_k3hj1b	President-elect Joe Biden twists ankle after slipping while playing with dog
t3_k393uk	Black Lives Matter helped shape the 2020 election. The movement now has its eyes on Georgia.
t3_k3a3ku	Op-Ed: How Trump is laying the groundwork for violence and unrest during Biden’s presidency
t3_k38mjd	"Trump attorneys described Giuliani as 'deranged' and likened the team pushing election fraud claims to a 'clown car,' report says"
t3_k37wn6	"Forget about ""moving on"" from Trump — the nation can't heal without accountability"
t3_k3c7il	"Trump said he wanted to file 'one big, beautiful lawsuit' claiming election fraud, but his lawyers told him he didn't have legal standing"
t3_k37kop	"Trump was convinced he was going to win on election night in a repeat of 2016, and was 'shouting at everyone' when Fox News called Arizona for Biden"
t3_k38uer	Philadelphia does not use Dominion Voting Systems technology
t3_k3bcok	Trump cannot pardon himself former White House ethics lawyer says
t3_k3bfhz	GA Sec Of State Calls Out GOPers Who Won’t Condemn Death Threats: ‘Really Complicit’
t3_k3a68z	"Let’s Talk About Higher Wages - The nation, and the Democratic Party, desperately needs a replacement for the tired story that tax cuts drive economic growth."
t3_k39ahe	S. Dakota COVID-19 Deaths Bust Record—and Noem Tweets About Shopping
t3_k3ecom	Completed Wisconsin recount confirms Biden’s win over Trump
t3_k3du0g	"Fauci says he lacks power to get Trump to discourage holiday travel, warns of surge upon COVID surge"
t3_k3arda	Senior Republican senator accepts election was not rigged but refuses to call Biden president-elect
t3_k3jz0x	"Pressed About Election, Senior GOP Senator Admits 'I Don't Think It Was Rigged'"
t3_k3jmhf	"From Terre Haute to Tehran to your grandma, Trumpism is revealed as a death cult in the end."
t3_k391by	Lieutenant governor: Trump campaign would get its 'clock cleaned' if it appeals Pennsylvania ruling to Supreme Court
t3_k3j0yc	Source: Pa. lawmaker gets a positive test at Trump meeting
t3_k3irr6	"Official Says No Evidence of Fraud During Wisconsin County's Recount, Biden Still Wins the State"
t3_k3aqkr	Pennsylvania Supreme Court Throws Out Last Active Legal Challenge to State’s Election Results
t3_k3bame	Readers respond: Keep military gear from police
t3_k3evh9	Trump said world leaders complained to him about the election results — but most of them have already congratulated Biden
t3_k3fge7	Take a Look at What Trump Was Doing as Thousands Died of COVID-19
t3_k38izh	House Dems subpoena ICE detention facility over allegations of medical abuse
t3_k3i7pn	Biden hires all-female senior communications team
t3_k3exx6	Fauci says Christmas and New Year’s restrictions will be necessary due to holiday coronavirus wave
t3_k3gbey	Politics updates: Trump mocked for claim that 'I came up with vaccines'; Blunt won't call Biden president-elect
t3_k3ayh6	"Joe Biden plans quick moves to boost protections for LGBTQ Americans, including lifting Trump’s ban on transgender military service"
t3_k3dkne	"Wisconsin Completes Partial Presidential Recount, Biden Gains 166 Votes"
t3_k37m2b	The Republican Secretary of State for Georgia says Trump 'should leave quietly' after state's election recount confirmed Biden's win
t3_k3khjm	Pa. lawmaker gets news of positive COVID test while meeting with Trump at White House
t3_k3ecjz	Advocates Push For Resurrection Of DoJ Civil Rights Division Under Biden
t3_k38l6p	Beware going 'back to normal' thoughts – normal gave us Trump
t3_k3g7qk	Trump rails at judges as another court rejects his lawyers' claims of voter fraud
t3_k3fz09	"Trump legal team will ‘get their clock cleaned’ by Supreme Court in challenging Pennsylvania election results, official says"
t3_k3d3f8	"To this Supreme Court, religious freedom trumps public health — even amid the COVID plague - America may be back, as Joe Biden says, but at the Supreme Court, with its extremely conservative new majority, America is increasingly unrecognizable"
t3_k39jhd	Pennsylvania Supreme Court dismisses lawsuit seeking to throw out all mail ballots
t3_k3h07o	Appeals courts allows Governor Beshear to halt in-person classes at Kentucky’s religious schools
t3_k3e5ct	Fox News' Maria Bartiromo gave Trump his first TV interview since the election. It was filled with lies
t3_k3fz0x	Trump baselessly claims the FBI and DOJ may be involved in a ploy to 'rig' the election and says the agencies have been 'missing in action' in his legal battles
t3_k3hmac	Memo to Biden: Go big — use the moment to not only rebuild but to rebuild differently
t3_k3991a	Stimulus clock ticking as Congress has just 14 days to work out relief package this year
t3_k32m73	Navajo Nation's Jill Jim named to President-elect Joe Biden's COVID-19 Advisory Board
t3_k3gjao	"Trump senior aide Kushner and team heading to Saudi Arabia, Qatar"
t3_k3ji2o	There was only one fraud in the 2020 election
t3_k3d9lf	Mullen: 'National security issues do not wait' for presidential transitions
t3_k38qqi	Trump’s Election Attack Ends December 14—Whether He Knows It or Not
t3_k3h2tl	Bill that could help Black farmers reclaim millions of acres 'a step in the right direction'
t3_k3j21s	Fauci said authorities should 'close the bars and keep the schools open' to cut down on coronavirus infection spread
t3_k3khqf	Pa. lawmaker was informed of positive coronavirus test while meeting with Trump: report
t3_k3e5z7	Completed Wisconsin Recount Confirms Biden's Win Over Trump
t3_k3fdo0	Trump Complains About 'Massive Dumps' While Lying About Why He Lost
t3_k3atlw	Trump tells viewers to watch 'anything else' but Fox News ahead of his 1st interview since Election Day
t3_k3kpim	Black women helped push Democrats to the finish line in Georgia. Here's how they can do it again
t3_k3azwk	Fauci: There will 'almost certainly' be an uptick in COVID-19 cases after Thanksgiving travel
t3_k39783	"Let Trump try to defend racist, traitorous Confederates. Congress can still prevail."
t3_k3jlh5	Source: Pa. state Sen. Doug Mastriano learns of positive coronavirus test at Trump meeting
t3_k38yw1	"Americans are voting to legalize weed. It’s unlikely the next Congress will do the same. - Despite support for legalization in the House, the Senate is expected to keep holding up federal marijuana change next year."
t3_k3e29l	Lifting near-total ban on transgender people from military service among Biden plans to protect LGBTQ rights
t3_k3cg0x	Shady money bankrolls sham candidates in Florida
t3_k3er1o	Top US Cybersecurity Official Fired by Trump Calls Allegations of Voter Fraud ‘Farcical Claims’
t3_k3kqj0	Jennifer Psaki to Be Press Secretary as Biden Names All-Female Communications Team
t3_k3fk4j	Beware going 'back to normal' thoughts – normal gave us Trump
t3_k3gz0n	Jared Kushner heading to Saudi Arabia and Qatar in last ditch effort to resolve Gulf dispute
t3_k3f3b9	Wisconsin recount confirms Joe Biden’s win over Donald Trump
t3_k3h7rw	Trump falls short in Wisconsin recount he paid $3 million for
t3_k3jlp6	Recount in two Wisconsin counties reinforces Biden’s victory.
t3_k3g69n	"Trump’s first interview since losing reelection was a smorgasbord of disinformation: The president spread conspiracy theories about rigged voting machines, mail-in voting, and more."
t3_k3dnz2	Delusional Trump Says He’ll Waste ‘125%’ Of His Energy Into Already Low Energy Election Lawsuits
t3_k3bb83	Trump's lies about the election show how disinformation erodes democracy
t3_k3bgiy	"Kamala Harris Calls Chicago Nurse on Thanksgiving to Thank Her for Working on COVID-19 Frontlines — ""I've been reading about you and just all that you do in service of so many people,"" Kamala Harris told nurse Talisa Hardin."
t3_k31mpq	Trump Tells Fans to Watch ‘Anything Else’ but Fox News Ahead of His Own Fox News Interview
t3_k2zswu	"GOP Lawmaker Slams Republican Trump Loyalists, Calls MAGA Base 'Anti-American,' Says He's 'Damn Sick of It'"
t3_k3lck8	Trump Did Worse in Counties Where He Held His Final Rallies: Report
t3_k2zswu	"GOP Lawmaker Slams Republican Trump Loyalists, Calls MAGA Base 'Anti-American,' Says He's 'Damn Sick of It'"
t3_k3d1qw	Trump says his election challenges probably won't make it to the Supreme Court
t3_k30k0w	"Donald Trump's biographer says he ""cannot even succeed at being a loser"""
t3_k3g7qz	"Wisconsin Recount Confirms Biden’s Victory Over Trump, Again."
t3_k3il3b	Dr. Fauci Says U.S. May See 'Surge Upon Surge' of COVID-19 in Weeks Ahead
t3_k3akel	Pa Supreme Court Rejects Another Gop Effort To Block Certification Of Biden’s Win
t3_k3hmeh	Pressure mounts on Congress to help struggling Americans as Covid-19 surges
t3_k37g8m	Limbaugh criticizes Trump’s lawyers: They promised “blockbuster” evidence — then “nothing happened”
t3_k2ysnf	Pennsylvania Supreme Court dismisses Trump allies’ attempt to throw out millions of mail-in ballots
t3_k3lkkn	Fox News Host Pulls Apart Election Lies Trump Spouted On Network Hours Earlier
t3_k3dmky	Covid stimulus help for desperate ICU nurses is urgent. But Congress is on vacation. | Americans worry about their grocery stores running out of toilet paper. Imagine how much more worried they'll be if their hospitals run out of nurses.
t3_k3lrqt	We Won’t Forget and We Won't Forgive What Trumpists Did To America
t3_k3hach	John Nichols: Trump wants to take the internet down with him
t3_k3g5my	Trump says he is ashamed that he supported Georgia Gov. Brian Kemp
t3_k2yg1r	AOC's Among Us stream on Twitch nets $200K for charity
t3_k3e88e	"Trump, without evidence, calls the 2020 presidential election results 'the greatest fraud in the history of our country from an electoral standpoint'"
t3_k3jnqz	Source: Pa. lawmaker gets a positive test at Trump meeting
t3_k3itl5	Biden names Jen Psaki as White House press secretary as part of all female communications team
t3_k3b05b	"White House testing czar promotes mask wearing, social distancing: 'Testing alone will never solve this issue'"
t3_k3hygn	White House coronavirus adviser Deborah Birx hopes to brief Joe Biden about pandemic on Monday
t3_k37iu4	President scams his supporters
t3_k3lk06	Pennsylvania Lt. Gov. John Fetterman calls Trump's election lawsuits 'mandatorily aired absurdities' and calls out Twitter over its handling of the president's misinformation
t3_k31bt6	"With a Biden win, Bears Ears and Grand Staircase monuments may soon be restored"
t3_k3j8m1	Biden names Jen Psaki White House press secretary along with an all-female senior communications staff
t3_k35o1g	"'They’re trying to take our votes away': Trump's effort would throw out ballots from 238,000 Wisconsin voters"
t3_k3lk40	Trump loyalist Pa. State Sen. Doug Mastriano tests postive for COVID-19 after meeting Republicans at White House
t3_k3gmu1	Wisconsin election recount confirms Biden’s win over Trump
t3_k3kq0o	"The Biden Era Will Be Neither Normal Nor Boring | The next four years will be quieter than the past four, but they will still be chaotic."
t3_k3g4s5	Trump Administration Fast Tracking Executions and Trying to Bring Back Firing Squads Before Biden's Inauguration
t3_k3cbbl	Marco Rubio is already suiting up for the politics of destruction
t3_k2xnep	"Trump Calls Fox News 'Virtually Unwatchable,' Points Followers to OANN and Newsmax"
t3_k2yhfy	GOP congressman calls party's refusal to acknowledge Biden's win a 'massive grift' and says Trump 'forgot he was serving people and not himself'
t3_k3gb1n	Biden can begin quickly reversing Trump’s damaging impact on LGBTQ rights — with or without Congress
t3_k3jrbe	Biden chooses an all-female senior White House press team
t3_k3kq63	President-elect Biden chooses an all-female senior White House press team
t3_k3hv75	Up to 87 million workers could lose access to paid leave next month if Congress doesn't pass another coronavirus relief package
t3_k3c70t	Trump: 'I'm ashamed that I endorsed' Kemp in Georgia
t3_k2y6nr	"'Voters, Not Lawyers, Choose The President': Trump Team Dealt Another Blow In Court"
t3_k3iay9	Trump says it will be 'hard to get' his election claims to Supreme Court
t3_k3gab7	Trump admits 'it's hard to get to the Supreme Court'
t3_k3gzle	‘My mind will not change in six months’: Trump says he will not accept defeat whatever happens
t3_k3jloc	Biden announces all-female senior White House communications team
t3_k39byi	McDaniel Struggles To Energize Trump Supporters Convinced Of Fraud To Vote In GA Runoffs
t3_k2x8f1	New polls show Mike Pence will never be president as long as the Trumps are around
t3_k2vqbg	U.S. House to vote on ending federal ban on marijuana
t3_k39ura	"Trump Races to Weaken Environmental and Worker Protections, and Implement Other Last-Minute Policies, Before Jan. 20"
t3_k3ici2	Trump on Kemp: ‘I’m ashamed that I endorsed him’
t3_k3hjiu	Recount confirms Biden's win in Wisconsin
t3_k39lln	Trump transition show is jumping the shark
t3_k2y87s	"Pa. Supreme Court Dismisses Request From Mike Kelly And Sean Parnell To Declare Mail-In Voting Unconstitutional In State, Deny Results From 2020 Election Mail-In Ballots"
t3_k3e487	WI Recount Cements Biden’s Win And Trump’s Failure To Overturn Results
t3_k3civx	Trump on election claims: 'My mind will not change in six months'
t3_k2v21a	Trump Supporters in Georgia Ask RNC Chair Why They Should Vote in Runoffs When System Is 'Rigged'
t3_k322av	Pennsylvania supreme court throws out Republican bid to reject 2.5m mail-in votes
t3_k3gjgq	EU proposes new post-Trump alliance with U.S. in face of China threat: FT
t3_k38sk7	America’s stance on human rights has a global impact – Biden must restore credibility
t3_k3d9nz	US officials quiet on Iranian assassination amid fears of dangerous escalation
t3_k3ge98	"COVID-19, masks and the freedom to drive drunk"
t3_k3l9pr	Doctor says Biden fractured foot while playing with his dog
t3_k3cdu8	"Dane County completes presidential election recount: 91 vote reduction for Biden, 46 vote reduction for Trump | Local News"
t3_k3i9qt	Trump rails at judges as another court rejects his lawyers' claims of voter fraud
t3_k3gpvf	Donald Trump refuses to concede in first post-election TV appearance
t3_k3l3zn	Trump clings to bevy of bogus election claims
t3_k3e1s8	Let’s Talk About ‘Massive Dumps’ That Lost Trump the Presidential Election
t3_k2zx53	RNC Chair Struggles to Energize Georgia Republicans to Vote in Runoffs They See as Rigged
t3_k3ciju	Republicans turn to Biden transition as Trump's legal options dwindle
t3_k3khvs	Biden picks all women to lead the White House communications team
t3_k37ege	Make America incompetent again? Trump wants to ruin our merit-based federal jobs system.
t3_k2ylpt	"Trump's ""total fraud"" election tweets follow template he used in 2016 and 2012 against Cruz, Obama"
t3_k3kaq9	Every Senior Member Of The Biden-Harris Communications Team Will Be A Woman
t3_k3ia5q	GOP Sen Refuses To Refer To Biden As POTUS-Elect Even After Trump Lawsuits Fizzle
t3_k3cjn0	"Jill Biden, Joe’s chief protector, to step up as first lady"
t3_k3db1s	How to Counteract the Court - Congress has the power to override Supreme Court rulings based on statutory interpretations
t3_k3kbrw	Five things to know about Georgia's Senate runoffs
t3_k3iqlo	"Biden to name economic team this week, with three women in top roles to help build recovery"
t3_k3fy4g	Canada moves to limit prescription drug exports after Trump order
t3_k3i3aa	"With Fox’s Maria Bartiromo as his first post-election interviewer, Trump found a sympathetic ear and few questions"
t3_k3iv9k	Biden's goals likely exceed America's state pre-Trump Reich says
t3_k3ifqq	"Biden to nominate Tanden, Rouse to economic team: WSJ"
t3_k395za	Colorado Governor Jared Polis announces he has tested positive for COVID-19
t3_k3h153	The Supreme Court will hear its first big Computer Fraud and Abuse Act case
t3_k3e1db	The Cost of Trump’s Assault on the Press and the Truth
t3_k2wm4b	McConnell suspends in-person GOP lunches
t3_k2sxrv	"Experts Scorch Pennsylvania Senator’s ‘Nakedly, Indefensibly Anti-Democratic’ Attempt to Replace State’s Electoral College Voters"
t3_k3dxmk	Trump claims world leaders are calling to say how 'messed up' the U.S. election was despite most congratulating Biden
t3_k3b5ep	'It was a mistake that I deeply regret': Denver Mayor Michael Hancock talks about his decision to travel for Thanksgiving
t3_k2uvw9	Editorial: Why President Trump's pardon of Michael Flynn is even dirtier than the rest
t3_k3izhw	Biden and Harris announce all-female communications team
t3_k3itz3	Is Trump headed to another campaign or to a courtroom?
t3_k3lp8z	CIA Contractor Dies in Secret U.S. War in Somalia
t3_k2r7kx	"Gov. Cuomo, Dr. Fauci nominated for Time’s Person of the Year"
t3_k2xnld	Alito Slaps Down Megachurch Pastor’s Lawsuit That Claimed Obeying God Meant Ignoring COVID-19 Orders
t3_k3k9lb	President-elect Joe Biden hires all-female communications staff
t3_k2rd69	Twitter Has Flagged 200 of Trump’s Posts as ‘Disputed’ or Misleading Since Election Day. Does It Make a Difference?
t3_k3c6fh	Trump expresses doubt on whether Supreme Court will hear election cases
t3_k3i6sx	"President-Elect Joe Biden Twists Ankle While Playing With Dog, Visits Doctor"
