name	title
t3_k3vjm4	"It Is Not ‘Humane’ For The Atlantic To Sympathize With Killing Babies With Down Syndrome, Like My Little Sister -- Atlantic writer Sarah Zhang uses a rhetorical trick to create sympathy and understanding for eugenics and a modern-day genocide."
t3_k47rrl	Trump supporter who gave $2.5m to fight election fraud wants money back
t3_k4ahnj	Christy Smith Concedes To Mike Garcia In LA County Congressional Race
t3_k3ut8g	"In America’s whitest city, Black activists struggle to separate themselves from anarchists"
t3_k3n6so	Lawsuit alleges Starbucks fired Christian barista who refused to wear LGBT 'pride' shirt
t3_k3mvu7	"Nearly one-third of NY, NJ small businesses reportedly closed in 2020"
t3_k3t9yz	Biden Breaks Foot Playing with Dog Needs to Wear Walking Boot Trump Sends Message ’Get Well Soon!’
t3_k44e44	"Biden Acolytes Are Abuzz Over 'First All-Woman WH Comms Team,' They Forgot to Check in With Who's There Now"
t3_k485ut	WSJ Editorial Board: Return of the Obama Economists
t3_k4842j	Alessandra Bocchi: Ancient History Isn’t Colonialism
t3_k409ld	🔴 LIVE: Arizona State Legislature Holds Public Hearing on 2020 Election
t3_k495jv	Resurfaced photo shows Biden press sec Jen Psaki wearing hammer and sickle hat with Russian official
t3_k48aa6	"Gerard Baker: Media Treat Trump’s Team Like Dogs, Biden’s Like Puppies"
t3_k3zgid	Republican Senate Staff Say One Biden Cabinet Pick Has 'Zero Chance' at Confirmation: Neera Tanden -- 'has an endless stream of disparaging comments about the Republican Senators whose votes she’ll need'
t3_k48y91	Dr. Scott Atlas resigns as special adviser to Trump on coronavirus
t3_k3ly3h	Georgia recount in Fulton County delayed by Dominion server crash: Report
t3_k48rl9	American High Schools Go Woke: Consultants cash in on radical changes to curricula nationwide
t3_k3t1lz	"Georgia Dem Senate Candidate Ossoff Says We Need a One-Party Government During Pandemic Crisis. He apparently doesn’t like anyone to oppose Democrats. Why can’t Republicans just sit down, shut up, and do as they’re told?"
t3_k487f3	Celia Walden: I hope the courts make the right decision on puberty blockers
t3_k3nhl9	Kamala Harris slammed for tweet sucking up to small businesses after bailing out rioters
t3_k3uu1z	"FBI Requests Fraud, Disenfranchisement Evidence, Researcher Says"
t3_k3y97p	"Cornyn spokesman: Biden's pick for OMB ""stands zero chance of being confirmed"""
t3_k3yfrb	AOC’s Latest Viral Post Flunks Econ 101
t3_k3kaku	Roger Simon: Now Is the Time for All Good Men and Women to Get Off Twitter
t3_k4asyr	Beat Cops Cut Crime. A new study explores how police presence maintains public order.
t3_k49fec	Georgia Ordered to File Brief in Sidney Powell Election Suit
t3_k4ans8	Wisconsin Confirms Joe Biden as Winner Following Recount
t3_k3rvgp	"Sen. Paul Calls Out 'Anomalies in Vote Counts,' Big Tech"
t3_k481mb	Libby Purves: (UK) Now ministers hold the keys to our homes
t3_k3ufc2	Why Do UNC Schools Spend Money on Diversity Training That Doesn’t Work?
t3_k3vioi	"Trump’s Michael Flynn Pardon Is Only The Beginning Of The Justice This Nation Deserves -- The corporate media has refused to tell Americans the truth, so I will. Here are six key aspects of the case that expose the Obama-Biden administration's travesty of justice."
t3_k478fy	"In Extremely Close House Race, New York Court Demands Election Boards Stop Screwing Up Vote Counts -- All eight counties in the district ordered to preserve all ‘worksheets, tally sheets, spreadsheets or any other election tallying records’ pending court review of the chaos."
t3_k44gxh	"L.A. Health Official: Not Wearing A Mask Is ‘An Act Of Domestic Terrorism, Should Be Treated Like One’"
t3_k3b8wi	Almost Half of Violent Sex Attacks in Italy Committed By Foreigners
t3_k3z0i5	John Kerry: 'Great Reset' Will Happen
t3_k3h8r1	Judge Blocks Georgia From Wiping or Resetting Election Machines
t3_k3x5vj	It Is Not 'Humane' To Sympathize With Killing Babies With Down Syndrome
t3_k3lel5	"Professional Asshole Keith Olbermann: Prosecute Trump, Family, Supporters, Everyone"
t3_k49es4	"Businesses, Residents Left to Fend for Themselves as Anti-Cop Fervor Drives Retirement Surge"
t3_k44lvd	"Trump’s NATO Ambassador Calls Biden President-Elect, Vows ‘Seamless’ Transition"
t3_k3rwur	Dominion Server Crashes During Georgia Recount
t3_k3hinw	BREAKING: Emergency Order Granted in GA to Stop Alleged ‘Wiping of Data’ From Voting Machines
t3_k3aa7g	'LYING FOR DEMOCRATS' Candace Owens wins challenge against ‘communist’ Facebook fact-checker Politifact over Biden post false rating
t3_k3x46a	A compilation of twenty alleged election ‘facts’ that don’t pass the smell test
t3_k3ltm4	"This is a government website. Instructions surviving a nuclear blast. It literally is discussing when moving to a shelter after the blast and says to bring a mask and hand sanitizer to avoid getting COVID-19. What the in the actual hell? I mean, are they trying to be funny??"
t3_k3jicl	Republican congressional challenger set to win election by 6 votes
t3_k457sx	Pennsylvania House GOP leaders: Lawmakers won't meet again this year
t3_k47wm4	Pennsylvania Lawmakers Formally Introduce Resolution to Dispute 2020 Elections Results
t3_k3jisw	"NYC pub takes defiant stand against Gov. Cuomo, declares itself 'autonomous zone' from lockdown restrictions"
t3_k3hvde	Trump: Fox News 'Virtually Unwatchable'
t3_k3wtco	"Media stars, business magnates lead exodus from California to southern states"
t3_k39ud0	Whole Foods CEO blasts socialism: It's 'trickle-up poverty' that 'impoverishes everything'
t3_k3sxzv	President-Elect Not Decided Until Electoral College Votes: Sen. Blunt
t3_k3c7z3	"Time magazine's 'Person of the Year' nominees: Stacey Abrams, Andrew Cuomo, Dr. Fauci, Gretchen Whitmer, BLM activists"
t3_k461kt	Armed robber demands cash at Philly Wingstop. But customer with license to carry walks in — and puts perp down for good with one shot.
t3_k3zfhx	New York Times mocked for echoing Iranian talking point: ‘Carrying water for Iran’
t3_k4ac2q	"NEW: Senator Doug Mastriano proposal - SR410 - rejects Secretary Boockvar's premature certification of the presidential election, overturns the certification and – among other components – designates lawmakers with the authority to award presidential electors"
t3_k3x3bv	Another severe side effect in AstraZenica vaccine reported. AstraZenica denies link
t3_k49qth	"Slanted: Our Dumb, Incompetent, Dangerous and Awful Media"
t3_k3aodl	Forbes Shreds Democrats’ Student Debt Forgiveness Push: Makes ‘Mockery Of People Who’ve Played By The Rules’
t3_k3akeo	"""What an insensitive joke"" Kamala blasted after encouraging people to ""shop local"" amid mass restrictions"
t3_k40ar1	On Meet The Press Chuck Todd and Eric Dyson Insipidly Declare Trump Contesting Election Results is a Racist Dog Whistle
t3_k3u4wn	Fulton County recount hits snag with Dominion mobile server crash
t3_k3afdi	"As NY politicians eye new taxes on the rich, high earners eye the exits"
t3_k3elac	Japan had more suicides in October than all of the COVID-19 deaths during the pandemic
t3_k3lfcm	Biden’s Injury From Falling While Playing With Dog More Serious Than Initially Thought
t3_k3lpb3	Trump on Election Fraud: The DOJ and FBI Are 'Missing in Action'
t3_k3gq58	"Sidney Powell files emergency demand to seize all voting machines for forensic audit: Powell’s suit, filed seeks an “emergency declaratory judgment that voting machines be seized and impounded immediately for a forensic audit.”"
t3_k3hjz8	FBI requests group's election fraud data that shows 'hundreds of thousands' of fraudulent ballots
t3_k39s39	CDC Admits Their Numbers on COVID Are off by a Huge Amount.
t3_k3lml0	Fulton County recount hits snag with Dominion mobile server crash
t3_k3m9sr	Dr. Birx says Americans who gathered at Thanksgiving need to assume they're infected with COVID-19 and get tested this week
t3_k3zcmo	BREAKING: Biden Announces 6 New Major Picks For His Economic Team
t3_k3b74m	"The Obama Media Is Back -- When a Democrat is in the White House, journalists spend more time sucking up to the administration than doing anything that could even loosely be defined as reporting."
t3_k3skok	Scott Morrison demands apology from China for doctored ADF propaganda | Sky News Australia
t3_k3cu2a	Trump Expresses Doubt on Whether Supreme Court Will Hear Election Cases
t3_k4av0z	National Association of Realtors Imposes Cancel Culture on 1.4 Million People - Frontpagemag
t3_k3skdi	"‘Sheriff, hurry up please.’ Disabled man battles intruder as cops wait down the street - South Florida Sun Sentinel"
t3_k3l96s	Entertainment Industry Workers Exempt From Newsom’s Stay-At-Home Order
t3_k3m5k5	"Judge Blocks, Then Unblocks Georgia From Wiping or Resetting Election Machines"
t3_k3b6dl	"NYC Pub Borrows a Page From Leftists in Lockdown Dispute -- Declares itself an ""autonomous zone"""
t3_k3nbdh	Study: Media’s Suppression of 8 Issues Likely Swung Election to Biden
t3_k3ypz2	Ronald Reagan on Prosperity: Free Enterprise Makes America Prosperous
t3_k340al	US Closed 10 Bases in Afghanistan as Part of Withdrawal
t3_k49ggq	King v Whitmer has been amended and more exhibits have been provided to the courts.
t3_k3fz23	"Candace Owens Challenges Fact Checker, and Wins"
t3_k3n064	"D'oh, de Blasio: On second thought, let's open the schools again"
t3_k3ae8i	GOP Iowa congressional challenger Miller-Meeks expected to win by 6 votes after recount
t3_k3zftt	We need to act boldly now if we are to avoid economy-wide lockdowns to halt climate change
t3_k3zdvy	Fans who want to see Rockefeller Center Christmas tree will need tickets: mayor
t3_k48ypw	"Rumored 2024 GOP Presidential Hopefuls Test Appeal Stumping In Georgia Senate Runoffs: Mike Pence, Marco Rubio, Tom Cotton, Rick Scott, Tim Scott, Nikki Haley, Josh Hawley, Larry Hogan"
t3_k3z90v	Trump presses 'hapless' Georgia governor to overrule secretary of state on signature matching
t3_k48v6s	Ossoff’s embrace of Bernie Sanders highlights shift for Georgia Democrats
t3_k3v3sg	Wales BANS pubs from selling alcoholic drinks and brings in 6pm CURFEW
t3_k3fsn9	Trump: ‘They used COVID as a means to stuff the ballot boxes’
t3_k48i0m	Benedict Spence: Using celebs to advertise vaccines is a sign of a desperate governing class
t3_k43rzj	Dallas Restaurant Owner Explains Why He Scolded Black Women for Twerking
t3_k3o5uf	Japan Is Only One Country Where the Lockdowns Suicide Rate Is Outpacing the Pandemic
t3_k3ohws	THIRD ORDER - PEARSON v. KEMP 11.29.2020.pdf
t3_k47whj	Biden’s Pick For Homeland Security Chief ‘Exerted Improper Influence’ In Visa Program For Rich Foreign Investors
t3_k3fqs1	BOMBSHELL: FBI to Investigate Evidence of Illegal Ballots Uncovered by Private Group
t3_k36a7i	At least 14 are shot in New York City over the Thanksgiving holiday as gun violence soars 102%
t3_k3phcw	"REPORT: Lt Gen McInerney Reports US Special Forces Attacked CIA Server Farm In Germany In Server Seizure Operation, 5 Soldiers Killed, Servers Secured - Conservative News Outlet"
t3_k3ia9x	NYC schools to open again. It seems like children are safer at school then home. Just like the studies have said over and over...
t3_k4765k	Big Tech employees complaining about San Francisco
t3_k3c8oj	NY Times taken to woodshed for claiming Iran's nuclear program is 'peaceful': 'Is this an Iranian paper?'
t3_k3z9mn	Moderna Submits Covid-19 Vaccine For Emergency Approval
t3_k3v1yi	Legitimacy of Biden Win Buried by Objective Data | The American Spectator | USA News and PoliticsThe American Spectator | USA News and Politics
t3_k3eevo	"Trump Makes His Post-Election Move, Purges Pentagon's Outside Advisory Board, Kissinger and Albright Get the Boot"
t3_k3av2k	Massive Islamic Terrorist Attack In Africa Results In Deaths Of At Least 110 People: Report
t3_k3a5kw	Pennsylvania Bombshell: Biden 99.4% vs. Trump 0.6%
t3_k39tlx	"Data expert: Vote tabulation feeds in PA, GA show 'anomalies' suggesting Trump missing votes"
t3_k36noz	"California: ISIS Jihadi Stabs Four in University Classroom, University Blames Toxic Masculinity"
t3_k344zi	Now It’s India: China Blames India For Origin Of COVID-19
t3_k3jnha	Breaking...Lin Wood gets order to stop wiping of GA machines then it's REVERSED
t3_k3n0ys	Killing of nuke chief was done entirely by remote control -- Iranian report
t3_k3gdv3	"UAE said blocking visas for 11 Muslim countries, as Israelis allowed in freely"
t3_k3l7zy	Rep.-Elect Burgess Owens Announces ‘Freedom Force’ To Fight Leftist ‘Squad’
t3_k3ngg7	Democrat Rashida Tlaib Promotes Slogan Associated With Calling For Elimination Of Israel
t3_k49b7q	‘We Just Can’t Do It This Year’: CNN Medical Analyst Nixes Christmas
t3_k39e0u	Jon Voight Warns 'We Are in Great Danger if We Fall Under a Biden Administration'
t3_k3lwp9	Biden’s Injury From Falling While Playing With Dog More Serious Than Initially Thought
t3_k37fx4	Over 150 arrested in London anti-lockdown protests
t3_k48ghw	Diana Zhang: Three Ways America’s Mainstream Media Resemble Communist Media
t3_k3es4d	Michigan County Commissioner Backs Gretchen Whitmer Impeachment: ‘Cannot Step on Constitution’
t3_k3o62k	"FBI Requests Fraud, Disenfranchisement Evidence, Researcher Says"
t3_k3ji7b	"Los Angeles enacts new lockdown, report says county spent millions of CARES Act funds on PR firms"
t3_k38wma	Hayward: Coronavirus Helps China’s Totalitarian Social Credit System Spread Worldwide
t3_k3k0gm	Biden Announces All-Female Senior WH Press Team
t3_k32d4e	Former GOP Rep. David Valadao flips California House seat. It's the third pickup in the state for Republicans.
t3_k3bosz	"In Dangerous Decision, SCOTUS Rules First Amendment Can Stay"
t3_k3cpdz	Pennsylvania Justices Accused of Playing Politics After Dismissing Challenge Over Absentee Ballots
t3_k3epku	Johns Hopkins academic: CDC data shows COVID hasn’t increased US death rate
t3_k46btk	"Meghan McCain Criticizes Bill Kristol Over His Support For Neera Tanden: ""Please don’t insult me and say as a serious conservative I should be supporting the head of the hard-left advocacy group Center for American Progress."""
t3_k3if5s	More people died from suicide in Japan last month than from Coronavirus in the country year to date – new report
t3_k3h951	"FBI Requests Fraud, Disenfranchisement Evidence, Researcher Says"
t3_k475wv	Media Matters: From CTr to Shareblue: How Paid Shills Attempt to Distort the Truth
t3_k2xv2h	"Candace Owens Challenges Fact-Checker, And Wins"
t3_k3b0k0	Can someone explain to me how this can be a thing: Deported veterans
t3_k2ydmj	Supreme Court agrees to hear Trump’s plan to remove non-citizens from census
t3_k3b7re	"‘Reckless, Provocative, and Illegal’ – Bernie Sanders Laments Assassination of Iran Nuclear Scientist"
t3_k3afy8	"AFFIDAVIT: In Michigan the votes were counted by decimals in a scheme called a ""Ranked Choice Voting Algorithm"" -- 1 vote per citizen? No, you get .0534 of a vote"
t3_k2vlb2	"Ohio certifies Presidential election results, Trump wins OH"
t3_k2yf03	"Mouse utopia study in which a colony of mice were given everything to survive without any environmental adversity. Females became dominant, even killing their young. Males because passive and feminized. The colony eventually died out as they stopped reproducing."
t3_k44yh0	"SEC Names Sarah Fuller ""Co-Special Teams Player of the Week"" For Her Amazing 26-Yard Kickoff"
t3_k37n9a	Hundreds of BLM Protesters Gather Outside LA Mayor Eric Garcetti’s Home. This is the 5th straight day protesters have shown up to Garcetti’s home to protest. They say they are here to protest the consideration of Eric Garcetti to the media’s fake president-elect Joe Biden’s so-called “cabinet.”
t3_k3wud8	The Case Against Sally Yates
t3_k3o6n7	1/ On 23 jan @c_drosten et al published their paper describing the de facto industry standard protocol for detection of #SARSCoV2 by PCR Now an intl. team of top experts asks for RETRACTION. The protocol is fatally flawed: it can NOT DETECT the virus. #retractionpaper #PCRGATE
t3_k3la1r	Black Fragility? A bestselling book offers a prescription for race relations that casts whites as sinners and blacks as children.
t3_k3a8u0	"Iran’s Mohsen Fakhrizadeh killed by 62-person hit squad, reports say"
t3_k363y1	Sidney Powell to Newsmax TV: Dominion Contracts Warrant Criminal Probe
t3_k47fd7	Seattle homicides highest in over a decade as council cuts police budget
t3_k39dsf	Pennsylvania Supreme Court Tosses Challenge to Vote-by-Mail Because It Came Too Late
t3_k3b86w	Pennsylvania Supreme Court rejects GOP challenge after judge said it had 'likelihood to succeed'
t3_k34595	U.S. Sends Air Craft Carrier To Persian Gulf As Iran Vows Retaliation For Killing Of Scientist
t3_k3g0cy	Phillip Kline on Twitter: After learning that hundreds of thousands of ballots are potentially fraudulent- The FBI has now requested to look at our data. See statement below:
t3_k46s8y	CNN uses Biden’s foot injury to fawn over transparency of incoming administration
t3_k3fm3e	How an Elite 62-Person Hit Squad Ambushed &amp; Killed Iran's Top Nuclear Scientist
t3_k3b90k	Trump officials claim legacy of 'groundwork' for nuclear breakthrough
t3_k343i7	The FBI Spied on Carter Page. Now He’s Suing Them For $75 Million.
t3_k3vicl	"""COVID-19 Data Collection, Comorbidity &amp; Federal Law: A Historical Retrospective"""
t3_k340wi	OFFICIAL RECALL PETITIONS: Recall Gavin Newsom. Please sign
t3_k32co8	NY Times taken to woodshed for claiming Iran's nuclear program is 'peaceful': 'Is this an Iranian paper?'
t3_k2s248	"Police: Boy, 13, home alone calls parents about man breaking in. Boy's dad, an off-duty cop, arrives and fatally shoots alleged intruder."
t3_k47afl	Sarah Fuller Named The SEC Special Teams Player Of The Week After Kicking The Ball 30 Yards
t3_k478t8	Melania Trump Stuns With White House Christmas Decorations Yet Again
t3_k2rrd5	"Whole Foods CEO blasts socialism, explains how universities corrupt young people: 'Trickle-up poverty'"
t3_k2xwcs	"Pennsylvania Supreme Court vacates lower court’s order to delay certification, dismisses Rep. Mike Kelly’s case"
t3_k46y7f	Georgia Senate runoff spurs election probe of groups trying to register out-of-state voters
t3_k47w3s	Gideon Rachman: The perils and pitfalls of multiracial multi-religious societies
t3_k39q3u	"Joe Biden Cabinet Prioritizes Establishment Experience, Obama Administration Figures"
t3_k46e4x	Conservative justices quiz Trump administration on bid to remove illegal immigrants from Census with Amy Coney Barrett saying history 'really cuts against your position'
t3_k3e7qd	"A Voter Fraud Investigation Group has group also found more than 20,000 people in Georgia and more than 8,000 people in Nevada who cast ballots although they no longer met the residency requirements of their respective states."
t3_k39tab	Here Are Some More Troubling Questions About the Election Numbers
t3_k2vlyu	Looks Like The Shills Will Be Making OverTime This Weekend
t3_k342p4	Report: Public School Enrollment Dropping Across The Country
t3_k44jvi	"Jennifer Rubin calls Biden's cabinet picks 'center-right', impressing conservative policy wonks"
t3_k43l9y	Georgia Probing Liberal Voter-Registration Groups Ahead of Critical Senate Races
t3_k4885v	Reasons why the 2020 presidential election is deeply puzzling
t3_k2zcn3	Miller-Meeks (R) holds 6 vote lead over Hart (D) after recount for Iowa’s 2nd Congressional District
t3_k30jtg	NYC bar in COVID-19 hotspot refuses to shut down after state yanks liquor license
t3_k32mfc	Pennsylvania Bombshell: Biden 99.4% vs. Trump 0.6% Stunning testimony that the media has dutifully ignored.
t3_k2z1v2	Pennsylvania Supreme Court Tosses Trump Ally Mike Kelly’s Constitutional Challenge to the 2020 Election
t3_k447ms	Democrats Are Finally Dissecting Their Overall Awful 2020 Election Performance
t3_k36qda	Biden's Leading CIA Director Pick Backed Torture
t3_k42tpl	Georgia's Fulton County Recount Delayed After Dominion Server Crash
t3_k454ir	Disney to Have Mickey Mouse campaign for the Dems in Georgia runoff
t3_k3hi2c	"'Essential' Businesses Are No Longer Safe Under State's New Lockdown, Now Even Grocery Stores Can Be Forced To Close"
t3_k43tfe	Team Blue and Team Red still enthusiastically embrace authoritarianism and scorn our [Libertarians'] insistence on letting people run their own lives.
t3_k439uq	Socialist Transgender Ex-Prostitute Running For City Council In New York
t3_k4494y	"Hillary Clinton Congratulates Vanderbilt Football Team’s Female Kicker—After She Kicks Off to 35-Yard Line (After losing the game 41-0 to Missouri, the next day Vanderbilt fired their 0-8 coach.)"
t3_k445pf	Media Ignore ‘Devoutly Religious’ Biden’s Embarrassing Bible Gaffe After Freaking Out About Trump’s ‘Two Corinthians’ Remark -- Media blatantly ignores Joe Biden’s Biblical flub that would be non-stop headline fodder if uttered by the current president.
t3_k452jb	"The Tactics of Communism, Then and Now"
t3_k34j2p	Report: Atlanta sees highest homicide rate since 1990
t3_k4770m	Trump: 'We Don't Have Freedom of the Press in This Country -- We Have Suppression by the Press'
t3_k3ax3m	Michael Flynn: 'The President Has Clear Paths to Victory'
t3_k3abwt	The Citizens of UK to plant trees to mark Queen Elizabeth's 70 years on throne | FlashNews
t3_k3enwh	"Maricopa County, AZ county recorder on election security. Operates on “faith”"
t3_k2xj6r	"Ohio certifies presidential election results, Trump win"
t3_k438kt	BIZARRE: Georgia Govt Lawyers Defended Dominion's 'Trade Secrets' to Stop Forensic Analysis of Machines/Software
t3_k47fo1	Actor Laverne Cox Claims to Be Victim of Transphobic Attack in L.A.
t3_k3iqmu	FBI Jumps Into Action -- Ignores MASSIVE Voter Fraud and Instead Investigates Threats Against Political Hack Brad Raffensperger
t3_k47bis	"Gingrich: 'It's a Very Great Danger That' Democrats 'Will Find a Way to Steal' GA Senate Election -- “The Democrats have nominated two left-wingers who, in an honest election, could not possibly win.”"
t3_k3wz9h	Perverse Freedom | Mark T. Mitchell
t3_k2zqhw	Trump Officially Wins Ohio As State Certifies Election Results
t3_k3wsnx	Why Iran Is Getting the Bomb
t3_k46bbv	Anti free press liberals be like
t3_k37qoe	Evidence for Journalists: A Short Course. The meaning of evidence and what is required to gather it is lost on the cynically ignorant media.
t3_k45j46	Viral video showing a man assaulting a police officer takes a very unexpected turn
t3_k44rgd	"Don’t leave Facebook, Twitter to the left"
t3_k2zt4f	Pennsylvania Supreme Court tosses GOP congressman’s suit seeking to throw out all ballots cast by mail
t3_k3afay	USS Nimitz to Gulf as Iran War Threat Grows
t3_k32phv	Thouands of Fake Votes Found at Wisconsin Recount — Photos and Report from GOP Observer
t3_k3zfke	"San Jose mayor, police chief urge county to change sanctuary city policy"
t3_k3jlm9	Matthew Scott: (UK) Lockdown is being policed in an entirely disproportionate way
t3_k2wfag	"VIDEO: BBQ restaurant owner defies COVID lockdown, arrested, hit with 13 charges and fines; supporters stand with him"
t3_k3gldo	Trump’s Payroll-Tax Deferral Creates Predicament for Congress
t3_k2zlqx	Sajid Javid: We must not allow woke activists to stop us confronting Islamic extremism
t3_k39rzc	Iran blames Israel for Fakhrizadeh's death. So now what?
t3_k44lut	"Female Kicker On Vanderbilt Football Team Explains Why She Was ‘Pissed Off’ At Players, Details Her Halftime Speech"
t3_k44kzw	Crime Hiding Crime: A Motive for Stealing the Election
t3_k473cp	"Amazon Hires 1,400 Workers a Day: Any Regrets, Alexandria Ocasio-Cortez?"
t3_k4642s	"Pope names Governor Cuomo as the next Catholic Saint. His saint name will be “Saint COVID”, and he will immediately be the patron saint of nursing home patients."
t3_k46kn4	"Rudy Giuliani: Trump Team Looking Past Election Lawsuits, Will Lobby State Houses​"
t3_k42zm4	San Francisco Should Pay Yosemite the Dam Rent
t3_k45ywe	UPDATE: Biden ankle injury caused by tripping over a box of ballots in his basement
t3_k45yl5	Pennsylvania Lawmakers Formally Introduce Resolution to Dispute 2020 Elections Results
t3_k43mcu	Reasons why the 2020 presidential election is deeply puzzling | Spectator USA
t3_k2ut3m	Supreme Court Blocks Covid-19 Restrictions on Religious Services in New York
t3_k3349a	End of recount maintains Miller-Meeks' lead in Iowa 2nd District U.S. House race; margin just 6 votes
t3_k45urv	Report Finds Biden’s Campaign Received Six Times More Dark Money Than Trump’s
t3_k459c2	Voters rejected radical Joe Biden and he now has a mandate to work with moderate Republicans
t3_k33xbd	Pennsylvania Supreme Court tosses GOP congressman’s suit seeking to throw out all ballots cast by mail
t3_k341lz	NYC Sheriffs Dept Busts Underground Nightclub Packed With Hundreds Of People
t3_k3ljh7	Bias in r/politics Sources
t3_k2rr24	"The 'smartest man in the room' has joined Sidney Powell's team -- Navid Keshavarz-Nia, an expert witness, stated under oath that there was massive computer fraud in the 2020 election, all of it intended to secure a victory for Joe Biden."
t3_k2y9pk	"Mark Zuckerberg Funded Group Comes Into Spotlight in Election-Related Cases. ""The group received hundreds of millions of dollars from the Facebook CEO and is accused in lawsuits of violating state laws in several battleground states. """
t3_k43r58	‘The Squad’ Adds San Diego Weatherman Brick Tamland
t3_k2wekr	Ted Cruz hits ex-CIA boss John Brennan over 'bizarre' support of Iran following killing of nuclear scientist
t3_k2lwsd	CA Pastor Reclassifies Church as 'Strip Club' So That It Can Open for Services During COVID (Not the Bee)
