name	title
t3_k44ezr	Horowitz: New analysis shows Biden winning nearly impossible margins on mail-in ballots in Pennsylvania
t3_k2twr2	Liberals Heads Explode After CNN Video Surfaces Showing Path for Trump 2020 Win
t3_k46ehh	"Sidney Powell Has the Receipts: ""We've got pictures of the check stubs paid to people to ballot harvest"""
t3_k3460z	NBC Acknowledges Severe Isolation Facing Nursing Home Patients Due To COVID-19 Concerns
t3_k340u1	UK Testing Error Wrongly Tells 1,300 People They Have Coronavirus
t3_k345jj	Los Angeles County Issues Stay-At-Home Order, Bans Most Gatherings Excluding Protests And Church Services
t3_k45bu2	Horowitz: New analysis shows Biden winning nearly impossible margins on mail-in ballots in Pennsylvania
t3_k341xh	Alito Sets Deadline For New Jersey To Respond In Religious Freedom Case
t3_k34k1l	Calif. officials evict crowds of activists illegally occupying vacant homes
t3_k3zaxp	Democrats Are Currently Stealing a House Seat in New York
t3_k449zo	Trump's multiple paths to victory
t3_k41a5u	The Problem with Unskilled Immigration in the 21st Century
t3_k42z6e	Democrats face accusations of fraud in House race after 28,000-vote lead on election night erased by judge and mail-in ballots
t3_k3434g	New Details Emerge About Operation That Eliminated Iranian Nuclear Weapons Scientist Mohsen Fakhrizadeh
t3_k46lfq	"PA Judge Rules GOP Lawsuit Has ""Established A Likelihood to Succeed"""
t3_k33ze3	High Court Takes Up Census Case, as Other Count Issues Loom
t3_k3483t	Dr. Navid Keshavarz-Nia: “I conclude with high confidence that the election 2020 data were altered in all battleground states resulting in a hundreds of thousands of votes that were cast for President Trump to be transferred to Vice President Biden.The evidence is overwhelming and incontrovertible.”
t3_k3xywu	Democrats Rejoice After Kamala Harris Finds Special Potion To Cure Biden’s Injured Ankle
t3_k3vcbf	The Sketchy Claims of the Case for a Mask Mandate
t3_k4124o	Pennsylvania Gestapo reminds you that you should be hiding in your basements.
t3_k427r3	Gab
t3_k2wgb5	‘Sovereign Citizens’ are claiming ownership of occupied Seattle mansions
t3_k33zq4	Trump Nominates a Top Bank Regulator as Biden Starts Transition
t3_k32nf0	Just like Biden: Chavez was losing on election night...
t3_k33yan	The PA State Legislature Hearing Was a Powerful Moment for the Trump Legal Team
t3_k30luj	"Pennsylvania Supreme Court Dismisses Challenge to Mail-in Voting on Equitable Doctrine of ""Laches"""
t3_k43b7v	During Republican hearing on voter fraud, Arizona Sec. of State rushes through election certification! AZ needs to protest now!
t3_k2zcmc	Pa. Supreme Court Dismisses Request From Mike Kelly And Sean Parnell To Declare Mail-In Voting Unconstitutional In State, Deny Results From 2020 Election Mail-In Ballots
t3_k31vtx	Zuckerberg-Funded Group Comes Into Spotlight in Election-Related Court Cases
t3_k2uss7	New Lawsuit Asks Wisconsin Supreme Court to Declare All Drop-Box Ballots Illegal and Block Certification
t3_k2u8uo	US economy grows at record 33.1%, according to second estimate
t3_k2pwq9	Politicians had officers 'stand down' to rioters but 'go after' law-abiding citizens
t3_k37x25	Bette Midler: Doctors Should Sue over SCOTUS Protecting Rights of 'Super Spreader' Churches, Synagogues
t3_k2zl98	Michigan targeted with another election-fraud lawsuit -- 'The pattern of lawlessness was so pervasive and widespread'
t3_k2yrpr	Chicago Mayor Lori Lightfoot's 'pandemic budget' passes: agreeing to pilot a program that would have mental health workers respond to certain emergency calls, rather than police.
t3_k2nbot	"WATCH: Olbermann says he wants so many Trump allies jailed ""that we have to convert Trump buildings"" into ""Trump prisons"""
t3_k3ua6r	Joe Biden fractures foot after slipping while playing with dog
t3_k2rhbn	When Che Guevara and Castro Wished Us a Happy Thanksgiving -- On Black Friday 1962 Castro’s agents had targeted Macy’s, Gimbels, Bloomingdales, and Manhattan’s Grand Central Station with a dozen incendiary devices and 500 kilos of TNT. J. Edgar Hoover’s FBI foiled the plan.
t3_k3yha6	Giuliani and Powell Could Not Give Evidence of ‘Explosive’ Fraud Claims When Asked by Others on Trump Team: Report
t3_k2mh5u	Democrats are scrambling to explain away the inroads Republicans have made with minorities, as evidenced in the election results. Instead of listening to the concerns of the Black and Hispanic voters who voted for Trump — Democrats are instead blaming them.
t3_k2rio0	“Dominion, Now the Largest or Second Largest Voting System Company, Is Foreign Controlled and Depends Upon Secret Source Code Created and Owned by Smartmatic, a Foreign Controlled Company With Ties to The Venezuelan Government Led by Hugo Chavez“
t3_k2yz6l	Illinois borrows 2 billion dollars from Fed to cover lockdown costs. Debt likely will be downgraded to junk soon. Chicago locks down again to ensure complete destruction.
t3_k2zkp6	Britons to get 'vaccine stamps' in their passports before overseas travel
t3_k2wf55	"A thorough breakdown of Sidney Powell's ""Kraken"" Lawsuits"
t3_k2yc1d	Pa. Supreme Court Dismisses Request From Mike Kelly And Sean Parnell To Declare Mail-In Voting Unconstitutional In State, Deny Results From 2020 Election Mail-In Ballots
t3_k34w50	Sen. Cruz Responds to John Brennan's 'Bizarre' Reaction to Iranian Assassination
t3_k3tovr	Republican Sens. Tom Cotton and John Cornyn slam Biden cabinet picks, suggesting confirmation fight
t3_k2wt60	Michigan Complaint: Vote Counts 'Not Normal'
t3_k30nte	‘Mossad’ assassins blow hole in Iran’s nuclear programme
t3_k3x8vi	Why Hasn't Kamala Harris Resigned From the U.S. Senate Yet?
t3_k2u62j	Trump’s Legal Team to Participate in Public ‘Hearing on Election Integrity’ with Arizona Lawmakers
t3_k2m7vc	"Art Critic: ""Republicanism is no longer a political problem; Republicanism is a social problem. It must be treated in the same way coronavirus is treated: it has to be isolated and snuffed-out by repressing it in about 70% of the general population."""
t3_k33oij	Senate Democrats Could Force Brett Kavanaugh To Resign By Pushing For Perjury Investigation, Report Says
t3_k3rh69	As if Parents Weren't Confused Enough, De Blasio Changes His Mind AGAIN on Schools
t3_k419pl	BLOCKED EVERYWHERE: How Trump won the 2020 Election. —— Try copying and pasting the link in FB messenger to a friend and watch it not go through. This is next level censorship on a grand scale and is quite telling!! Try it yourself!
t3_k2zevk	Japan Had More Suicides in October Than COVID Deaths So Far This Year
t3_k2ubf1	Rabid Far-Leftists Try To Cancel Eric Clapton Because 2020 Isn’t Over Yet
t3_k3mc7z	Brazilian President: There is widespread evidence of voting fraud in US | One America News Network
t3_k2q0q7	Pennsylvania Judge Rules 2020 PA Election Likely Unconstitutional – Trump Case “Likely to Succeed”
t3_k2on81	Sidney Powell has photos of check stubs to pay ballot harvesters
t3_k30sig	Black Lives Matter Leader Says Joe Biden ‘Capitalized On Our Efforts To Defund The Police’
t3_k2w56t	Schools Ban Classic Novels As Much For Laziness And Ignorance As Politics - Removing time-tested classics and assigning easy fiction with leftist themes fails in cultivating any love of reading
t3_k3ts3g	Trump Supporters Have A Cross To Bear
t3_k2wfns	Carter Page sues FBI, DOJ, and individuals behind FISA abuse
t3_k2x18b	Big Tech leaving San Francisco area
t3_k3shne	Crowd gasps after learning a spike of votes in PA had 600k votes for Biden and only 3,200 for Trump
t3_k2x8wf	Judge rules pro-Trump case established a 'likelihood to succeed on the merits' in Pennsylvania
t3_k34w5s	Two Dead in California After Local Authorities Ignore ICE Detainer for Known Criminal Alien
t3_k3rzbt	Report: 'Smartest man in the room' has joined Sidney Powell's team
t3_k3qpbl	Police storm church broadcast in Milton Keynes over 'loud music'
t3_k2xzrl	State Court Judge Finds Use of Mail-In Voting In Pennsylvania Likely Violated State's Constitution
t3_k344pu	ERICKSON: The Puritan Work Ethic
t3_k30raf	NYC: Wealthy hire protection on the streets after spike in violent attacks
t3_k30q7v	Looks like New Mexico's Lockdowns are going well
t3_k2qrfi	Oxford University students vote to ban beef, lamb from campus eateries citing the need to be a leader in the fight against climate change.
t3_k2v31g	General Flynn Finally free to speak. First interview after pardon
t3_k3rdlh	'Get well soon': Donald Trump's message after Joe Biden fractures his foot while playing with dog
t3_k2wwiz	The European Court of Justice (ECJ) has determined that Italy must pay for the dependents of migrants even if they do not live in the European Union.
t3_k3pg69	Report: Joe Biden Suffers Injury; Heads to Orthopedist
t3_k2o2q1	195 Million Chinese Students Are In School. Why Aren’t Our Kids? -- Right now in China, 195 million students K-12 are learning in-person in Chinese public schools. Meanwhile, millions of American public school students are learning in a failed remote system.
t3_k2pp1n	Emergency Wisconsin Lawsuit To Stop Certification Challenges Nearly 160,000 Votes
t3_k2nc9m	UPDATE on Pennsylvania: Judge predicts Trump will win the lawsuit on unconstitutional mail-in ballots
t3_j9346j	/r/Conservative Official Political Discord
t3_k4m5n4	Hate Mail of the Month - November Edition!
t3_k4vjv7	Attorney General Bill Barr says no evidence of widespread fraud in 2020 election
t3_k4lgz3	L.A. Democrat Ate Outside At Restaurant Immediately After Voting To Ban Outdoor Dining
t3_k4y9ob	"Justice Department investigating 'bribery conspiracy scheme' involving presidential pardon, documents show"
t3_k4k8d4	"Far-left actress Bette Midler rips conservatives, wealthy people 'sailing by us in their yachts.' Then she's reminded of her bank account."
t3_k4w53o	AG Barr: No evidence of fraud that would change election outcome
t3_k4p8dd	😳 Project Veritas has been listening in on internal CNN calls for months and is about to release the recordings tonight
t3_k4mxrb	Mathematician Who Claimed Voter Fraud to Arizona Legislature Suspended From Twitter
t3_k4k96r	Sen. Joe Manchin takes dig at fellow Democrat AOC: 'She's more active on Twitter than anything else'
t3_k4iskw	"Republican Florida Gov. Ron DeSantis said that public schools will remain open, calling those who advocate for school closings “today’s flat earthers.” “Closing schools due to coronavirus is probably the biggest public health blunder in modern American history”"
t3_k4k8is	CNN: Leaked documents prove that 'China underreported COVID-19 numbers'
t3_k4e3oe	Mark Zuckerberg and his wife donated at least $400 million to a group that has now been accused of contributing to constitutional violations in key battleground states.
t3_k4xakx	Bill Barr: No Evidence Of Widespread Voter Fraud
t3_k4nlzx	GOP Officially Flips Fourteenth Congressional Seat
t3_k4lpm5	"The paid shareblue trolls in this sub are using a tactic called ""forum sliding"": in wich they prevent damaging articles from reaching the top by flooding the que with less important stuff"
t3_k4ujm8	Watch: Arizona Gov. Doug Ducey Appears to Decline Call from President Trump
t3_k4inlh	"LA County supervisor Sheila Kuehl dines outdoors just hours after voting to ban the practice. Earlier that day at a board of supervisors meeting, Kuehl called the outdoor dining “a most dangerous situation” with regard to the possible spread of COVID-19."
t3_k4oytf	Nevada Judge Orders Inspection of Election Equipment
t3_k4kxnz	"Illegal Money-for-Votes Raffles Conducted in Arizona Wisconsin, and Minnesota as well as Nevada"
t3_k4w4cx	BREAKING - SEC filings: The parent company of Dominion Voting Systems received $400 million from an Investment Bank in Switzerland that is 75% owned by the Chinese government.
t3_k4qqft	BREAKING: Investigation Reveals Chinese Govt-Tied Bank Has Majority Stake in Dominion Voting Systems
t3_k4oz1f	CNN Finally Discovers China Uses U.S. Media To Attack The United States
t3_k4zh65	"Congressman-Elect: ‘Americans Just Want to be Left Alone,’ Politicians ‘Aren’t Smart Enough’ to Make Decisions for Them"
t3_k4qe9z	James O'keefe of Project Veritas has been secretly recording the CNN morning meeting conference calls for months. Revealed himself on the call with Jeff Zucker. Tapes to release tonight at 7:00pm
t3_k4lsk8	Puberty blockers: Under-16s 'unlikely' to be able to give informed consent
t3_k4wp0g	Fox News' Daytime Ratings Fall 32%
t3_k4ln0f	"Two charged in Los Angeles for allegedly submitting more than 8,000 fraudulent voter registrations on behalf of homeless people, fictitious identities, and dead voters from July to October 2020"
t3_k4m06h	The Arizona legislature is calling for a *special session* to assess fraud and determine who gets Arizona’s 11 electoral college
t3_k4mcl3	CNN Finally Admits China Lied About Bat Flu
t3_k4k8s4	Supreme Court SLAPS DOWN Cuomo's COVID restrictions on religious gatherings
t3_k4qhdi	Twitter Suspends Account of Mathematician Who Submitted Voter Fraud Investigation to Arizona Legislature
t3_k4mils	"Data Expert: Up To 300,000 Fake People Voted In Arizona Election, ""Biggest Fraud"" In History"
t3_k4fxgd	"Still, no Twitter action a day later after international condemnation of an official state-run Chinese Twitter account posting a doctored photo of an Australian soldier holding a bloody knife on a child's throat. Not even a fact check tag."
t3_k4m1p1	"Powell: Election fraud witnesses are being threatened, beaten up"
t3_k4wmkw	San Jose Mayor Said to Cancel Thanksgiving Due to COVID. He Celebrated with Other People Anyway.
t3_k4jrwh	Donald Trump Supporters Hold 'Stop the Steal' Rally Outside AZ Hearing on Election Integrity
t3_k4jx40	Georgia Secretary Of State Opens 250 Investigations Into ‘Credible Claims Of Illegal Voting’
t3_k4ykxt	Barr likely ‘to be fired’ after disputing Trump’s voter fraud claims
t3_k4hy75	Trump Ballots Defaulted and Switched to Biden Votes on Dominion System: Maricopa GOP Chairwoman
t3_k4jxmq	"Trump campaign to file Wisconsin lawsuit, claiming 'abuse' of absentee voting affected 220K ballots"
t3_k4vjir	"Only 29 Percent Of Donald Trump Voters Think Joe Biden Will Be Inaugurated, Poll Shows"
t3_k4nfiz	"Justice Department Quietly Updates One Rule, Clears the Way for Executions by Firing Squad for Federal Crimes"
t3_k4qdiv	"James O’Keefe Crashes CNN Daily Call With Jeff Zucker, Reveals Months Of Recordings"
t3_k4nhv7	Cyber Monday Sale! Biden Offers China 50% Off American Manufacturing
t3_k4y2dq	"BREAKING: Project Veritas first round of videos released exposing President and Executive team at CNN showing how fake news is created, what’s omitted, and the entire orchestrated narrative."
t3_k4je89	Seattle homicides highest in over a decade as council cuts police budget
t3_k4zj26	GOP leaders lay into Pelosi for marijuana legalization bill while COVID-19 relief remains uncertain
t3_k4vb8l	How spineless and traitorous are most of the GOP?
t3_k4wy47	Hewlett Packard’s Bay Area headquarters relocating to Texas
t3_k509nr	"James O’Keefe Crashes CNN Daily Call With Jeff Zucker, Reveals Months Of Recordings"
t3_k4lzac	BREAKING: @Project_Veritas LIVE STREAMS President Jeff Zucker’s 9am Editorial Phone Call With @CNN Senior Leadership — Massive amounts of audio clips from CNN insider from top executives with top management on how they decide to control the narrative on everything #ExposeCNN
t3_k4tilo	"Sen. Susan Collins Found A Number Of Body Bags On Porch Of DC Home: The signs on the bags read: “TRUMP COVID DEATH” … “270,000” and more."
t3_k409j1	"Report: Nike, Coke, other companies lobbying against bill that would ban goods made with slave labor of Uighurs in Xinjiang"
t3_k4wwp6	"Liam Halligan: (UK) This is no longer a health crisis, it’s a total economic catastrophe"
t3_k4ah28	"CA-25: Smith (D) concedes race, Garcia (R) declares himself victor"
t3_k4jk52	Ted Cruz torches Alyssa Milano after she tries to blame Republicans for standoff on coronavirus relief
t3_k4lx8w	The Mass Murder of Nigerian Christians
t3_k50eri	Biden OMB Pick Wants National Soda Tax
t3_k4zxsy	Elected officials dine out after urging others to stay home
t3_k4m06p	"Top 20% Gets 6x More Benefits from Student Debt Cancellation than Bottom 20%, New Study Finds"
t3_k4lq6p	"Joe Biden’s new appointee as director of the Office of Management and Budget, spread baseless conspiracy theories after the 2016 election insisting that Hillary Clinton lost to President Trump because Russian hackers flipped votes"
t3_k4y7pa	"'Arrested Development' Star: Non-Liberals Filled with Negativity, Hate or Racism"
t3_k4mw9r	L.A. Supervisor Sheila Kuehl Dines at Outdoor Restaurant After Voting to Ban Outdoor Dining
t3_k4vdyc	Senator Schumer Suggests AG Barr Could Be Fired Over No Voter Fraud Claim
t3_k4kh8a	Inside the Wuhan Files: NEW documents show China covered up COVID-19
t3_k4m2fr	Rudy Giuliani wants lawmakers to seize Arizona's 11 electoral votes
t3_k4v629	Biden Treasury Secretary nominee Janet Yellen on Tuesday said she would focus on “gender disparities” and the “climate crisis.”
t3_k4qp1k	Giuliani and Trump reported to have discussed 'pre-emptive pardon'
t3_k4ezvb	"After the way Americans have been censored, gaslighted, and lied to, no one is obligated to accept anyone’s narrative anymore."
t3_k4eg08	Rand Paul points to 4 wild 'data dumps' that put Biden ahead: 'Look at the evidence and decide for yourself'
t3_k4w0wc	"In Hilarious Comic Masterpiece, NYT Editor Tweets Paper Will Treat Biden As They Did Trump"
t3_k4o9xf	LA County official votes to ban outdoor dining at restaurants over COVID-19 — then dines outdoors just hours later
t3_k4vvy9	"Twitter suspends data analyst who testified that up to 300,000 fake people voted in Arizona election"
t3_k4lnfq	"Poll watcher witness says feds showed up at door, made her feel like a criminal after fraud testimony"
t3_k4iq2r	"Pro-social distancing protest expected to attract 10,000+. “I fully support this protest. It’s great what they’re doing! I’m glad to see young and old Americans coming to together to protest against gatherings."""
t3_k4paoi	Stacey Abrams-founded group with Senate hopeful Warnock under investigation for allegedly sending ballots to residents in other states
t3_k4op0c	Trump Ballots Defaulted and Switched to Biden Votes on Dominion System: Maricopa GOP Chairwoman
t3_k4mxd0	"Chinese doctors recording at least DOUBLE the number of coronavirus cases that Beijing was reporting to the world in February, leaked documents reveal"
t3_k50j9z	"San Francisco mayor London Breed is under fire after it was revealed that she attended a birthday party at the restaurant in Napa Valley, just one night after governor Gavin Newsom did the same. Even though statewide guidelines discouraged gatherings with members of more than three households."
t3_k4ja4g	Ohio state representatives file articles of impeachment against Gov DeWine for his lockdown policies
t3_k4xjxi	Hewlett Packard Enterprise relocating global HQ from San Jose to Texas
t3_k4cfpg	"'Woke' Kentucky mayor is slammed for wanting pull $120,000 from emergency rental fund to pay for 'critical race theory' training for city employees"
t3_k4ow2c	"Election Official Chris Krebs who said the 2020 Election was the most secure in American history, mulls legal action against Trump team after Joe DiGenova said ""That guy is a Class A moron. He should be drawn and quartered, taken out at dawn and shot."""
t3_k4kpqe	It's a Lot: Georgia Eyes More Than 250 Investigations of 'Credible Claims of Illegal Voting and Violation of State Election Law
t3_k4ky15	The only context in which you'll hear a liberal ever speak of souls is to try and scare conservatives into not listening to theirs.
t3_k4vxhd	BBC Studios Announces 20% Diversity Quotas On All Future Productions
t3_k4lyw9	"Trump, Ron Paul and US anti-establishment leadership"
t3_k4ou1e	"San Francisco Radio Host Asks ""Why do poor people vote for Republicans?"" The responses are revealing."
t3_k4j9bk	Cancel Culture Comes for Eric Clapton After He Records New Anti-Lockdown Song
t3_k4bdzc	Republicans file articles of impeachment against Gov. Dewine.
t3_k4pdt7	"Articles of Impeachment officially filed against Ohio Gov. Mike DeWine, claiming abuse of power during pandemic"
t3_k4wueb	Minneapolis City Council Trying To Defund The Police Department Again
t3_k4tez8	"It appears that Joe Biden took only one question at today's big economic event: ""How does your foot feel?"""
t3_k4mdzb	Democrat San Jose Mayor Allegedly Violated Coronavirus Rules For Thanksgiving
t3_k4rsiy	WHO rejects China’s propaganda on COVID-19’s start
t3_k4oxva	"Bipartisan Group of Senators come up with $908 billion compromise coronavirus aid bill. Republican Senators include Mitt Romney, Susan Collins and Lisa Murkowski."
t3_k4tg5z	"Newsweek Knocks Whole Foods CEO for Blasting Socialism’s Many Failures: ""It's not exactly clear what attempts at socialism Mackey was referring to."""
t3_k4mlxf	New York: Democrats Gain Super Majority in State Senate
t3_k500vz	NASDAQ Strikes a Blow For Discrimination
t3_k4ynb6	S.F. Mayor London Breed had her own French Laundry party — the night after Gavin Newsom’s
t3_k4wg7t	Bipartisan group of senators unveil $908B coronavirus relief proposal amid gridlock
t3_k4yj5t	A Red/Blue Risk Divide - The pandemic revealed strikingly different outlooks on the balance between safety and freedom.
t3_k4x070	"Cuomo warns that Trump vaccination plans fail minorities, undocumented immigrants"
t3_k4w9as	"Watch: James O'Keefe Calls Into CNN's Morning Conference Call, Tells Startled Jeff Zucker He's Going to Release Two Months of Calls Tonight; Then LOL"
t3_k4bxio	U.S. Billionaires Gained $1 Trillion Since The Pandemic Started
t3_k4q228	Government Prepares For Next Pandemic By Taking Away Everyone's Rights Ahead Of Time
t3_k43sa6	Arizona certifies Biden as winner over Trump team’s objections
t3_k4pc8f	Video: Dominion Voting Systems Representative Engages In Extremely *Shady* Behavior With A USB Card &amp; A Laptop
t3_k4x036	Partial Unsealing Order
t3_k4prog	Cybersecurity Expert: DHS Was Aware of Vulnerabilities in Voting Systems
t3_k4pvb9	"Data Expert: Up To 300,000 Fake People Voted In Arizona Election, ""Biggest Fraud"" In History"
t3_k4ewf8	Powell: Dominion Server Removed From Fulton County While Lawyers Sought Restraining Order
t3_k4wnaa	Janan Ganesh: The real class war is within the rich
t3_k50obg	"Report: Trump has discussed with advisers pardons for his 3 eldest children, Jared Kushner and Rudy Giuliani"
t3_k47gtt	Wisconsin Becomes Last Contested State to Confirm Biden Won
t3_k4ls0z	Tenney(R) leads Brindisi(D) by 12 in first official vote count in House election
t3_k4coua	Another Top Iranian Revolutionary Guard Commander Terminated In Airstrike: Reports
t3_k4l3sk	“And Why Stop There?”: CNN Analyst Calls For Sweeping Regulation of Free Speech On The Internet
t3_k4lwj8	They all know COVID-19 is not a big deal
t3_k4egvq	Surprising percentage of Democrats think their party stole 2020 election
t3_k41eey	"Poll: Most People, Even Ethnic Minorities, Believe BLM Made Racial Tensions WORSE"
t3_k4sow3	"Biden’s outspoken nominee to run budget office deletes 1,000 tweets"
t3_k4ehkc	Hundreds of investigations launched into Georgia vote fraud
t3_k4k9jz	LA County supervisor visited restaurant after voting for outdoor dining ban: report
t3_k4k27q	Democrat Christy Smith concedes to GOP's Garcia in race for seat held by Katie Hill
t3_k4mp18	Another Democrat is caught violating the rules she imposes on others
t3_k4mtqy	Puberty blockers: Under-16s 'unlikely' to be able to give informed consent
t3_k4mzp7	Trump Lawsuit: Wisconsin Absentee Ballot Abuses Affected 220K Votes
t3_k4tufv	"For these unemployed Bay Area hospitality workers, free time meant helping Biden win Nevada"
t3_k4q1n3	Online petition: Louisville Restaurants will reopen Dec. 14 with or without Beshear's approval
t3_k4dzl2	Zuckerberg-Funded Group Comes Into Spotlight in Election-Related Court Cases
t3_k4ej48	"Victory in CA-25: Smith Concedes to Garcia, Leaving Katie Hill's Former Seat Red"
t3_k4b3g5	"Michigan Illegally Counted or Ignored 500K Ballots, Lawsuit Claims; and lefty group Rock the Vote given registered voters' social security #s, birthdates, eye color"
t3_k4m447	"U.S. Women’s Soccer Team Wears BLM Jackets, Refuses To Stand For National Anthem…"
t3_k4tmig	"Statement of Trump Legal Team on Bill Barr’s Comments on Voter Fraud - ""We have gathered ample evidence of illegal voting in at least six states, which they have not examined."""
t3_k4qjyc	Paris imam who denounced terrorism in hiding after death threats
t3_k4cezj	Obama criticizes Americans for liking 'cheap gas and big cars' more than 'the environment'
t3_k4htpk	Israel to use Saudi Arabia air space for commercial use | Flash News
t3_k4p6z0	Chinese State Media: 'An Asian Era Is Coming' Post-Trump
t3_k4mgha	Only FOUR hospitals in the whole of England are busier now than last winter
t3_k4pj8w	"Children can only have puberty blockers if they understand they're irreversible, High Court rules"
t3_k4o9qv	CDC testing shows COVID was in the US as early as December 2019
t3_k4m2l4	"Has the Penn Supreme Court Invited Scrutiny and Rebuke By Relying on ""Laches"" to Dismiss an Incovenient Complaint?"
t3_k4wv2c	Gristedes CEO: Progressives Are Regressing NYC
t3_k4ly59	"Is America to Be First, Second — or What?"
t3_k4l3br	"The Number of 'Indefinitely Confined' Wisconsin Voters Who Can Vote without IDs Increased from 60,000 in 2016 to Over 200,000 in 2020"
t3_k4zi0e	"Whistleblowers claiming USPS threw out, backdated ballots before election"
