name	title
t3_j9346j	/r/Conservative Official Political Discord
t3_k3fhy2	Brett Favre: Sports Fans Don't Want Political Messaging At Games
t3_k3b8wi	Almost Half of Violent Sex Attacks in Italy Committed By Foreigners
t3_k3aa7g	'LYING FOR DEMOCRATS' Candace Owens wins challenge against ‘communist’ Facebook fact-checker Politifact over Biden post false rating
t3_k39ud0	Whole Foods CEO blasts socialism: It's 'trickle-up poverty' that 'impoverishes everything'
t3_k3aodl	Forbes Shreds Democrats’ Student Debt Forgiveness Push: Makes ‘Mockery Of People Who’ve Played By The Rules’
t3_k3c7z3	Time magazine's 'Person of the Year' nominees: Stacey Abrams, Andrew Cuomo, Dr. Fauci, Gretchen Whitmer, BLM activists
t3_k3akeo	"""What an insensitive joke"" Kamala blasted after encouraging people to ""shop local"" amid mass restrictions"
t3_k3afdi	As NY politicians eye new taxes on the rich, high earners eye the exits
t3_k39s39	CDC Admits Their Numbers on COVID Are off by a Huge Amount.
t3_k3h8r1	Judge Blocks Georgia From Wiping or Resetting Election Machines
t3_k3b74m	The Obama Media Is Back -- When a Democrat is in the White House, journalists spend more time sucking up to the administration than doing anything that could even loosely be defined as reporting.
t3_k3hinw	BREAKING: Emergency Order Granted in GA to Stop Alleged ‘Wiping of Data’ From Voting Machines
t3_k340al	US Closed 10 Bases in Afghanistan as Part of Withdrawal
t3_k3cu2a	Trump Expresses Doubt on Whether Supreme Court Will Hear Election Cases
t3_k3b6dl	"NYC Pub Borrows a Page From Leftists in Lockdown Dispute -- Declares itself an ""autonomous zone"""
t3_k3hvde	Trump: Fox News 'Virtually Unwatchable'
t3_k3ae8i	GOP Iowa congressional challenger Miller-Meeks expected to win by 6 votes after recount
t3_k3elac	Japan had more suicides in October than all of the COVID-19 deaths during the pandemic
t3_k3gq58	Sidney Powell files emergency demand to seize all voting machines for forensic audit: Powell’s suit, filed seeks an “emergency declaratory judgment that voting machines be seized and impounded immediately for a forensic audit.”
t3_k36a7i	At least 14 are shot in New York City over the Thanksgiving holiday as gun violence soars 102%
t3_k3hjz8	FBI requests group's election fraud data that shows 'hundreds of thousands' of fraudulent ballots
t3_k3a5kw	Pennsylvania Bombshell: Biden 99.4% vs. Trump 0.6%
t3_k3c8oj	NY Times taken to woodshed for claiming Iran's nuclear program is 'peaceful': 'Is this an Iranian paper?'
t3_k36noz	California: ISIS Jihadi Stabs Four in University Classroom, University Blames Toxic Masculinity
t3_k344zi	Now It’s India: China Blames India For Origin Of COVID-19
t3_k3av2k	Massive Islamic Terrorist Attack In Africa Results In Deaths Of At Least 110 People: Report
t3_k3fz23	Candace Owens Challenges Fact Checker, and Wins
t3_k39tlx	Data expert: Vote tabulation feeds in PA, GA show 'anomalies' suggesting Trump missing votes
t3_k3jisw	NYC pub takes defiant stand against Gov. Cuomo, declares itself 'autonomous zone' from lockdown restrictions
t3_k3jicl	Republican congressional challenger set to win election by 6 votes
t3_k39e0u	Jon Voight Warns 'We Are in Great Danger if We Fall Under a Biden Administration'
t3_k3eevo	Trump Makes His Post-Election Move, Purges Pentagon's Outside Advisory Board, Kissinger and Albright Get the Boot
t3_k37fx4	Over 150 arrested in London anti-lockdown protests
t3_k3fqs1	BOMBSHELL: FBI to Investigate Evidence of Illegal Ballots Uncovered by Private Group
t3_k3fsn9	Trump: ‘They used COVID as a means to stuff the ballot boxes’
t3_k3kaku	Roger Simon: Now Is the Time for All Good Men and Women to Get Off Twitter
t3_k38wma	Hayward: Coronavirus Helps China’s Totalitarian Social Credit System Spread Worldwide
t3_k32d4e	Former GOP Rep. David Valadao flips California House seat. It's the third pickup in the state for Republicans.
t3_k3gdv3	UAE said blocking visas for 11 Muslim countries, as Israelis allowed in freely
t3_k3ierv	California: ISIS Jihadi Stabs Four in University Classroom, University Blames Toxic Masculinity
t3_k3ia9x	NYC schools to open again. It seems like children are safer at school then home. Just like the studies have said over and over...
t3_k3bosz	In Dangerous Decision, SCOTUS Rules First Amendment Can Stay
t3_k3cpdz	Pennsylvania Justices Accused of Playing Politics After Dismissing Challenge Over Absentee Ballots
t3_k3jnha	Breaking...Lin Wood gets order to stop wiping of GA machines then it's REVERSED
t3_k3es4d	Michigan County Commissioner Backs Gretchen Whitmer Impeachment: ‘Cannot Step on Constitution’
t3_k2xv2h	Candace Owens Challenges Fact-Checker, And Wins
t3_k3epku	Johns Hopkins academic: CDC data shows COVID hasn’t increased US death rate
t3_k2ydmj	Supreme Court agrees to hear Trump’s plan to remove non-citizens from census
t3_k3lel5	Professional Asshole Keith Olbermann: Prosecute Trump, Family, Supporters, Everyone
t3_k3b0k0	Can someone explain to me how this can be a thing: Deported veterans
t3_k3afy8	"AFFIDAVIT: In Michigan the votes were counted by decimals in a scheme called a ""Ranked Choice Voting Algorithm"" -- 1 vote per citizen? No, you get .0534 of a vote"
t3_k2vlb2	Ohio certifies Presidential election results, Trump wins OH
t3_k3l96s	Entertainment Industry Workers Exempt From Newsom’s Stay-At-Home Order
t3_k2yf03	Mouse utopia study in which a colony of mice were given everything to survive without any environmental adversity. Females became dominant, even killing their young. Males because passive and feminized. The colony eventually died out as they stopped reproducing.
t3_k3k0gm	Biden Announces All-Female Senior WH Press Team
t3_k3l0u9	Hits you right in the truth
t3_k37n9a	Hundreds of BLM Protesters Gather Outside LA Mayor Eric Garcetti’s Home. This is the 5th straight day protesters have shown up to Garcetti’s home to protest. They say they are here to protest the consideration of Eric Garcetti to the media’s fake president-elect Joe Biden’s so-called “cabinet.”
t3_k3h951	FBI Requests Fraud, Disenfranchisement Evidence, Researcher Says
t3_k363y1	Sidney Powell to Newsmax TV: Dominion Contracts Warrant Criminal Probe
t3_k3b7re	‘Reckless, Provocative, and Illegal’ – Bernie Sanders Laments Assassination of Iran Nuclear Scientist
t3_k39dsf	Pennsylvania Supreme Court Tosses Challenge to Vote-by-Mail Because It Came Too Late
t3_k34595	U.S. Sends Air Craft Carrier To Persian Gulf As Iran Vows Retaliation For Killing Of Scientist
t3_k3a8u0	Iran’s Mohsen Fakhrizadeh killed by 62-person hit squad, reports say
t3_k3b86w	Pennsylvania Supreme Court rejects GOP challenge after judge said it had 'likelihood to succeed'
t3_k340wi	OFFICIAL RECALL PETITIONS: Recall Gavin Newsom. Please sign
t3_k343i7	The FBI Spied on Carter Page. Now He’s Suing Them For $75 Million.
t3_k3if5s	More people died from suicide in Japan last month than from Coronavirus in the country year to date – new report
t3_k2s248	Police: Boy, 13, home alone calls parents about man breaking in. Boy's dad, an off-duty cop, arrives and fatally shoots alleged intruder.
t3_k32co8	NY Times taken to woodshed for claiming Iran's nuclear program is 'peaceful': 'Is this an Iranian paper?'
t3_k3ji7b	Los Angeles enacts new lockdown, report says county spent millions of CARES Act funds on PR firms
t3_k2rrd5	Whole Foods CEO blasts socialism, explains how universities corrupt young people: 'Trickle-up poverty'
t3_k2xwcs	Pennsylvania Supreme Court vacates lower court’s order to delay certification, dismisses Rep. Mike Kelly’s case
t3_k3b90k	Trump officials claim legacy of 'groundwork' for nuclear breakthrough
t3_k3ax3m	Michael Flynn: 'The President Has Clear Paths to Victory'
t3_k3lml0	Fulton County recount hits snag with Dominion mobile server crash
t3_k3fm3e	How an Elite 62-Person Hit Squad Ambushed &amp; Killed Iran's Top Nuclear Scientist
t3_k3ly3h	Georgia recount in Fulton County delayed by Dominion server crash: Report
t3_k2vlyu	Looks Like The Shills Will Be Making OverTime This Weekend
t3_k342p4	Report: Public School Enrollment Dropping Across The Country
t3_k39q3u	Joe Biden Cabinet Prioritizes Establishment Experience, Obama Administration Figures
t3_k39tab	Here Are Some More Troubling Questions About the Election Numbers
t3_k3lfcm	Biden’s Injury From Falling While Playing With Dog More Serious Than Initially Thought
t3_k3ltm4	This is a government website. Instructions surviving a nuclear blast. It literally is discussing when moving to a shelter after the blast and says to bring a mask and hand sanitizer to avoid getting COVID-19. What the in the actual hell? I mean, are they trying to be funny??
t3_k2zcn3	Miller-Meeks (R) holds 6 vote lead over Hart (D) after recount for Iowa’s 2nd Congressional District
t3_k30jtg	NYC bar in COVID-19 hotspot refuses to shut down after state yanks liquor license
t3_k2z1v2	Pennsylvania Supreme Court Tosses Trump Ally Mike Kelly’s Constitutional Challenge to the 2020 Election
t3_k32mfc	Pennsylvania Bombshell: Biden 99.4% vs. Trump 0.6% Stunning testimony that the media has dutifully ignored.
t3_k36qda	Biden's Leading CIA Director Pick Backed Torture
t3_k3jkqw	Restaurant Holdouts Defy Government Shutdown Orders
t3_k3l7zy	Rep.-Elect Burgess Owens Announces ‘Freedom Force’ To Fight Leftist ‘Squad’
t3_k34j2p	Report: Atlanta sees highest homicide rate since 1990
t3_k3abwt	The Citizens of UK to plant trees to mark Queen Elizabeth's 70 years on throne | FlashNews
t3_k2xj6r	Ohio certifies presidential election results, Trump win
t3_k3lwp9	Biden’s Injury From Falling While Playing With Dog More Serious Than Initially Thought
t3_k2zqhw	Trump Officially Wins Ohio As State Certifies Election Results
t3_k3hi2c	'Essential' Businesses Are No Longer Safe Under State's New Lockdown, Now Even Grocery Stores Can Be Forced To Close
t3_k2zt4f	Pennsylvania Supreme Court tosses GOP congressman’s suit seeking to throw out all ballots cast by mail
t3_k37qoe	Evidence for Journalists: A Short Course. The meaning of evidence and what is required to gather it is lost on the cynically ignorant media.
t3_k32phv	Thouands of Fake Votes Found at Wisconsin Recount — Photos and Report from GOP Observer
t3_k2wfag	VIDEO: BBQ restaurant owner defies COVID lockdown, arrested, hit with 13 charges and fines; supporters stand with him
t3_k3enwh	Maricopa County, AZ county recorder on election security. Operates on “faith”
t3_k2zlqx	Sajid Javid: We must not allow woke activists to stop us confronting Islamic extremism
t3_k3afay	USS Nimitz to Gulf as Iran War Threat Grows
t3_k2ut3m	Supreme Court Blocks Covid-19 Restrictions on Religious Services in New York
t3_k3e7qd	A Voter Fraud Investigation Group has group also found more than 20,000 people in Georgia and more than 8,000 people in Nevada who cast ballots although they no longer met the residency requirements of their respective states.
t3_k3349a	End of recount maintains Miller-Meeks' lead in Iowa 2nd District U.S. House race; margin just 6 votes
t3_k3lpb3	Trump on Election Fraud: The DOJ and FBI Are 'Missing in Action'
t3_k341lz	NYC Sheriffs Dept Busts Underground Nightclub Packed With Hundreds Of People
t3_k2rr24	The 'smartest man in the room' has joined Sidney Powell's team -- Navid Keshavarz-Nia, an expert witness, stated under oath that there was massive computer fraud in the 2020 election, all of it intended to secure a victory for Joe Biden.
t3_k2y9pk	"Mark Zuckerberg Funded Group Comes Into Spotlight in Election-Related Cases. ""The group received hundreds of millions of dollars from the Facebook CEO and is accused in lawsuits of violating state laws in several battleground states. """
t3_k33xbd	Pennsylvania Supreme Court tosses GOP congressman’s suit seeking to throw out all ballots cast by mail
t3_k2lwsd	CA Pastor Reclassifies Church as 'Strip Club' So That It Can Open for Services During COVID (Not the Bee)
t3_k2wekr	Ted Cruz hits ex-CIA boss John Brennan over 'bizarre' support of Iran following killing of nuclear scientist
t3_k3la1r	Black Fragility? A bestselling book offers a prescription for race relations that casts whites as sinners and blacks as children.
t3_k2rtky	"Judge: Republicans Will Likely Win Pennsylvania Election Lawsuit. ""The Constitution does not provide a mechanism for the legislature to allow for expansion of absentee voting without a constitutional amendment"""
t3_k2snaa	How the explosion in critical race theory is poisoning America
t3_k39rzc	Iran blames Israel for Fakhrizadeh's death. So now what?
t3_k2x1bx	Black Lives Matter Leader Says Joe Biden ‘Capitalized On Our Efforts To Defund The Police’
t3_k37fse	London: More than 150 arrested in anti-lockdown protests
t3_k2twr2	Liberals Heads Explode After CNN Video Surfaces Showing Path for Trump 2020 Win
t3_k3460z	NBC Acknowledges Severe Isolation Facing Nursing Home Patients Due To COVID-19 Concerns
t3_k3k7ah	Judge Blocks, Then Unblocks Georgia From Wiping or Resetting Election Machines (this is bad)
t3_k340u1	UK Testing Error Wrongly Tells 1,300 People They Have Coronavirus
t3_k345jj	Los Angeles County Issues Stay-At-Home Order, Bans Most Gatherings Excluding Protests And Church Services
t3_k341xh	Alito Sets Deadline For New Jersey To Respond In Religious Freedom Case
t3_k3gldo	Trump’s Payroll-Tax Deferral Creates Predicament for Congress
t3_k34k1l	Calif. officials evict crowds of activists illegally occupying vacant homes
t3_k3434g	New Details Emerge About Operation That Eliminated Iranian Nuclear Weapons Scientist Mohsen Fakhrizadeh
t3_k3483t	Dr. Navid Keshavarz-Nia: “I conclude with high confidence that the election 2020 data were altered in all battleground states resulting in a hundreds of thousands of votes that were cast for President Trump to be transferred to Vice President Biden.The evidence is overwhelming and incontrovertible.”
t3_k3iw5f	Joe Biden Twists Ankle While Playing With Dog, Reports Say
t3_k33ze3	High Court Takes Up Census Case, as Other Count Issues Loom
t3_k3hiex	True investigative reporting by the LA Central City News chronicles massive 2020 election fraud: “Ironically the NYT has recorded the fraud for all times, though they have not reported it”
t3_k3jlm9	Matthew Scott: (UK) Lockdown is being policed in an entirely disproportionate way
t3_k2wgb5	‘Sovereign Citizens’ are claiming ownership of occupied Seattle mansions
t3_k33zq4	Trump Nominates a Top Bank Regulator as Biden Starts Transition
t3_k32nf0	Just like Biden: Chavez was losing on election night...
t3_k30luj	"Pennsylvania Supreme Court Dismisses Challenge to Mail-in Voting on Equitable Doctrine of ""Laches"""
t3_k2zcmc	Pa. Supreme Court Dismisses Request From Mike Kelly And Sean Parnell To Declare Mail-In Voting Unconstitutional In State, Deny Results From 2020 Election Mail-In Ballots
t3_k3erbc	Joe Biden Gun Control Proposal Could Bankrupt Firearms Industry
t3_k2uss7	New Lawsuit Asks Wisconsin Supreme Court to Declare All Drop-Box Ballots Illegal and Block Certification
t3_k31vtx	Zuckerberg-Funded Group Comes Into Spotlight in Election-Related Court Cases
t3_k2u8uo	US economy grows at record 33.1%, according to second estimate
t3_k2pwq9	Politicians had officers 'stand down' to rioters but 'go after' law-abiding citizens
t3_k33yan	The PA State Legislature Hearing Was a Powerful Moment for the Trump Legal Team
t3_k2zl98	Michigan targeted with another election-fraud lawsuit -- 'The pattern of lawlessness was so pervasive and widespread'
t3_k3m1oh	Time's Up charities set up by celebrities as part of Me Too movement spent $1.4m on salaries, $157k on conferences at luxury resorts and and just $312k helping victims of sexual harassment
t3_k3lyf7	A Football Analogy to Explain Democrats' Election Cheating
t3_k2yrpr	Chicago Mayor Lori Lightfoot's 'pandemic budget' passes: agreeing to pilot a program that would have mental health workers respond to certain emergency calls, rather than police.
t3_k2nbot	"WATCH: Olbermann says he wants so many Trump allies jailed ""that we have to convert Trump buildings"" into ""Trump prisons"""
t3_k37x25	Bette Midler: Doctors Should Sue over SCOTUS Protecting Rights of 'Super Spreader' Churches, Synagogues
t3_k2rhbn	When Che Guevara and Castro Wished Us a Happy Thanksgiving -- On Black Friday 1962 Castro’s agents had targeted Macy’s, Gimbels, Bloomingdales, and Manhattan’s Grand Central Station with a dozen incendiary devices and 500 kilos of TNT. J. Edgar Hoover’s FBI foiled the plan.
t3_k30gtc	Donald Trump gave the first speech of his first (brief) presidential campaign on November 15, 1999. Its subject; isolating and toppling Cuba's communist regime
t3_k2mh5u	Democrats are scrambling to explain away the inroads Republicans have made with minorities, as evidenced in the election results. Instead of listening to the concerns of the Black and Hispanic voters who voted for Trump — Democrats are instead blaming them.
t3_k3kwyk	"Former State Attorney General: 2020 Election ""One of the Most Lawless in US History"""
t3_k2rio0	“Dominion, Now the Largest or Second Largest Voting System Company, Is Foreign Controlled and Depends Upon Secret Source Code Created and Owned by Smartmatic, a Foreign Controlled Company With Ties to The Venezuelan Government Led by Hugo Chavez“
t3_k2wf55	"A thorough breakdown of Sidney Powell's ""Kraken"" Lawsuits"
t3_k2zkp6	Britons to get 'vaccine stamps' in their passports before overseas travel
t3_k2yz6l	Illinois borrows 2 billion dollars from Fed to cover lockdown costs. Debt likely will be downgraded to junk soon. Chicago locks down again to ensure complete destruction.
t3_k2yc1d	Pa. Supreme Court Dismisses Request From Mike Kelly And Sean Parnell To Declare Mail-In Voting Unconstitutional In State, Deny Results From 2020 Election Mail-In Ballots
t3_k33oij	Senate Democrats Could Force Brett Kavanaugh To Resign By Pushing For Perjury Investigation, Report Says
t3_k2wt60	Michigan Complaint: Vote Counts 'Not Normal'
t3_k30nte	‘Mossad’ assassins blow hole in Iran’s nuclear programme
t3_k2u62j	Trump’s Legal Team to Participate in Public ‘Hearing on Election Integrity’ with Arizona Lawmakers
t3_k2m7vc	"Art Critic: ""Republicanism is no longer a political problem; Republicanism is a social problem. It must be treated in the same way coronavirus is treated: it has to be isolated and snuffed-out by repressing it in about 70% of the general population."""
t3_k34w50	Sen. Cruz Responds to John Brennan's 'Bizarre' Reaction to Iranian Assassination
t3_k3crc5	Vanderbilt University senior Sarah Fuller, 21, makes history as the first woman EVER to play in a Power 5 college football game as kicker
t3_k2ubf1	Rabid Far-Leftists Try To Cancel Eric Clapton Because 2020 Isn’t Over Yet
t3_k2zevk	Japan Had More Suicides in October Than COVID Deaths So Far This Year
t3_k2q0q7	Pennsylvania Judge Rules 2020 PA Election Likely Unconstitutional – Trump Case “Likely to Succeed”
t3_k2on81	Sidney Powell has photos of check stubs to pay ballot harvesters
t3_k34w5s	Two Dead in California After Local Authorities Ignore ICE Detainer for Known Criminal Alien
t3_k30sig	Black Lives Matter Leader Says Joe Biden ‘Capitalized On Our Efforts To Defund The Police’
t3_k2w56t	Schools Ban Classic Novels As Much For Laziness And Ignorance As Politics - Removing time-tested classics and assigning easy fiction with leftist themes fails in cultivating any love of reading
t3_k2wfns	Carter Page sues FBI, DOJ, and individuals behind FISA abuse
t3_k2x18b	Big Tech leaving San Francisco area
t3_k2x8wf	Judge rules pro-Trump case established a 'likelihood to succeed on the merits' in Pennsylvania
t3_k37zyy	Medicaid is hemorrhaging $100B on Americans ineligible for the program
t3_k2xzrl	State Court Judge Finds Use of Mail-In Voting In Pennsylvania Likely Violated State's Constitution
t3_k344pu	ERICKSON: The Puritan Work Ethic
t3_k30raf	NYC: Wealthy hire protection on the streets after spike in violent attacks
t3_k30q7v	Looks like New Mexico's Lockdowns are going well
t3_k2qrfi	Oxford University students vote to ban beef, lamb from campus eateries citing the need to be a leader in the fight against climate change.
t3_k2v31g	General Flynn Finally free to speak. First interview after pardon
t3_k2wwiz	The European Court of Justice (ECJ) has determined that Italy must pay for the dependents of migrants even if they do not live in the European Union.
t3_k2o2q1	195 Million Chinese Students Are In School. Why Aren’t Our Kids? -- Right now in China, 195 million students K-12 are learning in-person in Chinese public schools. Meanwhile, millions of American public school students are learning in a failed remote system.
t3_k2pp1n	Emergency Wisconsin Lawsuit To Stop Certification Challenges Nearly 160,000 Votes
t3_k2nc9m	UPDATE on Pennsylvania: Judge predicts Trump will win the lawsuit on unconstitutional mail-in ballots
t3_k2cxxq	Milwaukee County presidential recount wraps up with Biden adding to his margin over Trump
t3_k2s2e0	What National Adoption Month Means to Me as an Adoptee
t3_k2mps5	Joe Biden 'offers John McCain's widow Cindy McCain the job of UK ambassador' after she campaigned for him and 'delivered Arizona' for the Democrats in surprise victory
t3_k2s2qb	'Decolonization' activists vandalize monuments in 4 states over Thanksgiving
t3_k2s2e9	American oil executives known as the 'Citgo 6' sentenced between 8 and 13 years in prison in Venezuela
t3_k2sgjc	'Highly Speculative': WHO Official Pushes Back On Chinese State Media Claims COVID-19 Originated In Europe - The National Pulse
t3_k2lxb5	LIMBAUGH: Democrats Want Unity Only On Their Terms
t3_k2u9gl	The Guardian has a serious case of TDS (tiny desk syndrome). For anyone who didn't believe they are in the business of fake news, a tiny desk apparently makes headlines
t3_k2xb8z	Chief Justice John Roberts has lost control of the Supreme Court
t3_k2ony6	26 Pa. House Republicans call for withdrawing certification of presidential electors
t3_k2oj48	Jenna Ellis to Newsmax TV: Trump Team Heads to Arizona Legislature Next
t3_k2n1c3	GOP's House wins show some Dem voters 'connecting the dots' on liberal left, lawmaker says
t3_k2hlf7	Pennsylvania State Judge Upholds Halt To Certification, Finds Likelihood Mail-In Balloting Procedures Violate PA Constitution
t3_k2wer9	Pennsylvania judge rules GOP lawsuit challenging new absentee ballot law has 'likelihood to succeed'
t3_k2u3so	Kentucky Religious Schools Have First Amendment Right to Reopen, Says Federal Judge
t3_k2iiqm	Judge: Republicans Will Likely Win Pennsylvania Election Lawsuit
t3_k3048t	Chris Roach: Straw Men Distract us from Real Corruption
t3_k2okbb	Johns Hopkins retracts report finding COVID death count 'not alarming'
t3_k2dwwq	Police raid gym because OWNER was using his facilities during lockdown
t3_k33yov	Dark Money, Assailed by Dems, Aided Biden: Analysis
t3_k2xmzb	End of recount maintains Miller-Meeks lead in Iowa 2nd District U.S. House race; margin just 6 votes
t3_k2sdw8	United begins flying Pfizer’s COVID vaccine for rapid distribution: Report
t3_k2bvqq	Trump Slams Twitter For ‘Conservative Discrimination,’ Calls For Repeal Of Section 230
t3_k2c7cb	Pro Tip: Skip Out On Black Friday Deals And Just Hold Out For The Next Peaceful Protest
t3_k2hfm4	Carter Page sues James Comey, Andrew McCabe, the FBI, and others for $75M
t3_k2qwef	Biden To ‘De-Emphasize The Military As An Instrument Of National Power’: Report
t3_k2vixo	President Trump paid $3M in Wisconsin recount only for Biden to gain 132 votes
t3_k2oeu6	I'm so old that I remember when Sarah Palin was mocked for talking about death panels.
t3_k2hi8y	Johns Hopkins University Newsletter Ran Study Saying COVID 'Relatively No Effect on Deaths' in U.S., Then Deleted It After Publication
t3_k2tanb	US women's soccer team wears Black Lives Matter jackets and kneels for national anthem before game in Europe
t3_k28iyb	BREAKING: Republican David Valadao Flips Blue House Seat In CA; Third GOP Pick-Up Of Election In State
t3_k2qtrn	The Definition of Censorship According to Mark Twain
t3_k3kbdw	Biden news coverage goes to the dogs — media lap up word of pets returning to White House
t3_k2nky3	Trump unloads on Georgia Sec of State, calls him ‘enemy of the people’ over lack of transparency
t3_k2n80l	"""Sovereign citizens"" knock on doors of rich Seattle residents demanding they hand over their mansions"
t3_k26yrk	To Save Time, The Babylon Bee Will Now Just Republish Everything Biden Says Verbatim
t3_k2797i	President Trump the First Since Carter Not to Get U.S. Involved in New Wars
t3_k2rfra	Biden’s ‘Climate Czar’ Makes Shocking Comments About the Anti-Capitalism Great Reset: ‘It Will Happen’
t3_k2kga7	Justice Is Coming: Carter Page Takes Comey, McCabe, Strzok to Court in $75M Obamagate Lawsuit
t3_k3kz0q	#MAGAday rally on inauguration day
t3_k2fm82	Democrats Erupt After Scientist Behind Iran’s ‘Clandestine Nuclear Ambitions’ Is Killed
t3_k2cb4u	Report Claims Fox News Is Blacklisting Guests Who Appear on Newsmax TV
t3_k2kqo6	Monuments across country vandalised over Thanksgiving
t3_k2f5xr	Donald Trump Urges Georgia Supporters to Vote for Kelly Loeffler and David Perdue in Senate Runoffs
t3_k2wbwz	"YouTube Celebrates ""Unthanksgiving"" Instead of Thanksgiving"
t3_k2dth2	Did You Notice Anything Ironic About That Tweet From John Brennan on Iran? -- The only people who appear to be upset about the death of Iran’s nuclear weapons program architect are Obama folks.
t3_k2nfgc	Political, Not Medical, Science Drives the Lockdown Lemmings
t3_k277ty	Republicans Flip 3rd House Seat in California
t3_k2nzht	Judge: Republicans Will Likely Win Pennsylvania Election Lawsuit
