name	title
t3_k2l7ch	The Left in America seems to be progressively drifting off into their own version of reality; riots are peaceful, counting legal ballots is a threat to our democracy, and vicious attacks on political opponents are meant to “heal” a divided nation.
t3_k3hkk3	President-elect Joe Biden twisted ankle while playing with dog Major
t3_k2wwil	Donor sues pro-Trump group for $2.5M over 'empty promises' on voter fraud
t3_k3ka2f	Trump Reportedly Planning To Announce 2024 Run — During Biden's Inauguration
t3_k3h40d	Five Videos – Five States Where Votes Were Switched Live on TV Away from President Trump to Biden -
t3_k3l53e	Jake Tapper Virtue Signals About GOP 'Moral Cowardice', His Argument Gets Turned Around on Him Big Time
t3_k3htss	Reasons why the 2020 presidential election is deeply puzzling | Spectator USA
t3_k2uxeq	Iran threatens to retaliate for killing scientist
t3_k3ineb	Is the FBI Finally Looking Into Voter Fraud?
t3_k3kgwi	New group ‘Freedom Force’ vows to be GOP answer to AOC’s ‘Squad’
t3_k2ndhk	Report: Stacey Abrams To Brief Hollywood Weekly On How To Help Win Georgia Races
t3_k2o25j	Arizona State Legislature to Hold 'Urgent' Election Integrity Hearing With Trump's Lawyers
t3_k2u5jx	"NYT Panned Over 'Absolutely Delusional' Tweet About Iranian Nuclear Scientist's Assassination: ""Iranian officials, who have always maintained that their nuclear ambitions are for peaceful purposes..."""
t3_k3k8li	"Situation Update, Nov. 29th - 305th Military Intelligence Battalion is ""Kraken:"
t3_k2mzfq	PA Supreme Court Fails to Uphold the Law to Ensure Fair Elections - Senator Joe Scarnati
t3_k3ilkl	FBI asks Voter Integrity Project for findings on possible illegal ballots, group's leader says (good news as the data is enough to flip some states)
t3_k2hn27	Pennsylvania State Judge Upholds Halt To Certification, Finds Likelihood Mail-In Balloting Procedures Violate PA Constitution
t3_k2o3k1	Digital Forensic Analysis Shows Dominion's Server Connected to Iran and China: Affidavit
t3_k2uy7v	Joe Biden Video Censored by Facebook Fact Checker
t3_k3k85w	A Justified Pardon -- Trump’s pardon of Michael Flynn restores the executive branch’s prosecutorial discretion and ends a case that should never have started.
t3_k2d0y9	DATA: Michigan Analysis Suggests Absentee Votes 'Manipulated By Computer', Flags Hundreds Of Thousands Of Ballots
t3_k25wgh	Black Lives Matter has increased racial tension, 55% say in UK poll | World news
t3_k2s1xs	US women's soccer team wear 'Black Lives Matter' uniforms, protest national anthem in Europe
t3_k241pr	Wikipedia Co-Founder: Site’s Neutrality Is ‘Dead’ Thanks to Leftist Bias
t3_k2z3hd	New DOJ rules could allow firing squads, electrocution, poisonous gas for executions
t3_k3hkd2	Keep in mind, emperor Cuomo destroyed our tacks and field/ football field to make this... and not ONCE has this been UTILIZED.. smfh
t3_k3elt5	Covid Hypocrite of the Week
t3_k348zg	Resistance to Vaccination Could Prolong the U.S. COVID-19 Pandemic.
t3_k2grgp	Over 700 Gang Members in Central America Arrested in US-Aided Actions
t3_k30n8l	Camilla Long: We’re women, not victims
t3_k246k2	President Trump says he'll 'certainly' leave office if he loses Electoral College vote, but vows legal fight is 'far from over'
t3_k2h0h9	Biden netted 132 extra votes after Milwaukee County recount
t3_k2f417	PIRRO INTERVIEW: Attorney Lin Wood is on the War Path Against Alleged Corruption, “Trouble’s coming AOC’s way too, Stay tuned”
t3_k3i5io	Alexandria Ocasio-Cortez Accuses The President Without Proof Once Again
t3_k26yxj	Court Denies Trump Campaign’s Appeal of Pennsylvania Ballot Challenge
t3_k2ck5p	China: Four doctors jailed for illegally harvesting organs
t3_k2f3b1	Trump campaign vows to appeal Pennsylvania case to Supreme Court
t3_k2ti1o	Pope Francis Criticizes Groups Protesting COVID Lockdowns in Op-Ed
t3_k2rahh	US announces reward of up to $5 million for information about 26/11 mastermind - Times of India
t3_k2qfnt	Back to the Future of Conservatism
t3_k2xa2d	PBS's Yamiche Alcindor Hails Biden Cabinet As the Avengers ‘Saving Us All'
t3_k2fneo	PA State Sen. Mastriano Introduces Resolution To Take Elector Power Back From The Secretary Of State
t3_k2be42	26 Pa. House Republicans call for withdrawing certification of presidential electors
t3_k3hft4	President Trump ‘not going to change mind’ on election fraud
t3_k3dttu	Cha-Ching: Black Friday sales hit new record totals
t3_k2m59u	Backlash as Brennan Blasts Killing of Iranian Nuclear Scientist: ‘Always on the Side of our Enemies’
t3_k2j156	Carter Page files $75M suit against FBI, DOJ, others over ‘unlawful surveillance’
t3_k2hfo5	Timing is everything: Assassination of Iran nuke chief Fakhrizadeh
t3_k3jiyz	Report: Trump considers launching 2024 campaign during Joe Biden's inauguration
t3_k3hbyt	11 Trillion Reasons To Fear Joe Biden's Presidency
t3_k3eetk	When Does the Winner of the Election Become the President-elect?
t3_k2ihl6	"Commonwealth PA Judge 11/27/20: Act 77 Likely Unconstitutional, PA Certified Only the POTUS/VP Elections Despite ACTIVE Injunction. State Claims Case is ""Moot"" Since it Only Certified POTUS/VP Elections (NY's argument in the Roman Diocese of BKLYN v Cuomo case)"
t3_k3dglw	“This is No Free Country”: Anti-Lockdown Protests Rage in London, Over 150 People Arrested
t3_k24dag	"""No takers in the Minneapolis and Portland attempts to obtain more cops."" - Can we skip ahead to the part where we say, 'We told you so?'"
t3_k2n81v	The Collapse of the Cuomosexual
t3_k3f8uy	Here's a long list of conservative podcasts if you're looking for something to listen to
t3_k3dtn3	‘Students for Western Civilization’ wants to set up shop at Canadian university
t3_k3fmtl	Trump Reportedly Planning To Announce 2024 Run -- During Biden's Inauguration
t3_k3ewa8	Phill Kline: 2020 Election One of the Most Lawless in US History
t3_k2f901	State lawmakers assert authority to name Electoral College slate -- Pennsylvania resolution cites constitutional power
t3_k3bitp	Seattle-area homeowners report ‘sovereign citizen’ property seizure attempts: report
t3_k2domm	"The 4 Year Campaign Against Trump (and they want him to concede to be a ""good sport"")"
t3_k25sn9	3rd Circuit Court of Appeals Issues Ruling in Trump Campaign v. Pennsylvania
t3_k20t80	Carlson: 'Our Political Class Has Deliberately Decided to Use This Pandemic as a Way to Gain Political Power'
t3_k3a6bq	Most and least trusted professions in Britain
t3_k2c4x6	Sidney Powell Witness Whom NY Times Described as “Always the Smartest Person in the Room” Concludes Hundreds of Thousands of Votes Transferred from Trump to Biden IN ALL BATTLEGROUND STATES
t3_k2rk7n	Clapton, Van Morrison Team Up For Anti-Lockdown Anthem
t3_k3fwuh	If the FBI and DOJ are involved, this might explain why it's so hard for Trump to get evidence of the massive Biden voter fraud in time for the courts
t3_k3ae0n	Report: Blue-state Migration Could Have Flipped Arizona
t3_k29hoz	Supporters Raise $150K for Toronto Restaurant Owner Who Defied Lockdown Orders
t3_k20tjn	8 U.S. House Races Still Have Not Been Called. Republicans Lead All 8 Races.
t3_k20rna	Big Media Is Hiding That Illinois Has Far More COVID Cases Than Florida Because Illinois Has A Democrat In Charge And Tighter Lockdowns
t3_k3b9ww	The Pandemic Is Changing Hollywood, Maybe Forever
t3_k2b6k6	Dominion Servers Connected to Iran and China, According to Digital Forensic Analysis in Filed Affidavit
t3_k29s72	Arizona State Legislature to Hold 'Urgent' Election Integrity Hearing With Trump's Lawyers
t3_k3aoih	Biden promise to follow the science is 'noble,' but it must be THE science
t3_k21jfs	COVID In NYC: In Response To New Restrictions, Staten Island Restaurant Declares Itself An ‘Autonomous Zone’
t3_k248be	Starbucks fired NJ barista for refusing to wear ‘Pride’ shirt, lawsuit claims
t3_k3bq8r	Reasons why the 2020 presidential election is deeply puzzling
t3_k2dqdd	Pa. State Senator Moving to Have Legislature Appoint Electors -- Because of ''so much evidence of shenanigans and fraud'' in the presidential election.
t3_k2f7n6	Mossad Whacks Top Iranian Nuclear Scientist, Joe Biden's Ability to Suck Up To Iran Hardest Hit
t3_k3bs3y	The Taliban Crime Syndicate Waits Out Trump
t3_k25m5w	Climate czar nominee John Kerry under fire for his apparently luxurious lifestyle of yachts and using a private plane
t3_k2bo0h	Amistad Project sues to invalidate Michigan election results
t3_k25xee	Sidney Powell has US military intelligence agents ready to testify that the Michigan/Dominion tabulation was tampered with.
t3_k39p5e	Reality and the Narrative -- Despite the blandishments of the narrative, which seek to seduce you into acquiescence with rumors of inevitability, we really do not know how this story, which seems so familiar, will end.
t3_k3ddui	'Arithmetically impossible'! Pollster explains why the 2020 election is 'deeply puzzling' in fact, stat, and math-filled thread -
t3_k2uxl6	Here Is What You Missed From Pennsylvania’s State Senate Hearing On The Election
t3_k34bb8	Christmas canceled? Dr. Fauci says COVID surge means Christmas won't be 'any different' than Thanksgiving
t3_k2cb9v	Chefs warn new Covid rules could kill US restaurants
t3_k3avhg	Rudy Giuliani: Trump Team Looking Past Election Lawsuits, Will Lobby State Houses​
t3_k2cljb	Barrett Reloaded? A New Third Circuit Decision Could Prove The Perfect Base For A Second Amendment Blowout
t3_k3974t	When, how can Iran avenge the Fakhrizadeh Killing?
t3_k24c2e	Keith Olbermann: We’d Like Prisons To Be Filled up with Trumps, Trump Flunkies, and Trump Apologists: AIR.TV
t3_k1zipn	Twitter Reverses Ban of Link to Sidney Powell's Election Website Lawsuit
t3_k2cfmu	Statement From Dominion on Sidney Powell's Charges - Dominion Voting Systems
t3_k2gt0o	Obama: Republicans portraying white men as 'victims' helped Trump win votes | Barack Obama | The Guardian
t3_k2ar2b	Donald Trump Calls for Section 230 Repeal as Parler CEO Says Facebook, Twitter 'Not Neutral Actors'
t3_k22af6	REPORT: Iran’s Top Nuclear Program Scientist Assassinated Outside Of Tehran
t3_k2f06l	Pennsylvania ruling sets up Trump appeal to Supreme Court
t3_k2o4xs	China Insider: Australian Correspondents Escape China, Fear They Will Be 'Disappeared'
t3_k3d4ed	Jack Dorsey Goes On Parler To Ask People To Follow Him On Twitter
t3_k3do9e	The Founders Meant to Keep Government Out of the Church, Not God Out of the Government
t3_k3a22l	Sarah Fuller Becomes The 1st Woman To Play In A Major College Football Game - Props to Fuller for carving out her place in history, but Vanderbilt is in trouble if this is where their kicking game is at.
t3_k3bw8f	The Faces of Antifa Members Show the Hate-Filled Roots of the Organization
t3_k25r0f	Nevada: Use of Casinos as Home Address &amp; Incomplete Voter Registrations Found
t3_k2dupc	BLM PAC to Raise $500K to Boost Georgia Democrats Warnock, Ossoff
t3_k23t82	'Historically strange' spike in incomplete Nevada voter files, casinos as ‘home’
t3_k22itk	Democrats Want Unity Only on Their Terms -- Many Trump haters have been lying all along about President Donald Trump, what he stands for, what his record has been, and who his supporters are. Now they tell us they want unity.
t3_k22jxr	Outgoing San Diego Mayor Faulconer: One-Party Rule Isn’t Serving Our State Well
t3_k22lf5	Donald Trump: 'Facts Are on Our Side' in Election Fight, but 'Time Isn't'
t3_k3cb2s	Joe Biden Has Been Living In Fear Of COVID Because Of Possible Loss of Smell
t3_k295lv	Johns Hopkins University Newspaper Pulls Down Article Questioning COVID-19 Death Tolls
t3_k269ct	Legendary Rockers Including Van Morrison and Eric Clapton Team Up to Record an 'Anti-Lockdown' Song
t3_k2avg4	Carter Page Sues DOJ, FBI, James Comey, And Others Behind Crossfire Hurricane FISA Abuse
t3_k28gxe	Trump team removes members of Pentagon's Defense Policy Board, including Kissinger, Albright
t3_k3bv92	PA State Senator: State's GOP-Led Legislature Must Pick Delegates if Election Is Compromised
t3_k3deu6	In the face of obvious election fraud, Democrats do not seem to care about American election integrity...
t3_k3bazb	Libertarians suck
t3_k2182k	Barrett confirmation sparks flood of Supreme Court-bound challenges from pro-gun groups
t3_k2cahk	Charles Moore: A culture of fear is undermining leadership at every level of society
t3_k37la0	"Time announces Person of the Year. The winner is one of the most important components to the ongoing 2020 presidential election.....And the Winner is The Dead Voter. In explaining the picK Time CEO said “This just goes to show how important dead people are to our elections and society as a whole."""
t3_k2h806	Korean automakers, Hyundai and Kia to pay $210 million U.S. auto safety civil penalty
t3_k2h6bv	Lee Smith: Trump Closes a Dark Chapter for General Flynn
t3_k2beq8	Pennsylvania Republican Lawmakers Introduce Resolution Disputing 2020 Election Results – CBS Pittsburgh
t3_k391xn	Phill Kline: 2020 Election One of the Most Lawless in US History
t3_k1xpzf	Jemima Lewis: The attempt to censor Jordan Peterson shows the intolerance of the social justice generation
t3_k2asmy	Arizona State Legislature to Hold Public Hearing on Election Integrity on Monday, Nov. 30
t3_k1z0qg	A few days ago Johns Hopkins published a study saying corona is nbd. They then deleted it. Read it here in its entirety
t3_k2grub	Iran Tells UN of 'Serious Indications' Israel Killed Scientist
t3_k24wiy	Johns Hopkins Study Saying COVID-19 Has 'Relatively No Effect on Deaths' in U.S. Deleted After Publication
t3_k212ut	Wisconsin voters file lawsuit to dismiss election results
t3_k2c7ch	"'Cover Up': Trump Lawyers React After Third Circuit Rejects PA Lawsuit -- ""Charges of unfairness are serious,"" Judge Stephanos Bibas wrote in his 21-page opinion on Friday. ""But calling an election unfair does not make it so."" Jenna Ellis responds: ""On to SCOTUS!"""
t3_k21gzf	Come the Grinches | If you think governors were tough on Thanksgiving gatherings, just wait for what they impose for Christmas.
t3_k24m97	Trump says Biden can only enter the White House as president if he can 'prove' his 'ridiculous 80M votes' were NOT 'obtained by fraud' as he appears to row back peaceful transition claims
t3_k35n1v	Lionel Shriver: We (UK) need a dose of vaccine realism
t3_k215ut	Pope Francis accuses lockdown protesters of turning 'personal freedom' into an 'ideology'
t3_k27ftu	Chinese State Media Feels Biden's Personnel Picks 'Good For China,' 'Softer' Than Trump
t3_k24hd4	"The Great Reset: If Only It Were Just a Conspiracy -- The 'Great Reset' masterminded by the Davos ""World Economic Forum"" is just corporatism by another name."
t3_k3501g	If even Eton falls to the woke, we might as well give up on education
t3_k36n6f	Beijing Biden to ‘cooperate with China’ and offer ‘more stable approach’ to Trump trade war
t3_k229fx	Socialism Leads to Suffering, Starvation and Poverty
t3_k258jp	Chief diversity officer: ‘First Amendment “excuse” is out’ regarding offensive speech
t3_k20xt2	The Electoral College Works Against Fraud -- What do we need to do? Answer: Let the process play out.
t3_k1zbdc	Florida Gov. Ron DeSantis Extends Order Suspending Mask Enforcement
t3_k2ciqc	The Class of 2020 Looks for Work
t3_k304ni	A New Pharaoh that Does not Know Joseph (What happens with all the pandemic laws once the pandemic is done)
t3_k34577	The Supreme Court Rejected Unfair Coronavirus Restrictions on Houses of Worship. But The Fundamental Fight Isn't Going Away.
t3_k20umh	Michael Flynn Thanks 'Every Single Patriot Who Circled Me with Prayers'
t3_k2gs8h	Los Angeles County Officials Announce Three Week Stay-at-Home Order
t3_k26bji	'F**k Thanksgiving' -- Portland Antifa Attack BLM-Supporting Grocery, War Memorial
t3_k1q44y	Recently Pardoned Turkey Found Dead After Claiming To Have Dirt On Hillary Clinton
t3_k2465g	Despite push from progressives, Biden unlikely to offer Sanders and Warren jobs
t3_k34w5k	How Biden Plans on Rewarding Cindy McCain for Her Endorsement
t3_k34bly	Carole Cadwalladr should now return her Orwell Prize
t3_k20zfg	Audit: Michigan May Have Paid Billions in 'Fraudulent' Jobless Claims; Gretchen Whitmer Administration Hit with 'Kickback' Allegations
t3_k28fq7	New affidavit notes 'historically strange' surge in incomplete Nevada voter registrations
t3_k307bs	On CIA's hacking operations in Frankfurt [2017, but relevant to server stories]
t3_k21mjx	Not Only Was Dominion Prone to Attack from China and Iran – It Was Also Connected to Pro-Obama Entity Known as ACORN
t3_k34w5b	Alamo Becomes Symbol for San Antonians Concerned Over Mayor's New Curfew
t3_k34ahh	Evidence Denial Is a Patently Absurd Media 'Stunt'
t3_k1ydx0	National Math and Reading Tests Postponed to 2022 – They Want to Hide How Much Students Have Fallen Due To Draconian COVID Rules
t3_k1qtwn	Biden breaks Obama’s record for lowest number of counties won
t3_k34kpq	Report: GOP could control House in 2022
t3_j9346j	/r/Conservative Official Political Discord
t3_k409j1	Report: Nike, Coke, other companies lobbying against bill that would ban goods made with slave labor of Uighurs in Xinjiang
t3_k43sa6	Arizona certifies Biden as winner over Trump team’s objections
t3_k41eey	Poll: Most People, Even Ethnic Minorities, Believe BLM Made Racial Tensions WORSE
t3_k3vkvs	Media Say Biden’s Female-Led Comms Team Is A First. It’s What Trump Has Now
t3_k3tm6t	Kamala Harris is slammed for pleading for people to help small businesses just months after she asked for donations to bail out jailed rioters who 'burned and looted' stores
t3_k41jnu	It’s Time To Dramatically Increase the Penalty for Election Fraud
t3_k3x365	Police: Armed robbery suspect fatally shot by customer with carry permit in Northeast Philadelphia
t3_k3x9rl	Buffalo Restaurant Puts Up ‘Walmart’ Sign to Protest Cuomo Restrictions
t3_k47gtt	Wisconsin Becomes Last Contested State to Confirm Biden Won
t3_k3zh2l	L.A. Health Official: Not Wearing A Mask Is ‘An Act Of Domestic Terrorism, Should Be Treated Like One’
t3_k3t289	Trump: 'We Don't Have Freedom of the Press in This Country -- We Have Suppression by the Press'
t3_k3vnsv	Stuck In Online Schooling, U.S. Kids Are Failing More Classes Than Ever And Will Never Recover
t3_k3y7zq	"""They’ll freeze them out"": Democrats fear Senate Republicans will block Biden’s judges"
t3_k3xxlv	Neera Tanden Deletes 1100 Tweets Criticizing GOP Leaders In Anticipation Of Tight Confirmation Battle -- Biden’s pick for Director of the OMB is frantically deleting old tweets ahead of a close confirmation vote requiring GOP senators’ support.
t3_k3tk8h	‘We’re Not Backing Down’: Staten Island Pub Declares Itself ‘Autonomous Zone’ In Defiance Of Cuomo
t3_k3m1oh	Time's Up charities set up by celebrities as part of Me Too movement spent $1.4m on salaries, $157k on conferences at luxury resorts and and just $312k helping victims of sexual harassment
t3_k3vep0	A few days ago Johns Hopkins published a study saying corona is nbd. They then deleted it. Read it here in its entirety.
t3_k42fdp	Dominion Representative for Fulton County Was Kamala Harris' Presidential Campaign Photographer
t3_k3z7u8	Sidney Powell files lawsuit claiming foreign interests targeted Dominion Voting Systems
t3_k43t65	Ted Cruz Hammers Alyssa Milano On Coronavirus Aid: ‘Every Senate Dem Voted to Block Relief’
t3_k3vtbv	Democrats’ Thin House Majority Could Get Smaller Depending On Supreme Court Ruling In Redistricting Case
t3_k3xpkf	Officials Confirm That Georgia Recount In Fulton County Delayed By Dominion Server Crash - Local Witness Allege That Someone REMOVED The Server!
t3_k433uk	Hall Of Fame QB Says He's Had It With Political Posturing In The NFL
t3_k407u9	BIZARRE: Georgia Govt Lawyers Defended Dominion's 'Trade Secrets' to Stop Forensic Analysis of Machines/Software - The National Pulse
t3_k42hyv	Judge Reapproves Emergency Order Blocking Georgia From Wiping or Resetting Voting Machines
t3_k3yzgu	Pennsylvania Bombshell: Biden 99.4% vs. Trump 0.6%
t3_k3x72z	Forbes Shreds Democrats’ Student Debt Forgiveness Push: Makes ‘Mockery Of People Who’ve Played By The Rules’
t3_k3wwfu	Karl Marx’s Shameful Life Repudiates His Evil Ideology -- The man who pretended to speak for the oppressed participated in oppression of the poor and his own family. It’s yet another repudiation of his work on its 100th anniversary.
t3_k3za8f	CNN Is Already Spreading Fear About Christmas: 'We Just Can't Do' It
t3_k44s2s	White House Theme for Christmas is 'America the Beautiful'
t3_k3xz7l	How Democrats Plan To Control New York Forever -- Democrats want to use illegal aliens and prisoners to determine legislative districts, as well as boxing out those who oppose them.
t3_k3yutd	Kurt Schlichter: Liberals Want You Demoralized, So Don’t Be -- We’re in a fight. Fix your bayonets and follow me over the top.
t3_k44jz0	Joe Biden Reportedly Working With Teachers Union That Opposes Charter Schools
t3_k3tinh	Obama Scolds Hispanic Trump Voters for Not Buying Liberal Lies
t3_k3m2o9	Trump tells Biden to 'get well soon' after he fractured his ankle while playing with his German Shepherd Major and his doctor revealed he would need a walking boot for several weeks
t3_k3vztk	Frightening Rise In Anti-Semitism Blamed On The Jews
t3_k3zdri	Lt. Gen. Michael Flynn: 'I Don't Believe the Country Will Accept Vice President Biden as the Next President'
t3_k46mmp	Never Trumper Rick Wilson demands humiliation, incarceration for top Republicans who backed Trump
t3_k41ss5	28 Shot, 7 Killed, over Weekend in Mayor Lightfoot's Chicago
t3_k3zexv	National Review is done with “Trump’s Disgraceful Endgame”
t3_k3wsh3	Why Millions Don't Believe Trump Lost
t3_k44ev4	REPORT: Coca-Cola, Nike Push Back On Legislation That Would Crack Down On Forced Labor In China
t3_k3xry1	Governor Newsom Appoints Bill Nye The Science Guy Head Of Coronavirus Task Force
t3_k44grt	Judge orders Georgia officials not to 'erase' data from Dominion voting machines in 3 counties
t3_k49jq3	MSNBC viewers lash out at Andrea Mitchell and demand she retire over comments​ critical of Joe Biden
t3_k45vr5	Iowa board certifies 6-vote Republican win in US House race
t3_k3ysps	Newt Gingrich: America’s Future Depends on Outcome of Georgia’s Senate Races
t3_k48ql0	Biden All-Female Communications Team Won't Tell Nation What's Wrong, Nation Should Already Know
t3_k48iyh	Pennsylvania House GOP Leaders: House Won't Return to Session this Year
t3_k4053x	New Jersey bill would mandate school lessons on racism and social justice
t3_k3xii7	VIDEO: Dominion Voting Systems Provide ‘Portal’ to Manipulate Data
t3_k44f7n	In National Survey Of Favorite Foods, Lukewarm Bowl Of Porridge Wins 80 Million Votes
t3_k49j80	Sidney Powell Lawsuit Claims Potential Election Fraud In Edison County, Michigan
t3_k3xj8e	"Protesters target home of Oregon OSHA inspector who fined gym that defied closure order. ""There were no problems, no issues,"". ""They stayed on the sidewalks and they stayed off private property."""
t3_k3t391	More intolerance from the people who preach tolerance. Leftist groups define diversity as agreeing with them. They do not tolerate dissent and will destroy your reputation if they can get away it.
t3_k49gqt	Poll Challenger, Dominion Contractor Say Voting Machines in Detroit Were Connected to Internet
t3_k48kxz	Rand Paul After Fauci’s Latest Comments: He Owes Apology To ‘Every Single Parent And School-Age Child In America’
t3_k45b9x	Crowd Gasps After AZ Witness Reveals How Easy it is to Hack Dominion Voting Machines, “Your Vote is Not as Secure as Your Venmo Account” (VIDEO)
t3_k41vhm	McDonald's accused of cultural appropriation over jerk chicken burger
t3_k3xx78	"Brazil's Bolsonaro Says Aware of Fraud in US Presidential Election. “You need to have a more reliable way to vote and the count has to be public."""
t3_k3z47b	Nearly One Third of Small Businesses in New York and New Jersey Shuttered Since January: Report
t3_k3z1n7	Hypocrisy Much, Kamala? One Tweet Sucks up to Businesses; the Other Raises Money for Rioters Who Destroyed Them
t3_k3fhy2	Brett Favre: Sports Fans Don't Want Political Messaging At Games
t3_k4ah28	CA-25: Smith (D) concedes race, Garcia (R) declares himself victor
t3_k4040o	BIZARRE: Georgia Govt Lawyers Defended Dominion's 'Trade Secrets' to Stop Forensic Analysis of Machines/Software - The National Pulse
t3_k3z5vm	Post-George Floyd, a Wave of ‘Anti-Racist’ Teaching Sweeps K-12 Schools Targeting ‘Whiteness’ - American Greatness
t3_k3z9v1	Kemp to Trump: Georgia law blocks him from ‘interfering’ with elections
t3_k3weww	New Republican Congresswomen: GOP Finally Preparing To Fight, Win
t3_k4a8xm	Rand Paul After Fauci’s Latest Comments: He Owes Apology To ‘Every Single Parent And School-Age Child In America’
t3_k3l0u9	Hits you right in the truth
t3_k492bt	Justin Trudeau breaks promise not to tax Netflix in new budget bill. Nobody is shocked.
t3_k3m96y	American billionaires have raked in more than $1trillion in combined income since the pandemic
t3_k47x6d	Chinese Sociologist: We’ll Soon Surpass U.S. ‘U.S. Will Not Survive,’ We’ll ‘Drive U.S. To Its Death’
t3_k3vjm4	It Is Not ‘Humane’ For The Atlantic To Sympathize With Killing Babies With Down Syndrome, Like My Little Sister -- Atlantic writer Sarah Zhang uses a rhetorical trick to create sympathy and understanding for eugenics and a modern-day genocide.
t3_k47rrl	Trump supporter who gave $2.5m to fight election fraud wants money back
t3_k4ahnj	Christy Smith Concedes To Mike Garcia In LA County Congressional Race
